rating_workload,rating_content,rating_teaching,rating_grading,has_midterm,has_final,has_quiz,has_assignment,has_essay,has_project,has_attendance,has_reading,has_presentation,course_name,level,upvote_ratio,insturctor_rating,comment_content,comment_teaching,comment_workload,comment_grading
4,1,3,3,True,True,False,True,False,False,False,False,False,COMP4331,4000,,0,"COMP 4331 disappoints in content delivery. Rather than diving deeply into core data mining concepts (e.g., apriori, k-means, hierarchical clustering), it skims a broad range of topics superficially, leaving gaps in understanding.<br /><br />Exams span too many areas with no practice or past papers available, making revision tough especially for someone who it terrible at memorizing random things. Lecture notes are poorly designed: overly vague slides often require YouTube supplements to grasp basics, and many exam questions appear unrelated to the material covered.","Basically the instructor just read what the lecture notes says, at least for the first 3 lectures. ( I skipped all remaining lesson )","The workload is ok with only 3 assignments, they are not that difficult and can be done in around 3 hours",I kinda gave up this course half way and I got around 40% in both exam and midterm and my final grade is C.<br /><br />all assignment: around 90% total<br />midterm: 48.5/100<br />final: around 40%
5,2,2,2,True,True,False,True,False,False,False,False,False,COMP4331,4000,0.9,0,"This is the first 4000 level COMP course I take. And honestly, words cannot describe how disappointed I am to the content of this course. This was a 4000 level COMP course so I was expecting the course to be difficult. I was expecting a lot of math, going in depth into data mining algorithms, stuff like that. But this course shows me that the 4 is just a number.<br />There are a few problems with the course content. First of all, there&#039;s just too little content. I planned out my study schedule and I would skip lectures and study 3 hours for every course per week. This works for other courses. I would usually spend the full 3 hours every week and be able to catch up on the content. <br />But for this course, only one and a half hour is needed. The content is so little its only 1.5 credits worth. Which is ridiculous considering this is a 3 credit course.<br /><br />Second problem with this course is how little depth it has. I mean what he taught for each of the algorithms are just scratching the surface. I have taken COMP2211 and gotten A+. And basically the content of naiive bayes, mlp, cnn are taught in much less detail than COMP2211. I actually just recalled my knowledge from COMP2211 for the exams. I learned nothing new. I mean I actually don&#039;t know why he included rnn in the syllabus. It&#039;s actually funny because rnn is such a complex algorithm and bro just has one slide per gate (output gate, input gate), and each slides shows a graph and a formula. And doesn&#039;t explain anything. And then rnn was never in the exam. I mean what&#039;s the point of including rnn in the content then if you are not actually gonna teach it and test it.<br /><br />Another issue is with the slides. Some slides are literally incomprehensible. There&#039;s a slide on edge betweenness, talking about an algorithm that measures edge betweenness. To this day, I have no idea what that slide is talking about. AI was suggesting its the Brande&#039;s algorithm? But the word &quot;Brande&#039;s algorithm&quot; never appeared on the slides. And I have no idea what the slides is talking about whatsoever. I spent at least 5 hours on that slide I think and I gave up at the end. Guess what? It appeared in the exam. Awesome. And for reference its probably not because I am dumb because I got A in comp3711 just reading the slides.<br /><br />I have attached some slides as reference. Btw this is the first time I saw filler slides. Just some slides that are not relevant to the content (You can check the community slides). I just thought it was really funny.","Disclaimer: What I write here only comments on the slides. I have not even attended a full lecture of James Kwok so I would not comment on how he teach. (I was so bored I left the first lecture after half an hour in front of the whole class)<br />This is my third year in UST. And honestly I have seen a lot of professors. There are very passionate and helpful professors, those who handwrites their notes, and those whose teaching quality is questionable. But I have never doubted the professionalism of these professors. I thought that each professor must have been one of the top scholars in the world to be able to secure their spot as a professor in a world renowned university.<br />But from James Kwok&#039;s slides, I just don&#039;t see it. In the neural network related topics, I actually just doubted if he actually understood the topic himself. He either doesn&#039;t know what he is doing, or he just don&#039;t care about teaching so much he made such crap slides. I believe the reason would be the latter? But the the slides for the other topics are better. So I don&#039;t know what&#039;s going on. He literally has so little content in his course. If he actually go in depth to teach any of the topics, he could easily double the content he has in this course and make it a normal comp course workload. <br />if you compare the neural network slides to the comp2211 neural network slides, you would realise comp2211 probably has around 3-4 times the content of this course. I thought the other topics like decision tree, hierachical clustering, association analysis slides are better (but also very brief ofc), but my friend said comp1942 taught them in way more detail. If this course is worse than a 1000 and 2000 level comp course, should it be 0 level instead? :) Comp0331 lol.","The homework is probably the only good thing about this course. There are 3 assignments in total, with the first and the second being coding assignments and the third one is just a written assignment. I think its not too challenging and you get to build something with pytorch so its good. The tutorials basically teaches you how to code your assignments and I heard that its ok. The content in the course is of course very manageable as well, since its only about 1.5 credits worth of content. <br /><br />I am just gonna make a conclusion for my long ass review. So basically I learned very little and left with a bad grade. DO NOT make the same mistake as me. I advice against anyone who wants to take comp4331 when James Kwok is teaching.","HAHAHAHAHAHA worst grading I have experienced. WOW!!!<br />The weightings are as follows:<br />Assignment 1	8%<br />Assignment 2	9%<br />Assignment 3	8%<br />Midterm	25%<br />Final	50%<br />Only mean and standard deviation of the exams are given. So here are the statistics:<br />Midterm exam: Mean-&gt;54.5 SD-&gt;22.3<br />Final exam: Mean-&gt;58.5 SD-&gt;19<br /><br />My mark: <br />Assignments nearly full<br />Midterm: 84 +1.3sd<br />Final 72.75 +0.75 sd<br />I mean overall I should be around +0.93sd right? If this was any good grade normal comp course, my mark would be between A- or A. 0.93sd should be top 18% in a normal distribution.<br />Guess what grade I got. B+. I GOT B+ SCORING +0.93SD. Wow. What can I say. Apparently I am 0.2 away from the A- cutoff. HAHAHA. Amazing.<br /><br />But after calming down and thinking about it once again. I think there&#039;s two reasons why I got B+. First one being that this course does not have a good grading. James Kwok maybe just doesn&#039;t give a lot of A range.<br />But the second reason is probably because the distribution is not normal. For those who are more sensitive towards math, a near 20 sd is not normal at all. In fact, I think the distribution would be close to a bimodal distribution. When going to paper checking, I saw many people who got 80 something in both midterm and final, and also a lot of them getting very low marks like 20 30 something. And this is just really weird to me. It also hints on the teaching quality of James Kwok. If a professor teaches well most student should get a mark close to mean. Just saying. <br /><br />The midterm was pretty easy. It&#039;s just telling you to run algorithms, no trick questions. Nothing testing your concepts or math. Honestly I thought the mean would be like 6X so I was shocked initially. The final exam tests way more in depth than what the slides is. It&#039;s almost like he is deliberately putting things that are not on the slides so that less people would know how to do the exam. I only survived because I have a very strong foundation in COMP2211 (Thanks Desmond)."
3,5,5,5,True,True,False,True,False,False,False,False,False,COMP4331,4000,0.2,11,"1. Intro: Explain the importance, source and types of data; What analysis could be performed on them (how to mine them); Applications.<br />2. Knowing your data: a. Statistical description of the data: from median to Q-Q plot; b. Proximity Measures: how similar/dissimilar your datum is compared to other data in different cases(i.e. types of data)<br />3. Data preprocessing: Data cleaning: Data integration; Data reduction (dimensionality reduction); Data transformation<br />4. Data warehouse: OLAP vs OLTP: from structure to operations; Data indexing<br />5. Introduction to classification: types of classification, measurement&nbsp;&nbsp;of data (confusion matrix, F-measures); Selection of Training and Testing sets<br />6. Decision tree: Algorithm, Purity and Overfitting handling<br />7. Bayesian classification: Assumptions, Formulas, Zero probability problem<br />8. K-nearest neighbour: Algorithm, Choosing the distance measure and K, limitation<br />9. Regression: Linear and Logistic regression: from formula to purpose; introduction to gradient decent<br />10. Artificial Neural Networks: From perceptron to propagation algorithm <br />11. Convolutional Neural Network: Structure and properties <br />12. Recurrent Neural Network: Introducing cell, attention mechanism to Neural Networks","Cecia is one of the best professor I&#039;ve ever met here in UST in my opinion. Aside from a well-designed teaching plan and a lecture with appropriate grammar, tone and fluency, the mode of delivery includes introducing the logic behind each of the formulas, and when/how/where to use them. Paired with concrete examples on each of the topics. Overall it provides a memorable experience in both understanding and application. <br /><br />On the flipped side, although TAs are usable along with the tutorial slides, I would rather read the transcript of the recordings if there&#039;s any. I will be surprised if those TAs could pass paper 4.","HW: Coding in python, 6+ hours per each PA even with pandas experience &amp; the help from chat-GPT.<br /><br />Revision:An additional 1.5h for each lecture for reviewing.<br /><br />Kind of gross if you ask me, but... your choice.<br /><br />P.S. I&#039;m not a CS student. If you have had enough of them taking over your territory, it is time to take revenge.<br />P.S.S. There&#039;s another review written by a different student regarding the same class, the information on that one is accurate while being more specific.","(LQ\Median\High\Me), rounded<br />Assignment * 3: 30%<br />pa1: (100\100\100\100)<br />pa2: (100\100\100\100)<br />pa3: (100\100\100\100)<br /><br />Midterm: 25%<br />(40\53\88\84)<br />Final: 45%<br />(44\56\80\71)<br /><br />Grade:&nbsp;&nbsp;A+"
4,5,4,4,True,True,False,True,False,False,False,False,False,COMP4331,4000,1.0,11,1.Knowing your data<br />2.Data Preprocessing<br />3.Data Warehousing and OLAP<br />4.Classification<br />- Decision Tree<br />-Bayesian classification<br />-Nearest Neighbor classifier<br />-Regression<br />-Artificial Neural Network<br />-Convolutional Neural Network<br />-Recurrent Neural Network<br />-Ensemble<br />5.Clustering<br />-Partitioning<br />-Hierachial<br />-Density based<br />6.Association Analysis,Cecia&#039;s teaching is ok.However recordings are also released for each lecture.<br />Cecia is willing to answer questions from students.,Not heavy workload<br />However I suggest to practice computationally extensive examples of the topics you have learned(For example:A Naiive Bayes classifier with two continuous attributes),Assignments-30%<br />Midterm-25%<br />Final-45%<br />There are three programming assignments:<br />PA1-Data preprocessing<br />PA2-Classification<br />PA3-Classification(Neural Network) &amp; Clustering<br />Since there are 150 submission attempts for each assignments all of the students will receive full marks for the assignments<br />Hence the exams are quite challenging.Challenging in the sense due to the extreme amount of calculations required.
4,4,4,5,True,True,False,True,False,False,False,False,False,COMP4331,4000,0.08,0,整個course無乜嘢背，主要係明白steps/algorithms。由於這個course比較簡單，上堂明到就得，不需花太多時間溫習。（其實是沒有什麼好溫習，因為沒有past paper或practice exercise。）,"prof. james kwok:<br />他教得很慢，但教得很清晰。他上堂喜歡 interact with students，他亦喜歡用生活例子做類比，所以都容易明，上他堂都不會太悶。<br />________________________________________<br /><br />TA: Mr. Zheng, Yimin + Mr. Jiang, Weisen + Mr. Yu, Runsheng<br />他們好helpful，覆email多數都好快！<br />改assignment方面，每個mistakes扣2分，所以個個都至少90幾分。",COMP courses而言好輕。得3份assignment（絕對唔係COMP2011/2012 programming assignment的難度/長度），prof 話expect我們4-5小時搞掂1份assignment，我無計過，不過感覺合理。<br />Assignment主要參考吓tutorial的 python code，如果你熟python，可能會更快完成assignment。（小弟係唔識python嘅！),"*************************<br />Here may be biased.<br />I admit that I do not have enough statistics to judge whether it is really a good grade semester. If you have more information, feel free to comment below.<br />*************************<br /><br />Statistics:<br />No statistics are officially released. Statistics can be seen in canvas in the beginning. It was disabled later. (i.e., we can&#039;t see the statistics.)<br />I remember the mean of the first 2 assignments are both higher than 99% (and no one gets below 94%), and the mean of the midterm is higher than 96%.<br />________________________________________<br /><br />考final exam前，估計mean54/55（請看上面statistics），咁即係 final 一試定生死啦！同埋我都有睇 prof.郭天佑 以前的 review (including https://ust.space/review/COMP4211) ，加上見d人咁勁，真心超驚爛grade。 <br />考緊final exam心諗，慘啦，好多題目都唔係好肯定，會唔會below mean㗎。結果⋯超好彩，估唔到自己攞到這個分數。<br />我當時諗，應該有A range啦，結果⋯一收到grade，完全喜出望外。<br />________________________________________<br /><br />For me:<br />Assignment(30%) 298/300<br />Midterm(25%) 100/100<br />Final Exam(45%) 95.5/100<br /><br />overall = 97.775%<br />grade = A+"
3,4,2,3,False,False,False,True,False,True,True,False,False,COMP4331,4000,0.5,0,"Course information<br /><br />Teaching Assistants<br /><br />Lifeng SHEN (office hour: Fri, 1:30-3pm)<br />Lawrence CHAN (office hour: Wed, 3:30-5pm)<br />Lecture Notes<br /><br />Introduction (printer-friendly: pdf)<br />data preprocessing (pdf)<br />classification<br />intrduction (pdf)<br />decision tree (pdf)<br />nearest-neighbor classification (pdf)<br />support vector machines (pdf)<br />artificial neural networks<br />introduction (pdf)<br />perceptron and multilayer perceptron (pdf)<br />computational graph (from CS231n, Stanford)<br />convolutional neural network (pdf), image processing basics (pdf)<br />clustering<br />k-means clustering (pdf)<br />hierarchical clustering (pdf)<br />network communities<br />association analysis<br />introduction (pdf)<br />Apriori algorithm (pdf)<br />miscellaneous<br />recommender systems<br />Tutorial materials<br /><br />T1: introduction to anaconda, jupyter and UG lab setup<br />T2: data pre-processing<br />T3: kaggle and basic python<br />T4: decision tree<br />T5: pytorch basics<br />T6: pytorch CNN<br />T7: sklearn, clustering (code), networkx (code)<br />T8: apriori algorithm (code)<br />T9: k-nearest neighbor (code)<br />T10: SVM (code)<br />Assignments<br /><br />assignment 1<br />mini-project (data.csv)<br />assignment 2<br />project (data)<br />Dec22, 11:59pm: Deadline to upload the report/code/model to Canvas<br />Dec23: Project presentations<br />Each group will have 15min (including Q&amp;A). The presentation schedule is here. If you have any change requests, please email (together with strong reasons) to the TA.<br />Attendance of all the group presentations is compulsory (and you have to switch on the webcam). Failure to do so will lead to a penalty of 10% on the project.<br />If you run out of time, focus the presentation on your additional analysis.<br />Dec23, 11:59pm: Each group should upload to Canvas the slides used during the presentation<br />Dec23, 11:59pm: Each student should upload the following to Canvas<br />your self-evaluation with (a) a brief description of your contribution in the r eport and presentation; (b) your percentage contribution to the whole project;<br />evaluation of the percentage contribution of each individual members in the group to the whole project (you only need to give the TA a number, no description is needed).<br />peer-evaluation for all the other groups. The form is here.<br />assignment 3","Well, for the teaching remember to open your camera and just listen him to read the ppt. nothing special",Workload is appropriate but all the content are irrelevant.,Worst.<br />All above mean B<br />No idea what happened. <br />probably others grade are great?
1,2,2,1,False,False,False,True,False,True,True,False,False,COMP4331,4000,1.0,0,"-Data Preprocessing<br />data summarization, cleaning, integration, transformation, reduction and discretization<br /><br />-Classification and Regression<br />decision trees, neural networks, Bayesian classification, rule-based classification, and various regression methods<br /><br />-Cluster Analysis<br />partitioning, hierarchical and density-based clustering algorithms, as well as outlier detection techniques<br /><br />-Association Analysis<br />popular frequent itemset mining algorithms","Prof Kwok focus on the algorithm on data mining, which is quite different from what I expect he will teach in the course. In fact, he only talks about the algorithm, and in his lectures he never talk about any coding which is related to data mining. However, in the assignment and project later, require advanced techniques which make me suffer when doing the assignments and projects. Although TA will talk about coding in tutorial section, it is not sufficient because there is just one hour per week and they just talked about very easy codes. when it come to assignments and projects, it still take tons of time for me to google and find out what code is useful.<br /><br />Unlike other comp course, it does not have lab session. I would prefer there is one though the workload will be more.&nbsp;&nbsp;The reason is lab session can help consolidate and make application what we learnt in the lecture and give more ideas when it comes to assignment and projects.","Workload is huge. As mentioned above, you need to find out what code is useful in your assignment and projects. You will not know what code you can use if you just attend the lecture even the tutorials. Project arrangement is also very bad. Group formation deadline is 30/11 this semester. He did not take into account that many students are having final in early to mid December. Assignment 3 is also due in mid December as well. As a result, in December, I needed to revise for my finals, do assignment 3 and group project which is a disaster. It is not understandable that why he did not set the deadline earlier and give students more time to do the project.",Three assignments: 30%<br />Mini Project: 20%<br />Group Project: 40%<br />Turn on webcam: 10%<br />Overall I got above mean and I got a B-.<br />Utterly bad Grading
