rating_workload,rating_content,rating_teaching,rating_grading,has_midterm,has_final,has_quiz,has_assignment,has_essay,has_project,has_attendance,has_reading,has_presentation,course_name,level,upvote_ratio,instructor_rating,comment_content,comment_teaching,comment_workload,comment_grading
5,4,5,5,True,True,False,True,False,False,False,False,False,COMP1022Q,1000,,11.0,,Dr Chan 好nice，好耐心答我問題。,接近0！<br />除lab7最尾10%，其他上lab可完成。,好grade！<br /><br />Statistics：<br /><br />lab 2 (the Moving Around Hong Kong lab)<br />Average (excluding zeros):&nbsp;&nbsp;99.3<br />Standard deviation:&nbsp;&nbsp;4.5<br />Maximum:&nbsp;&nbsp;100<br />Minimum (excluding zeros):&nbsp;&nbsp;20<br /><br />lab 4 (Shooting Game)<br />Average (excluding zeros):&nbsp;&nbsp;99.1<br />Standard deviation:&nbsp;&nbsp;12.1<br />Maximum:&nbsp;&nbsp;100<br />Minimum (excluding zeros):&nbsp;&nbsp;35<br /><br />lab 5 (Jigsaw Game)<br />Average (excluding zeros):&nbsp;&nbsp;97.6<br />Standard deviation:&nbsp;&nbsp;22.4<br />Maximum:&nbsp;&nbsp;100<br />Minimum (excluding zeros):&nbsp;&nbsp;15<br /><br />lab 7 (&quot;Escape the Monster&quot; Game)<br />Average (excluding zeros):&nbsp;&nbsp;97.0<br />Standard deviation:&nbsp;&nbsp;21.9<br />Maximum:&nbsp;&nbsp;100<br />Minimum (excluding zeros):&nbsp;&nbsp;25<br /><br />midterm exam<br />Average (excluding zeros):&nbsp;&nbsp;62.37<br />Standard deviation:&nbsp;&nbsp;24.22<br />Maximum:&nbsp;&nbsp;100<br />Minimum (excluding zeros):&nbsp;&nbsp;8<br /><br />final exam<br />Average (excluding zeros):&nbsp;&nbsp;48.0<br />Standard deviation:&nbsp;&nbsp;22.0<br />Maximum:&nbsp;&nbsp;100<br />Minimum (excluding zeros):&nbsp;&nbsp;2<br /><br />我：<br />lab 滿分<br />midterm +1.4 sd<br />final +1.3 sd<br />bonus 0.5 x 8 = 4<br />grade A+
5,5,5,4,True,True,False,True,False,False,False,False,False,COMP1022Q,1000,1.0,11.0,"Content is about basic VBA programming.&nbsp;&nbsp;It is very useful no matter what school you are in.&nbsp;&nbsp;As a business school student, I find VBA useful and applicable in my internships.&nbsp;&nbsp;Employers really care your computer skills and your way to handle data.&nbsp;&nbsp;Strongly encourage students to take it.","Gibson is a wonderful professor.&nbsp;&nbsp;Although it is a 9:30 class for my section, I seldom miss it. He explains all the things in a clear way.&nbsp;&nbsp;And he makes programming a funny way with his facial expressions and wordings.","Workload is low.&nbsp;&nbsp;All you need to do is to submit the 5 labs.&nbsp;&nbsp;The other labs you can choose to attend or not.&nbsp;&nbsp;No presentation, no project.&nbsp;&nbsp;Final and mid term are open book, so all you need to do is to understand the content and bring everything you need to the exams.&nbsp;&nbsp;No need to waste time copying cheatsheets.","There are 2 grading scheme.<br /><br />20% mid term<br />40% lab<br />40% final<br /><br />44% lab<br />56% final<br /><br />Your final score will automatically use the one which gives you a higher score.&nbsp;&nbsp;<br /><br />Lab is easy.&nbsp;&nbsp;Just attend all the lab sections then you can get almost 100%.&nbsp;&nbsp;For mid term and final, this semester the final is difficult.&nbsp;&nbsp;Gibson even said in the announcement that this is one of the most difficult finals throughout the years.&nbsp;&nbsp;Not sure if he wants to make this a more difficult course or this year is just an exception.<br /><br />Lab 100%<br />Mid term 81, mean 62.37, SD 24.22<br />Final 69, mean 48, SD 22<br /><br />Final grade A-"
5,5,5,5,True,True,False,False,False,False,False,False,False,COMP1022Q,1000,,11.0,The content can be divided into 2 parts. The first part is about some background information of excel and the second part is about VBA programming.,"Gibson creates a light-hearted atmosphere for the class but so how I think he is too fast during lessons when going through the powerpoints. And Gibson doesn&#039;t videotape his lessons, unlike those who attend the course in fall sem which got lecture videos, so it is better not to skip classes if you are not that good at computer stuff and there are chances for bonus marks lectures so try not to skip them.","Very low workload. Even if you don&#039;t attend the lecture, you can just read through the notes which is available on the website. The notes are easy to understand. The assignment can do it by yourself so you don&#039;t need to go to the lab session. In the lab section, TAs are willing to teach you or even give you the code for doing it.","There are 2 grading schemes:<br />Scheme 1: All in final<br />Final exam: 56%<br />Lab: 44%<br /><br />Scheme 2: Mid-term score included<br />Mid-term: 20%<br />Final: 40%<br />Lab: 40%<br /><br />Statistics:<br />Mid-term mean: 62.4/100<br />Mid-term SD: 24.2<br />Final mean: 48/100<br />Final SD: 22<br />Lab mean: &gt;95/100<br /><br />My score:<br />Lab: 100%<br />Mid-term: 62/100<br />Final: 75/100<br />Bonus Question(0.5%): 4 times, +2% <br /><br />A with scheme 1, 88%<br /><br />I would say I got lucky, to be honest."
5,5,5,5,True,True,False,True,False,False,False,False,False,COMP1022Q,1000,,11.0,First three weeks are basic formula of excel sheet and the remaining are VBA coding.,Gibson&#039;s lecture are interesting and easy to understand the content. The content are very easy as Gibson will have many example to let us understand it.,Most of the lab works are very easy and most parts are guided by TA. 2 Lectures which 50 mins in each lecture&nbsp;&nbsp;and 3 hours lab session.,"Good grading. Exam are open book/notes. Lab 40% Midterm 20% and Final 40%. If final exam result are very high, result of mid term can be ignored."
5,4,5,3,True,True,False,True,False,False,False,False,False,COMP1022Q,1000,,11.0,"The course mainly teaches Excel VBA programming, covering an overview of Excel and cells functions, VBA logic, loops, shapes and operations, as well as more advanced stuff like arrays, recursion and object, which are all rarely used in Excel VBA due to the availability of cells as object instances. 2D arrays are also out of syllabus, which comes to me as a joke, since both the other introductory courses have this programming logic.<br /><br />I would say this course is useful for office and work applications, but pretty much useless for learning actual programming concepts or as a prerequisite to the much higher-class COMP2011.","I absolutely adore Gibson.<br /><br />His lessons are really fun, and he can always take the seemingly complicated codes and dumb it down to a level that even junior secondary students have no trouble understanding the codes. A very good lecturer for absolute beginners in programming.<br /><br />He is also pretty knowledgeable in other programming languages, and is able to present comparison of VBA to other programming languages to help students determine which programming introduction course is the most suitable for them.","There is a lab each week, while you get some weeks off, so there are 8 labs in total. There is indeed some work involved, but it isn&#039;t really that hard, especially if you go to the assigned lab session.<br /><br />Both exams are, as always, open book, and thus you have no need of trying to memorize the syntax and function names and details; a throughout understanding of the logic is sufficient.","This course has traditionally been one of the best graded courses at HKUST, as well as the easiest among the 3 1000-level programming introduction choices. However, this semester has subverted all expectations, and I hereby announce that COMP1022Q has officially turned from an easy, good grade course into a course with terrible grading and difficulty.<br /><br />As always, both exams are open book exams.<br /><br />Participation bonus:<br />The instructor asks a question in class related to the lecture content, and the person who answers the question correctly gets 0.5% bonus each time, so my advice is to be proactive and seize the chance to answer, because Gibson allows that and he takes quite a long time to randomly pick a student.<br /><br />There are 2 grading schemes:<br />Scheme 1: All in final<br />Final exam: 56%<br />Lab: 44%<br /><br />Scheme 2: Mid-term score included<br />Mid-term: 20%<br />Final: 40%<br />Lab: 40$<br /><br />Statistics:<br />Mid-term mean: 62.4/100<br />Mid-term SD: 24.2<br />Final mean: 47.5/100<br />Final SD: 22<br />Lab mean: &gt;95/100<br /><br />My score:<br />Lab: 100%<br />Mid-term: 82/100<br />Final: 97/100<br />Participation bonus: 3 times, +1.5%<br /><br />A+ with scheme 2, 99.8%<br /><br />I would say I got lucky, to be honest."
5,3,4,5,True,True,False,False,False,False,False,False,False,COMP1022Q,1000,,11.0,"This course teaches you some of the common formulas you can use in Excel, which will be useful for your future career. You can also learn how to execute Excel through VBA, a bit like programming, you can control what you want, and Excel can run it automatically.","His speech is very interesting, in fact you will not be bored when you are in class. His speech always makes us laugh, always ask questions (if you answer correctly, it will be marked), the communication between students and professors is very good. His voice will definitely attract your attention and the learning atmosphere is also very good.","Almost zero ZERO workload. There are several labs that can count your final grades. The instructor will show you step by step in the lab section, and you can complete the experiment as you wish.","The score is not very good, maybe someone can still get a high score.<br />One might think that this is a good scoring course, and in order to make as much effort as possible, this makes the boundaries of the results so high, I think it is also one of the competitive courses."
5,5,5,5,True,True,False,False,False,False,False,False,False,COMP1022Q,1000,,11.0,"The course is mainly about excel formula and VBA.<br />The first few weeks are about excel and are very easy.<br />But after the midterm, the things are all vba and you better attend the lessons",The professor is humorous and his teaching is good<br />He can express the content clearly in every lessons,The workload is very low .,"40% LABs<br />20% Midterms<br />40% Finals<br />or<br />40% LABs<br />0% Midterms<br />60% Finals<br />good grade<br /><br />Grading is very generous. If you go to all the lab sessions and follow the instruction, you will get almost full marks for the lab <br /><br />midterm and final is easy to get above 85% if u had go over all the content especially the vba part"
5,5,5,5,True,True,False,True,False,False,False,False,True,COMP1022Q,1000,,11.0,"Basic and common excel formulas,<br />Basic excel VBA programs<br /><br />Taught excel formulas are commonly used in other courses for projects/homework, very useful<br /><br />The VBA part gives you a taste of programming",Extremely enthusiastic and articulate professor<br />will also ask questions in class that helps you focus,"two 50minutes lectures and a lab session each week, slightly longer hours than other courses, but has no hw<br />Lab projects are completed in lab sessions<br />Mid terms/ finals are open book exams<br />Basically go over the notes before exams and you will be fine","Graded with labs, mid terms and finals<br />Only assignment will be lab projects, but can be finished easily if you attend the lab sessions"
5,5,4,5,True,True,False,True,False,False,False,False,False,COMP1022Q,1000,,11.0,The course is mainly about excel formula and VBA. The content is not that difficult even that I have never learned anything about programming. I skipped a lot of lectures but go to every lab session and get a quite good grade.,David taught the class in an entertaining way. The lecture is quite interesting but the content is easy so I just read the ppt by myself. Lab session just needs to copy everything the tutor did and ask for help if you have any difficulties and you can almost full mark.,Assignment needs to submit every two weeks but can be finished easily in the lab session. there is almost no workload at all,"The score of assignments, mid-term and final are quite high but they are relatively easy. Enough preparation should ensure a good grade easily."
5,5,5,5,True,True,False,True,False,False,False,False,False,COMP1022Q,1000,,11.0,"Learn how to use Excel in first few weeks.&nbsp;&nbsp;(It is easy if you know how to use a computer.)<br />Learn VBA to make games, pictures.&nbsp;&nbsp;(A little bit challenging for me.&nbsp;&nbsp;It is important to ask when you don&#039;t understand.)<br />Have video recordings.<br /><br />頭幾個星期教嘅野好簡單，只要你識用電腦就會識。學過ICT嘅會開心小小，教返vlookup果啲。<br />之後重點教VBA，唔叫好難，但你個腦要清醒。<br />呢個sem有錄片，可以上網睇返，不過幾星期先upload一次。",He is the best teacher.<br /><br />佢唔單止風趣幽默，仲教得好好。<br />呢個sem嘅 TA都好好。,8 labs (4 labs counting marks) [40%]<br />Midterm [20%] <br />Final [40%]<br /><br />Midterm and Final are open book.,Have bonus lecture marks. (at most 5 marks) It is add to the final mark.&nbsp;&nbsp;0.5% extra mark for one correctly answered question in the lecture.&nbsp;&nbsp;Very good grade.
4,5,4,5,True,True,False,True,False,False,False,False,False,COMP1022Q,1000,,11.0,"better attend lab section because you can finish the homework easily with a high chance of having a full mark, most of the content can be studied by yourself but of course it is faster to understand the content if you do not miss any lessons . overall an easy course , you can learn yourself even you skip many lessons. My friend studied at fall sem and got a easy A/A+ and said exams are very easy but i dont know why this course becomes more difficult in spring sem. But still get A- after days of studying.",,,
5,5,5,5,True,True,False,True,False,False,False,False,False,COMP1022Q,1000,,11.0,前面教你點用excel (formula in cells)<br />之後開始學簡單vba language<br />完全冇接觸過既人都可以輕易掌握<br />Lab可以在家自己跟住instruction做晒 唔使上lab section<br />對自己有自信既同學甚至可以走lecture<br />因為親愛的David會將lecture video upload上網,兩位instructor都好好人<br />上堂會問問題幫大家溫故知新<br />落堂都可以問佢地問題,輕輕鬆鬆就呃到個A+<br />唔使諗喇 讀啦ching,Hand in lab全部滿分唔難 跟住marking scheme做就可以<br />mid term考衰左仲可以唔計分 final考返好就可以<br />做卷記得小心咁做 題目唔難 基本上都輕鬆A以上<br />仲未計上堂答對問題會送0.5%分<br />呢科想爛grade都難..
4,5,5,5,True,True,False,True,False,False,False,False,False,COMP1022Q,1000,,11.0,Content is about basic excel formulas and also excel programming called VBA. It does not need former knowledge in programming as the course will start from the basics and slowly progress to indepth knowledge of the course.,David is a fun character always making jokes and full of energy while teaching. The Power points are clear and the teaching are easy to follow. All teaching materials can be accessed from the comp1022q website.,"Workload is not high having 8 labs but only 4 is graded. There will be teaching assistants during the lab period. Attending all lab sessions is encourage so you can experience building your own program and learn from the mistakes you made in the program. If the lab is non-graded, you don&#039;t need to attend the lab session. Steps for completing the programs will be included with little empty components that you need to fill in yourself. Teaching assistants are not allowed to teach these parts so you need to figure out the answer yourself. It may sometimes be time consuming to think of the correct code to put in the program.<br />Overall the workload the little as mostly it is copy and paste. Not much to prepare for the exams, just remember to print out all necessary notes to bring into the exam hall.","The grading is really good. There will be a mid term and final, assignments will also be included in the grading. <br />You are allowed to bring books and notes into the exam, so you can find the answers from it. Although the exams are open book, you still need to understand the usage of different formulas of the program and the logic flow of different programs to get good grades. Just be careful and study all lab programs and highlight the important formulas in the notes so you can find the necessary information in the notes."
5,5,5,5,True,True,False,True,False,False,False,False,False,COMP1022Q,1000,,11.0,First few lectures are about some basic excel keys and usage. <br />Then covers about the simple functions in excel. Finally some VBA programming stuff. <br /><br />**真心好簡單**,"David teaches very well in a manner that everyone stays awake in his class. He may ask some super easy questions to you and 0.5% bonus marks will be added if you attempted the question correctly. <br /><br />The lab part is quite flexible, you can leave the lab if you finish it earlier. **( You can even not go to the lab if that&#039;s a not a hand-in&nbsp;&nbsp;work) Just follow this guiding website instruction and you will save your time, the TA can be ignored.<br /><br />**如果唔想上lecture可以上網看lecture video**",Only labwork needs your brain.,Add 0.5% bonus every question you answered. <br /><br />1st calculation method<br />lab (44%)<br />final (56%)<br /><br />2nd calculation method<br />lab (40%)<br />midterm (20%)<br />final (40%)<br /><br />Super easy to get high marks without preparation <br />ALL are open book exam.
5,4,5,5,True,True,False,True,False,False,False,False,False,COMP1022Q,1000,,11.0,"Lecture notes幾完整, 上堂會cover到9成內容,一開始會教下普通Excel function先到vba,唔上灶可以自己睇ppt","上堂氣氛幾好,david會準備啲問題考人,答問題有0.5%bonus,平時肯答同學問題","有去lab assignment基本full,前後總共4份",Assignment俾埋marking scheme你對<br />assignment&nbsp;&nbsp;100/100<br />mid term&nbsp;&nbsp;&nbsp;&nbsp;&nbsp;&nbsp;&nbsp;90+<br />final&nbsp;&nbsp;&nbsp;&nbsp;&nbsp;&nbsp;&nbsp;&nbsp;&nbsp;&nbsp;&nbsp;&nbsp;&nbsp;&nbsp;90+<br />grade&nbsp;&nbsp;A+
5,5,5,5,True,True,False,True,False,False,False,False,False,COMP1022Q,1000,,11.0,Quite interesting. Recommanded to reg in Spring Sem as there are many people already learnt about the course content in Fall Sem so Spring Sem will be more good grade.,I dont know as i escape all the lesson. No attendance will be taken so I did not attend the lesson much.,There is a lab in about twice a week but it is quite easy.,Exams and Mid terms are all open book so it is not that hard to get a good mark in those exams.
5,5,3,1,True,True,False,False,False,False,False,False,False,COMP1022Q,1000,0.0,,simple vba stuff<br />you know excel then you win<br />you don&#039;t know excel but you work hard then you win <br />you don&#039;t know excel and you don&#039;t work hard then you will get fucked,"boring , so fucking boring, that&#039;s why i didn&#039;t attend the class since the 2nd day of the class","light, very light. <br />if you get friends or sources, it won&#039;t be a problem.","damn it<br />much worse than expected<br />i got 86.7% in total, it turns out to be B only......"
4,4,5,5,True,True,False,True,False,False,False,False,False,COMP1022Q,1000,,11.0,,"David is a very nice and enthusiastic professor, you will never feel bored in his lesson.","Only have to hand in lab work, no other assignment have to be done. There are only two lessons with less than 1 hour lesson&#039;s time.","There are two grading systems in this course, depending on what&#039;s your result on mid-term, final and lab, and automatically choose a system which give a better result. Also if you answer to David&#039;s question correctly during the lesson, 0.5 points will be rewarded to your final result"
4,4,3,4,True,True,False,True,False,False,False,False,False,COMP1022Q,1000,,11.0,Simple coding which is not that Hard in my opinion,"Just reading the Powerpoint with only a little thinking<br /><br />During the lesson, Mr. Rossiter would ask somebody to answer a simple question while Cecia would ask for volunteers. These question would count for a bonus mark towards your final grade, although it is only 0.5%.",There is no homework after lessons. The only workload is some hand-in lab maybe 3-4 in a semester.,The mean is quite high which means you must be very careful in answering the question. I got 90/100 in final and scored an A.
5,5,4,4,True,True,False,True,False,False,False,False,False,COMP1022Q,1000,,11.0,"First 3 weeks: Basics of Excel<br />Weeks after: Programming with VBA<br /><br />Content is pretty easy to understand, even for people with no programming background. It is a good introductory course to give basic programming knowledge.","Teaching by David was pretty good, he introduces the basic concepts well and makes the lectures more interactive by asking questions (giving bonus points) and checks our understanding through these questions. It is not necessary to attend his lectures but it is better for easier understanding of content. He can be a bit harsh with his words sometimes if you don&#039;t answer correctly but overall teaching is good.","Light workload, just 4 labs as assignments (about once in two weeks). Both midterm and final is open book so no need to spend time memorizing anything. Best way to prepare for the exams is to check your logic by doing practice questions.",Grading is a bit tough seeing that it is an easy course so everyone is able to do really well which brings up the mean. You have to be very careful in midterm and final to be able to get a good grade.<br /><br />Grading is as follows:<br />Labs-40%<br />Midterm-20%<br />Final-40%<br />Bonus lecture marks<br /><br />Easy to get full 40% for labs if you just attend the lab session because they show all the steps. Or you can try out the lab beforehand to see if you can do it on your own and not have to attend the lab session at all.
5,5,5,5,True,True,False,True,False,False,False,False,False,COMP1022Q,1000,0.5,11.0,The content can be divided into 2 parts. The first part is about some background information of excel and the second part is about VBA programming.,Gibson&#039;s lesson is interesting and provides various example the ensure that you understand the topic. There maybe 1/2 bonus question at the end of the lecture.,"Very low workload. Even if you don&#039;t attend the lecture, you can just read through the notes which is available in the website. The notes are easy to understand. The assignment can be do it by yourself so you don&#039;t need to go to lab session. In the lab section, TA are willing to teach you or even give you the code for doing it.",Assignment have guideline so it is easy to get 100 mark.<br />Final mean is around 60 marks.<br />The grading of this course is quite good comparing to other common core courses.
