rating_workload,rating_content,rating_teaching,rating_grading,has_midterm,has_final,has_quiz,has_assignment,has_essay,has_project,has_attendance,has_reading,has_presentation,course_name,level,upvote_ratio,instructor_rating,comment_content,comment_teaching,comment_workload,comment_grading
5,5,4,5,True,True,False,False,False,False,False,False,False,COMP1022Q,1000,0.0,,no attendance requirement and it provide zoom for the lesson. It taught the basic logic of python.,The powerpoint content about 80% can be self-reading and understand. The professor is nice and will answer your question after class.,only&nbsp;&nbsp;have 3 lab as homework<br />one midterm and final exam,"The exam was not required to write a complete code, it required to fill in the bank and find out the incorrect place.<br />It has two weighting mode:<br />45%lab and 55%final exam or<br />30%lab and 25% mid-term and 45%final exam, it count the highest one"
5,5,5,5,False,True,True,True,False,False,False,False,False,COMP1022Q,1000,,11.0,"It consists of a paper format of quiz and assignments ,which require submission of coded excel file, and final exam .For assignment, you just need to follow the steps written on the password protected website specialized for this course then you will get exactly expected results.<br />The content was very exciting and every homework for excel coding was very practical and fun to do. i still remember an assignment using excel coding to play the piano. As this was my first coding experience, it gave me the feeling that coding is actually amazing.",The mode of delivery was great the teacher&#039;s voice is calm and she focuses on understanding the mechanisms behind the code slowly so that listeners feel easy to get the concept. Teaching assistants were helpful if asking questions.,Workload is not high as assignments only need to follow the guidelines anf submit the results then get good marks.But make sure you have loads of practice of hard codes before final exam,"It was my first class that i got A- so if you do it with passion then high results could be obtained reletively easily. Final exam was hard, especially the last question which may require deep understaning of every concept and repeated practice."
5,5,5,5,True,False,False,True,False,False,False,False,False,COMP1022Q,1000,,11.0,"Basic uses of Excel and coding with VBA.<br />The excel part is very useful. Using VBA can also facilitate data handling in excel. However, for coding, it is not useful as other popular programming languages like Python and C++. For SENG students, I recommend to enroll in COMP1021 instead.",Very good.,"Very light.<br />Every week a lab, but not all lab are need to be graded (only 4 out of 8).","Excellent (for this semester).<br />Due to social unrest, the final exam is cancelled. Only the 4 labs and midterm exam is used to calculate the overall score. Since the midterm exam is very easy, it is easy to get 95+ in overall score (which must be in A range)."
5,5,5,5,True,True,False,True,False,False,False,False,False,COMP1022Q,1000,,11.0,"The content is pretty easy to understand. First part is the basic of the usage of excel, then second part is dive into the topic of VBA.","The teaching is lively and David explain the topics is easy to understand. If you have any question in the class, you can find him after class, he will stay there for some minute to answer student questions.","The labs are not too bad, the TA in the labs are very helpful, some of the labs even guide you through the tasks, almost copy and paste.","Exams are open book and notes, the questions are straight forward, not too hard."
5,5,5,5,True,True,False,False,False,True,False,False,False,COMP1022Q,1000,,11.0,開頭會先教Excel既基本野<br />姐係formula個堆<br />如果平時有用開/中學讀ICT應該無難度<br />之後就會正式入VBA教你識program<br />會用到唔同concept<br />例如loop if等等<br />基本上熟習左就唔難,Dr. CHAN 教得幾好<br />都好詳細解釋每一樣concept<br />同時會開Excel VBA親自示範功能<br />比我地更加明白<br />無咩好講<br /><br />Lab變左做consultation<br />自己睇片明既話就唔洗去<br />有source就仲好,唔重<br />Lab可能要多少少時間做<br />考試前清concept<br />記一記D code點用就ok,4個計分Lab 每個100分<br />Lab: 100/100 (10% X 4)<br />Mean通常都90幾<br />Midterm: 80/100 (20%)<br />Open Book Exam<br />Mean: 76.1 SD: 16.9<br />Final: 71.67/100 (40%)<br />Open Book Exam<br />Mean: 51.2 SD: 14.8<br />Overall: 84.67%<br />Grade: A<br />84都A真係好靚grade<br />可惜今個sem係最後一次開呢個course lu :(
5,5,5,5,True,True,False,True,False,False,False,False,False,COMP1022Q,1000,,11.0,The content is easy to get. Basic Excel formulas and VBA programs. Very easy for people who have taken ICT as their electives in secondary.,Gibson&#039;s lectures are interesting and easy to understand the content. The content is very easy as Gibson will have many examples to let us understand it.,"Both exams are open-book, and thus you don&#039;t need to memorize the syntax and function names and details; a throughout understanding of the logic is sufficient.","The mean is quite high (&gt;90) for lab work, which means you must be very careful in answering the question. Work harder for the midterm and exam to score an A."
4,5,5,5,True,True,False,False,False,False,False,False,False,COMP1022Q,1000,0.0,11.0,打啲簡單嘅excel programme同vba code。邏輯能力強啲對呢個course好有幫助，理解完邏輯用vba code打返出嚟。邏輯好就會靚grade,教得幾好，簡單易明,workload唔大，啲lab有晒guide同check list，跟住就好易滿分,俾grade好鬆手，邏輯能力唔差嘅話A range唔難。淨係有上堂就夠，唔需要自己練習，lab已經練到。
4,5,5,5,True,True,False,True,False,False,False,False,False,COMP1022Q,1000,0.0,11.0,"This course is designed to equip students with the fundamental concepts of programming using the VBA programming language, within the context of the Microsoft Excel program. Students will first learn how to use Excel to analyze and present data, and will then learn how to use VBA code to build powerful programs.","Good teaching, very humourous, always asking questions in class which keeps you brainstorming. The questions are good for clearing your concepts. If you can understand every question in class, there is no problem for you in the final exam.","light workload, just some labs and the TAs will help you out.",Good grading.
3,3,3,1,True,True,False,True,False,False,False,False,False,COMP1022Q,1000,0.0,11.0,VBA and excel<br />elementary stuff<br />better take the python or java one if you actually want to learn useful things,boring<br />the lecturer will make you fall asleep<br />no need to attend the lecture<br />just review the stuff afterwards,"7 labs, midterm and exam<br />you can finish the labs with 1 eye closed<br />midterms and exams are open book so very easy","Why do people give this course an A in grading?<br />I got full marks in everything, got an A in the end<br />where is my A+<br />where? where? where?"
5,5,5,5,True,True,True,True,False,True,True,False,False,COMP1022Q,1000,0.0,11.0,"This class especially, VBA is very interesting at the moment&nbsp;&nbsp;as I have not finished this course haha. <br />Students who likes to solve logical problems will like the course for sure.<br /><br />As I am not a student with CS-related background, this is my only COMP course in my u life. I would say it is a relatively simple course, easy to understand, train more on your thinking skills rather than memorising things.","I am in Gibson class. He is a funny guy, but I think he talked a little bit fast, I could not catch up with his pace (it may be my problem)<br /><br />Thanks to the online lectures, I can join other lecturers&#039; section. From then, I started attending Cecia&#039;s class. I really enjoy her class, she is very patient and so nice. She may include some warm up exercise to help us review the previous lecture content. In general, I really like her teaching. I think her class is very suitable for students who may need more time to digest the concepts.<br /><br />Also, Peter, our TA, is very nice too. He is delivering the lab content very clearly. and I rmb I emailed him for enquiries, then he replied me at 6am the other day. very responsive and helpful!","pretty light.<br />4 labs, midterm and final exam<br />labs: just pay attention to the TA, then you will get everything done within 1 hour for each lab.","I have not finished the course, I will update another review at the end of this semester.<br /><br />for exam, usually exam is more difficult than the practice tests and review questions."
5,5,5,5,True,True,False,True,False,False,False,False,False,COMP1022Q,1000,,11.0,"The first few lessons were focusing on how to use excel and basic cell functions such as average, vlookup and hlookup. Then the next few classes introduce some basic VBA and how to type VBA codes. After midterm, the content gets a bit harder but still manageable. <br />Good course for people who are interested in coding or problem-solving.","Cecia is a very nice instructor. She tries to answer all students&#039; questions and doesn&#039;t mind repeating herself. The TA (Peter) is also very nice. He does all the lab recordings and usually explains the process very well, so the first few labs were easy. But for the last few labs, he will leave some blanks for you to fill in and finish the codes yourself.","The workload is light, only remember to hand in the labs and should be fine. No attendance required.","Grading is fair. <br />There are a total of 5 graded labs. I highly recommend doing all the labs (including the non-graded ones) to have more practice writing the VBA codes. Most people get full marks on the labs, so make sure you don&#039;t lose marks or make stupid mistakes. You can always check if your code is correct by running the VBA code. <br />Midterm exam was quite straightforward.<br />Final exam was harder, so remember to revise all the lecture notes and have more practice. <br />I got full marks for the labs, above mean for midterm and finals. Received A in the end."
4,5,5,4,True,True,False,True,False,False,False,False,False,COMP1022Q,1000,,11.0,First few lessons are about basic use of excel worksheet. Content of vba starts at around week 2 or week 3. It is a little bit hard for vba part. Make sure you ask when you do not understand as some concepts builds up from the previous concepts.,Cecia is a nice instructor. Feel free to ask her questions after lesson or through email.,Only 5 grading labs + 1 midterm + 1 final,"The grade is quite good. There are a few grading labs and please do all of it as it is a good way to obtain marks. For the first 4 labs, you can just follow the lab video and copy the steps. The last lab requires you to finish it on your own. Midterm is easier when compared to the final."
4,5,5,5,True,True,False,True,False,False,False,False,False,COMP1022Q,1000,,11.0,"This course will teach you basic stuff about Excel like cell formulas. You will also learn basic Excel VBA coding.<br />The contents are quite practical, and I am sure that you will find it useful in your future job. Highly recommend taking this course!!!",Gibson is such a nice and funny person. He could teach things clearly and in a fun way at the same time. Those TAs are also really nice. They always answer questions in detail.,"Actually, there was no assignment but labs. Some labs were required to be finished while some didn&#039;t. However, I do recommend finishing all the labs as it will be useful for your midterm and final.<br />The time spent on each lab was about 2 hours on average. Most of the answers of the labs were provided in the tutorial video. Therefore, the means of the required labs were nearly 100 marks.","The grading is quite nice. I got full marks in all required labs. As for midterms and finals, my marks were above mean about 1 SD on average. I got an A- eventually.<br />(Don&#039;t be afraid when you see your marks! The mean is relatively low compared to the busi courses I have taken.)"
4,4,5,5,True,True,False,False,False,False,False,False,False,COMP1022Q,1000,,11.0,"vba basics, not practical in workplace, but you can learn basic vba.","very good, they are all very nice and good tutor and professors, which you can have a very nice time in learning.","6 Labs, need to go to labs to do, but they are easy. Mid term and Final exam.","A, very easy. the a range is large, many students can get a A- or above in this course. labs almost 100, midterm and final only 67 and 78, but still get a A in grade, which is better than java and python."
5,5,5,5,True,True,False,True,False,False,False,False,False,COMP1022Q,1000,,,2 parts : Basic excel functions and VBA programming<br /><br />No Attendance is required.,"nice professor with crystal clear teaching.<br /><br />The powerpoints slides are comprehensive, which provides detailed steps.","Not really have a lot of works to do. <br /><br />You just need to complete the assignments with sufficient instructions, so they can done shortly. <br /><br />Better complete all the assignments and practice all the codes regularly to secure a good grade.",Fair grading. <br /><br />You will get a good grade if you go through all the slides and assignments before mid-term and final exam.
5,5,5,4,True,True,False,False,False,False,False,False,False,COMP1022Q,1000,,11.0,"VBA programming for beginners. Even you are not familiar with programming at all, you will not think that this course is difficult. Also, the content is very valuable and useful for business student. You will be learning how to use vba programming language to create macros, draw shapes in excel, etc.","The teaching is fun, you will never feel bored in his lecture. He always tried his best to explain the content so that even the beginners can understand. You will definitely enjoy the jokes he tells in lectures. Also, Gibson and the teaching assistants are always willing to respond to your questions, so that you can truly understand the content. Once, I encountered some problems when I was finishing my lab assignment, I emailed the teaching assistant and he gave me a clear explanation within a day.","The workload is not heavy at all. You have to submit some lab assignments in the semester. However, the assignments are not difficult at all.","The grading is fair. You just have to study hard and you will get a nice grade. If you work hard, the content in midterm and final will not be challenging at all."
3,3,3,3,True,True,False,True,False,False,False,False,False,COMP1022Q,1000,,11.0,Basic knowledge of VBA in excel.<br /><br />Useful if you use excel a lot.,"Gibson really did a great job in teaching us VBA. Instead of teaching use by reading the Power Point he do more demo instead.<br /><br />I remember one time I really don&#039;t know how to do the lab , and I ask him for help. He didn&#039;t turn me down and answers all my questions one by one.",Workload is minimum. Have some labs but its ok because you can follow the tutorial video.<br /><br />Exam and Mid term are alright if you understand all the lab.,I got B+
3,3,3,3,True,True,False,True,False,False,False,False,False,COMP1022Q,1000,,11.0,"Pretty easy to follow. The contents are basic and should not be too hard to understand everything.<br /><br />For students learning the basic principle of VBA this course will be fun because its content is general. There are even topics on how to make games and shapes, so for those who are interested it will be very enjoyable",Kinda boring. Everything he talked about can be found in his notes so for people who wish to skip his classes there won&#039;t be any big misses.,"There&#039;s not much work to be done for this course. Besides midterm and final exams there are only assignments, and you do not need to spend a lot of time revising for the exams.",The grades are kinda lenient. Did mediocre but scored a B+ in the end. As long as you finish your assignments on time and don&#039;t too bad on the midterm and final exam you should be good to go.
5,5,5,5,True,True,False,True,False,False,False,False,False,COMP1022Q,1000,,11.0,All course contents are included in PPT and the course website.<br />Not really difficult to understand and the examples demonstrated in class is quite straight forward.<br />The final part of the course about Recursion might be challenging.,Gibson is good.<br />the learning atmosphere is lively<br /><br />TA will offer full guidance during the lab session.,"There isn&#039;t any takehome assignment in the lecture<br /><br />Labworks are essential. Although only half of them would count into final grade, the others are likely to be covered in the final exam, so better complete them.","It will be quite good if you have experience in programming, studied ICT, or have good logical thinking.<br /><br />both the midterm and final are open book exam, prepare your notes.<br /><br />Two-way grading.<br />The midterm is optional.<br />the weighting of the midterm could be shifted to lab and final.<br /><br />Final grading:<br />Average (excluding zeros):&nbsp;&nbsp;48.0<br />Standard deviation:&nbsp;&nbsp;22.0"
5,4,5,4,True,True,False,True,False,False,False,False,False,COMP1022Q,1000,,11.0,"Most of the contents before mid-term are about the basic excel formulas. After that, all is about VBA. <br /><br />I think it is easy for students to handle the first part(excel formulas) cause it is just easy to understand. <br />However, it is quite challenging when learning the VBA if you are not familiar with computer stuff. So do the lab exercises and examples again to make sure you really understand the contents and logic before the final.",Gibson&#039;s teaching is good and quite funny. He will explain the contents and logic clearly. So I enjoy attending his lessons even it is on Zoom.,"The workload is quite low. Every week has one lab work. No attendance required. No other assignment.<br /><br />You only need to review the contents before the mid-term and final. But if you want a good grade, please finish all the example exercises and understand the logic behind the examples and labs.<br /><br />So it is a good choice for you to fulfill the common core requirement!","Grading is fair. This semester is online mode. <br />The mid-term is not that hard. The questions are tricky. So double-check before submit to avoid some careless mistakes. <br />For the final, it is pretty hard... <br /><br />Assessment weighting:<br />4 lab each 10% (total 40%)<br />Midterm 20%<br />Final exam 40%<br /><br />Me<br />Labs All 100<br />Midterm below mean<br />Final Above mean (&lt;0.5sd)<br />Final Grade = B"
5,5,5,5,True,True,False,True,False,False,False,False,False,COMP1022Q,1000,,11.0,"Content includes basic excel formula and basic VBA, which are really useful. <br /><br />Recommend to buy the textbook for preparing exam.",Best professor in UST. <br />Fun and interactive teaching.,Very very light workload compared to other courses in UST.<br /><br />Lab is quite easy. Just need to follow instructions. Better not skip the lab.,Good grading!!! No computer science background is still okay. Just do more exercise and be careful!!<br /><br />4 lab: 100/100<br /><br />Midterm: 92/100 (open book exam)<br />Mean: 76.2 <br />s.d.: 15.7<br /><br />Lecture point: 2 questions <br /><br />Final grade: A<br /><br />(*Tip: Remember to print out the Lab materials! Some of the questions are from lab materials)
4,5,5,4,True,True,False,True,False,False,False,False,False,COMP1022Q,1000,0.0,11.0,"Non-VBA Excel Functions (week 1-3)<br />Cell References, Operators (^ power, &lt;&gt; not equal to), Logic Functions (and, or, not),String Functions (Concatenation, LEN) IF, VLOOKUP, HLOOKUP, LookUp Error<br /><br />VBA (week 3-12)<br />Macro, VBA Event, InputBox &amp; MsgBox<br />Cell References (Cells(Row, Column), ActiveCell - currently selected cell)<br />IF...Then, Else IF, COUNTIF<br />Types of Variable (Integer, Long, Single , Double, Boolean)<br />Loop (While...Wend; Do While...Loop; Do...Loop While, For Loops, (For...To...(Step)...Next),&nbsp;&nbsp;For Each Loop (For Each...In...Next)<br />Specifying Input and Output Type, Random Numbers, RANDBETWEEN(a,b)<br />Local &amp; Global Variables, Excel Objects (Range = cells, Shape), Excel Color (RGB), Doing VBA Events (.Rows.Count, .Value), Brackets for functions with input parameters and output, Private and Public Functions, GUI Control<br />Object-Oriented Programming (class, attributes, method)<br />Recursion","His teaching is good and easy understand.<br />Using Zoom, he will also answer our questions typed in chat box.<br /><br />If you send email to ask, he may also answer your questions.",There are around 3 to 4 labs that needed to hand in and other do not.<br /><br />not too many workload,"Maybe due to the online examination, the final is too difficult. There are two papers in final. Both are 90 total in marks.<br />Mean: 30+ /90 <br />It really shows the difficulties of exam.<br /><br />The midterm is easy.<br /><br />The content and VBA is easy in understanding compared with other Comp course so many people get high marks in examinations."
