rating_workload,rating_content,rating_teaching,rating_grading,has_midterm,has_final,has_quiz,has_assignment,has_essay,has_project,has_attendance,has_reading,has_presentation,course_name,level,upvote_ratio,instructor_rating,comment_content,comment_teaching,comment_workload,comment_grading
3,3,3,3,True,True,False,True,False,False,False,False,False,COMP1022Q,1000,0.0,11.0,"一開始教你excel d 基本function,之後教打vba code<br />冇電腦底都好易上手,好易明<br />本書可以唔洗買,佢d ppt都好夠用","David 係我上過咁多年黎最好既老師,上堂好有趣,你唔會覺得悶甚至眼訓,而且d英文都好易明<br />每堂會隨機問問題,會問返上堂既內容,而且d問題同考試差不多<br />有video提供<br />係lecture堂任你轉session(簡左星期三五,可以上二四堂都得)","得每個星期有個lab要做(頭兩個星期冇)而且得4份要交,好簡單,基本上d code比哂你,照copy就可以,唯獨lab5最尾10%要你自己打<br />基本上可以唔上,如果自己識做,但要交個幾份lab聽下好d","超好grade, open book,考前睇下ok,最好print埋d lab code 出黎,會考<br />有兩種計法:如果你midterm分&gt;final，可以唔計midterm&nbsp;&nbsp;&nbsp;<br />但今年因為送中停課,所以唔洗考final,淨係計assignment + midterm<br />midterm: 93/100<br />assignment:滿分<br />答左一題問題<br />overall: A"
5,5,5,5,True,False,False,True,False,False,True,True,False,COMP1022Q,1000,0.0,11.0,"Week 1-2: Learning Excel Features<br />-Cell References<br />-Cell Formulas (including but not limited to: SUM(), AVERAGE(), MAX(), MIN(), RANK(), COUNTIF(), SUMIF(), SUMIF(), LEN(), UPPER(), LOWER(), LEFT(), RIGHT(), SUBSTITITE(), IF(), AND(), OR(), NOT(), VLOOKUP(), HLOOKUP(), ISNA(), IFNA(), ISERROR(), IFERROR(), etc.)<br /><br />Weeks after: Excel with VBA<br />-Referring to Cells (Cells(), Range())<br />-Making decisions (AND, OR etc.)<br />-Looping (While...Wend, Do While...Loop, For Loop, etc.)<br />-Making random numbers (Rnd())<br />-Changing the appearance of cells<br />-Using excel objects<br />-Drawing excel shapes<br />-Types of variable in Excel VBA<br /><br />As this semester is quite special, there&#039;s only a midterm but no final exam. The above is the content for the midterm exam.<br /><br />The following is the content after the midterm exam. Although not examined in this semester, here are the contents for your reference:<br /><br />-More on Loops<br />-Using shapes as buttons<br />-Different ways to make a macro<br />-Subroutines and functions<br />-More on variables<br />-Basic GUI controls<br />-RGB representation<br />-Arrays<br /><br />The content is quite useful, especially if you are from business school. However, if you wish to major in IS, you are not recommended to enroll in this course as you have to take ISOM 3400 instead of ISOM 3230 as ISOM 3230 has an exclusion of COMP 1022Q. ISOM 3230 would have a more comprehensive look on the business analytics side of excel, while COMP 1022Q looks at more of the technical side of excel and VBA. ISOM 3400 is a Python course, which is considerably harder than excel VBA.","Prof. David Rossiter is very nice and funny in class. He is energetic, and always tell jokes in hopes of initiating the class atmosphere. <br /><br />He is responsive to emails. It is easy to find him and approach him to ask questions after class and through email.<br /><br />He won&#039;t pick people who raise their hands in lectures to answer the lecture bonus questions! He picks randomly from the crowd. Wearing clothes with bright colours, bring a cup of coffee or but a water bottle on the table would increase the chance that you get picked in class for that sweet 0.5%!",Very very light workload. Just revised 2 hours before the midterm and got more than 1sd above the mean score. You could attend the lab sessions to copy the code that is demonstrated by Peter (the TA). There&#039;s nothing else really. The workload matches with a 1000-level 3 credit course. This is easily the best grade common core with the least workload in UST.,"Grading very lenient.<br /><br />[Special grading scheme for this semester]<br />One grading scheme only<br /><br />Each lab work: 16.67%<br />4 labs = 66.68%<br />Lab 3: 100/100, Mean=98.6, SD=7.0<br />Lab 5: 100/100, Mean=96.8, SD=10.4<br />Lab 6: 100/100, Mean=96.4, SD=8.7<br />Lab 8: 100/100, Mean=98.4, SD=6.2<br /><br />Midterm: 33.32%<br />95/100<br />Mean=76.2, SD=15.7, Max=100, Min=20 (excluding zeros)<br /><br />Lecture Bonus<br />Each question answered in class + 0.5% on top of the final grade<br />7 questions answered (+3.5%)<br />Mean=2.14 (+1.07%), Max=12 (+6%)<br /><br />Final Grade: A+"
5,5,5,4,True,True,False,False,False,False,False,False,True,COMP1022Q,1000,,11.0,"Before midterm basically is simple excel formulas but after midterm is talking about VBA, coding stuff , not really difficult, but tricky.",Gibson teaching is clear and fun. I enjoy his lesson.,"Only lab each week .Need to spend some time on it. Maybe 2-3 hours , or you can just go to the lab session and copy the answer !",Not as good grade as I thought. Because&nbsp;&nbsp;final in the semester I take is SO DIFFICULT. But some still got full marks...<br />It is hard to get high marks but I think above mean still got pretty good grades.
5,5,5,5,True,True,False,True,False,False,False,False,False,COMP1022Q,1000,1.0,11.0,"Basic VBA Programming. Compared to other courses, it&#039;s an easy course. Suitable for all schools, but I&#039;d suggest picking Python (COMP 1021) since most companies use it nowadays. The course is divided into two parts: basic Excel without any VBA (first 3 weeks, example: LOOKUP, MAX, SUM) and VBA (10 weeks, example: looping, arrays). For those of you who have prior programming knowledge, skipping classes is fine and you can just focus on the practice questions.<br /><br />Note: Don&#039;t buy the book and just focus on the powerpoint slides and exercises",[LECTURE]<br />Gibson&#039;s teaching is clear and very engaging. But sometimes the pace is a little bit too fast so you may need to revise from the lecture videos.<br /><br />[LABS]<br />TA&#039;s are generally helpful. Just follow their instructions and you will be guaranteed to get 100% marks.,"Very light workload. You don&#039;t need to prepare anything for the labs since the TAs will teach step by step and allow questions.<br /><br />As for the exams, you can bring your books / notes so you don&#039;t have to memorize the content. I myself just prepared a day before the exam by doing the practice questions. Focus on the logical thinking and A-range is secured.","Definitely a GPA booster, especially if you have prior programming knowledge. <br /><br />[SCHEME 1]<br />4 Lab Assignments [40%]: 100/100 (mean: around 98)<br />Midterm [20%] = 90/100 (mean: 62.37, sd: 24.22, maximum: 100, minimum: 8)<br />Final [40%] = 72/100 (mean: 48, sd: 22, maximum: 100, minimum: 2)<br />Additional Points [+2%] = 0/2 (didn&#039;t get it since I never came to the class and focused on other courses instead)<br />My Grade = A<br /><br />[SCHEME 2]<br />4 Lab Assignments [44%]<br />Midterm [0%]<br />Final [56%]<br />Additional Points [+2%]<br /><br />You can get additional points if you answer Gibson&#039;s questions in class. Just answer one and you will automatically get the additional 2%.<br /><br />They will automatically assess every students&#039; grades. If your final score is better than the midterm, you will be automatically switched to grading scheme 2.<br /><br />A friend of mine scored 1 SD below mean in midterm and mean in the final. He got B in the end, so I&#039;d say the grading is fair.<br /><br />Be careful in the finals, Gibson said that the final in Spring 18/19 is the worst so far, so maybe it progressively gets harder over time."
5,5,5,5,True,True,False,False,False,False,False,False,False,COMP1022Q,1000,,11.0,"Very basic programming.<br />variables, functions, if-else statement, loop, array...etc. But the assessed way is easy so no worry.<br />It offers the most important concepts that you can see almost every prgramming language and i think it is a good language for starters.",Professor Lam is very funny.<br />I still remember so clear that the first day he introduced himself using Stephen Chow&#039;s movie.At the instance i knew i wont be bored with this course.<br /><br />Almost every lecture there are questions that can give you bonus mark and they are not difficult as long as you comprehend the contents.,"Appropriate.<br />Contents taught in class are easy stuff.<br />Labs need you to think a little bit more<br />Exams are more challenging but if you truly put effort on it, you will get good grade.","The best grade I ever had.<br />Full marks in labs<br />Above 1 sd in midterm<br />Abover 1sd in final<br />Got 1 bonus question<br />Overall I got a A+(With this level of performance,A+ is guaranteed)"
5,5,5,5,True,True,False,True,False,False,False,False,False,COMP1022Q,1000,,11.0,Quite useful content for Excel and VBA. Besides teaching VBA codes it helps you with daily Exce Applications and it will be useful for future studies and career.,Funny Lecturer. Never felt boring in his lecture. Sometimes he will ask us some questions and giving the correct answer earns some marks of final grading.,The workload is not heavy. The assignments are easy. The important thing is to attend labs regularly if falling behind. The TAs are helpful and willing to solve your problem.,"As long as you are familiar with the lecture slides, assigments and labs you are good to go. The exams are open book. You can bring your notes in case you forget something."
5,5,5,5,True,True,False,False,False,False,False,False,False,COMP1022Q,1000,,11.0,"Super easy, just super easy, you can skip all the classes you want after he first class, but please take some time to read through the powerpoints.","Rossiter is the best prof. I’ve seen so far, humorous, good presentation. He will randomly choose someone to answer his question in class, but its ok to don’t know the answer so don’t be nervous.","Some handin labs. There are other extra labs that don’t require you to handin, but all the labs could be asked on exams so make sure to attend all of them and save the codings to ur account for your cheatsheet if you wanna have good grades.<br /><br />The biggest workload is to prepare a good cheatsheet, here are some common advice:<br />- Don’t just make code list for your cheat sheet, make a little section about each code with some simple definition and examples.<br />- Big font and different colour for the topic of the section, so you can find the section you need asap<br />- Put all the labs’ codes with explanations into the cheatsheet<br /><br />Please do the exam sample before the exam, its really useful.<br /><br />Good luck bois and gurs, you can do it.","Got a B without much effort. I have literally zero knowledge about computer science, didn’t put the lab’s codes into cheatsheet cuz I’m too lazy, skipped most of the class, didn’t attend any non-handin labs, still gets a B. So don’t be like me, work harder and I’m sure you can get an A. Add oil."
5,4,5,4,True,True,False,True,False,False,False,False,False,COMP1022Q,1000,,11.0,"As the title of the course suggests, it is a beginner programming course about Excel. The content is mostly about the basic knowledge of VBA. Some may say that there are too much materials to be covered, but both mid-term and final are open-booked exams, so I guess it is okay.","Gibson is a very passionate professor, he will expand everything very clearly, I don&#039;t recommend you to skip the lecture if you are not sure about the concepts.<br /><br />TA also gives out clear instruction for the lab work, so if you want to have some base marks for the lab work, make sure you don&#039;t skip the tutorials as well.","The workload is quite low. Lectures and tutorials are not compulsory.<br />However, you will need to hand in 4 lab work for marking which will be counted towards your final marks.","There are two grading scheme, the one which gives you the highest grade will be used.<br /><br />1.midterm 20%, lab work 40%, final exam 40%<br />2.midterm 0%, lab work 44%, final exam 56%<br /><br />In case, if you performed not so well in the mid-term, you can still catch up in the final.<br /><br />There is also bonus lecture marks, if you answered the questions which are raised by the professor during the lecture, you will get a bonus 0.5% to your final marks.<br /><br />One thing to be careful is that although the course gives out good grade, there can also be some tricky parts in the questions, just don&#039;t let your guard down."
5,5,5,5,True,True,False,False,False,False,False,False,False,COMP1022Q,1000,,11.0,Excel VBA coding and Basic excel coding. <br />Easy and interesting.,"Funny and Easy, You can get extra credit by answering pop up questions in class which is quite easy.&nbsp;&nbsp;If you are confident enough to have a good grade in the final, you can choose not to answer.",Easy. <br />Step by Step teaching in tutorial lessons. <br />You can ask as many questions as you like. <br />Try to do the homework on your own first.&nbsp;&nbsp;Ask the TA when you have questions.,The final exam does not mainly focus on vba coding.&nbsp;&nbsp;It focuses more details and logical thinking.&nbsp;&nbsp;Try to think step by step instead of jumping to the conclusion immediately.<br />Unlimited cheat sheet is allowed.
5,5,5,5,True,True,False,True,False,False,False,False,False,COMP1022Q,1000,,11.0,"The content of the course is improving each year, and it’s already designed to quite easy to understand. If you attend the lectures and work hand on hand on the additional exercise, there should be no problem for you.",Good. Cecia could teach us according to our level and adjust her teaching pace. She is also very nice and will answer all your idiot questions.,"Almost no workload at all. Only need to attend the labs, (you even need not to attend if you know how to do)&nbsp;&nbsp;but labs and lectures usually include tips. Just revise the day before exam and midterm.","I got and A in the end. There is two option in grading, either consider both midterm and exam or exam only. Labs also counted but most of them can get full mark. One thing to suggest is don’t all in to your final. Because the trend seems to be a easy midterm and extremely hard final.(At least for both spring and fall last year) Therefore the midterm may save your grade if you did bad in the final."
5,5,4,5,True,True,False,False,False,True,False,False,False,COMP1022Q,1000,,11.0,if you have programming exp will be perfect.,Gibson is quite amusing,"you can choose not to attend any lesson of the course if you have basic programming skills. just remember to check which lab is graded and check for the instructions then do them all. if you have source, you can try to use them , but you need to check them carefully before submitting.",it is really easy to get good grade&nbsp;&nbsp;without lot of effort. i got A- with just few hours of review before exams.
5,5,5,4,True,True,False,True,False,False,False,False,False,COMP1022Q,1000,,11.0,"Very easy. <br /><br />This course is about how to use Excel VBA, mainly focusing on the coding and logic behind writing codes. They will teach you the most commonly used commands such as IF, LOOKUP. If you had taken IT courses before this course will be a piece of cake. If you hadn&#039;t this course will still be a piece of cake to you as the content requires little time to review and understand.<br /><br />The first half of the course consists of some excel basic knowledge that even primary students will know if they had taken their IT courses such as the definition of a spreadsheet (which of course will not be asked in exam), basic cell formulas. Another half of the course is also very easy to understand, such as looping and basic cell formatting.<br /><br />In fact, the course is so easy that you can understand all the lesson materials just by reading the lecture notes, you don&#039;t need to attend any lectures at all (in my opinion).","Streamlined and Sophisticated.<br /><br />Gibson is one of the best lecturers I&#039;ve seen (though to be fair as a year 1 student I haven&#039;t seen much), his lessons are interesting, used a lot of gags and jokes to stir up the atmosphere, he also uses very simple and easy examples to help students understand the concept of the class.<br /><br />Questions will be asked during each lecture and if you answered it correctly you will be awarded 0.5% towards your final grade.<br /><br />Each week they will have 1 lab, a mini-project/ homework that helps you understand the concepts and the implementation of codes. Without a doubt, those labs are very well organized, while doing the lab you&#039;re simultaneously learning and revising the lecture material. The lab is so good that if you&#039;ve done all the labs you don&#039;t even need to read the lecture notes to learn the content.","The only homework for the course is lab work aforementioned, better still only half of them are counted towards your final grade, which means there&#039;s only a lab work biweekly. <br /><br />Each lab work is a simple mini-project using excel spreadsheets that takes around 1 hour to finish, such as making a search up page for MTR fare. <br /><br />Lab project will be taught in lab sessions and you can finish that homework while attending that session. If you missed that session you have around 5 days to do it yourself and hand in via canvas.&nbsp;&nbsp;Moreover, each lab will have a sophisticated step-by-step guide teaching you how to write the codes almost LINE BY LINE. Even a primary student can finish the lab under that level of instruction.","This semester&#039;s grading is quite good in general.<br /><br />This course was regarded as one of the best courses in UST. Easy to learn with very high grades. However, this year is an exception.<br /><br />The course has 4 lab work, 1 mid-term exam and 1 final exam, by the way all exams are open book open notes exam.<br /><br />This course has two ways to count your final grade. I&#039;ve forgotten the exact method, but basically, final exam counts around 50%, mid-term 30% and labs 20%. The second way is final 60%, labs 40%. The instructors will automatically choose the method that will result in a higher score.<br /><br />My score:<br />Lab total: 97.5/100<br /><br />Midterm: 62/100<br />Mean: 62.37<br />S.D: 24.22<br /><br />Final: 83/100<br />Mean: 48<br />S.D: 22<br /><br />My Total: 84.6%, Final grade A.<br /><br />As you can see the final exam is disastrous. Never have I seen a 1000 level course having a lower than 50% mean score. Bear in mind this is an open book exam. Though to be fair it doesn&#039;t really help even if you had your notes, since the exam had focused a lot on logical deduction which required a focused-mind and clear head. To conclude almost no revision is required, but you&#039;d better make sure you&#039;re clear about the concepts of coding."
5,5,5,4,True,True,False,True,False,False,False,False,False,COMP1022Q,1000,,11.0,"頭三個禮拜講下啲好簡單嘅excel formula，基本上自己睇notes已經搞掂，之後就教vba language，包括variables, looping, if function, excel event, arrays, recursion, objects等",gibson算系我係ust見過教得最好嘅professor，冇口音，熱心回答你嘅問題，落堂可以chur住佢不停問，email佢都好快覆。其實齋睇notes已經好易明，但建議大家去上佢嘅堂，因為佢會將一啲比較複雜嘅concept用好簡單易明嘅方式例子去解釋，如果自己睇要半個鐘先明，佢十分鐘已經可以教到你明，最重要系佢上堂會時不時講下爛gap，雖然唔多人笑，但比起其他professor嘅堂，已經有趣好多。,每星期都有lab，但hand in lab得4份，其他可以唔去，hand in lab其實自己睇notes已經做到，去到都系跟ta做，完全唔識都可以滿分。,兩種計法，具體percent我記得，大約系：<br />midterm 30% lab 20% final 50%<br />如果你炒咗midterm，可以唔計midterm<br />final 60% lab 40%<br />lab其實只要有attend 跟住ta做已經滿分，最多留最後一個位自己做，但都唔難，都系唔識做嘅話可以chur下ta，佢會教埋你點做。<br />堂上回答問題有bonus分，但都系最多5%<br /><br />我lab 90%<br />mid term74/100 above半個sd<br />final 64/100&nbsp;&nbsp;above 1個sd<br />最後A-咗<br />超好grade
5,5,5,4,True,True,False,False,False,False,False,False,False,COMP1022Q,1000,,11.0,"內容圍繞Excel formula 同埋VBA, 中學有讀ICT嘅會比較容易，就算冇讀到幾容易上手。",Professor 教得好好亦好俾心機教,Lecture lab都唔會take attendance，但係lab work就計分，lab 堂有Professor同埋TA會教你做，或者自己喺屋企做Online交都得。總共8個lab， 4份計分,因為個course嘅內容比較簡單所以競爭會比較大
5,4,5,4,True,True,False,True,False,False,False,False,False,COMP1022Q,1000,,11.0,"It covers some basic excel functions which I believe many of us have already known. The major part of this course is about VBA coding, and helps you to develop a computer-language mindset, which I think it is quite useful and applicable in the future.",Gibson is one of the best professors I have met in UST. He teaches with heart and tires to make lessons fun.,"Very light. If you can finish the Lab assignment on your own, you can skip the lab secession. However, if you are not sure whether you can handle it, the lab tutor will show you the complete answer, so I recommend students with no computer science background to attend the Lab.","The final grade contributes to mid-term exam (optional), final exam(60%) and Lab assignments(40%). I fully got that 40% Lab contribution like most of the other students, MT and final both score 1 s.d. above and the final grade is B+."
4,4,5,5,True,True,False,True,False,False,False,False,False,COMP1022Q,1000,,11.0,It is an introductory course of students with any trials in programming. It is about using excel to programme some interesting functions and mini-games. The exam questions are MC and some fill-in the blanks question. You are required to choose the correct coding for the expected result.,"Rossiter, David is a perfect teacher. You are lucky if u are staying in his class. You won&#039;t fall asleep because his teaching style is to interact with students. You can get bonus marks if you answer the questions correctly in class","Just a few lab project/ assignment that can be handled easily. Some lab tutorial sessions are not essential to show up, but it would be better for understanding the programming logic behind. Low workload, it won&#039;t be a great course for year one student who just starts their university journey.",It is an open book exam which means u can bring all the teaching materials into the exam venue. You don&#039;t have to memorise anything but just understand the theory behind. I got an A grade.
4,5,5,5,True,True,False,True,False,False,False,False,False,COMP1022Q,1000,,11.0,The course includes basic knowledge of the application of Microsoft Excel and Visual Basic.,"Teaching is nice. The course instructor Cecia organizes the teaching materials and resources really nicely, and she can explain everything clearly and precisely.","Workload is reasonable. There are totally 8 lab works, four of which are hand-in lab which counts in your final grade. If you attend every lecture and complete each lab work, it&#039;s easy to obtain a satisfying result on this course.","The grading is rather good. If you get full score in all the lab work, it is not that difficult to get a A range. Mid term is optional. And all the exams are open-noted, which means they are actually testing your comprehension and understanding on the topics rather than memorization."
4,5,4,3,True,True,False,True,False,False,False,False,False,COMP1022Q,1000,,11.0,"The content of the course is pretty easy to get, before the mid terms it is focused on the excel functions like VLOOKUP while after mid term you will learn more about VBA, the hardest topic is recursion","His teaching style is quite fun amd interactive, however the exams seems to differ quite alot from what he teaches",the work load seems to be acceptable there are 7 labs in total with 4 labs that need to be handed at the very end,"the average of the midterm was in the 65s while final was 48, the grading seems quite fair, I got above 0.5sd in mid term and 1.2sd in final and ended up with A"
