rating_workload,rating_content,rating_teaching,rating_grading,has_midterm,has_final,has_quiz,has_assignment,has_essay,has_project,has_attendance,has_reading,has_presentation,course_name,level,upvote_ratio,instructor_rating,comment_content,comment_teaching,comment_workload,comment_grading
4,5,5,3,True,True,False,True,False,False,False,False,False,COMP1022Q,1000,1.0,11.0,"Non-VBA Excel Functions (week 1-3)<br />Cell References, Operators (^ power, &lt;&gt; not equal to), Logic Functions (and, or, not),String Functions (Concatenation, LEN) IF, VLOOKUP, HLOOKUP, LookUp Error<br /><br />VBA (week 3-12)<br />Macro, VBA Event, InputBox &amp; MsgBox<br />Cell References (Cells(Row, Column), ActiveCell - currently selected cell)<br />IF...Then, Else IF, COUNTIF<br />Types of Variable (Integer, Long, Single , Double, Boolean)<br />Loop (While...Wend; Do While...Loop; Do...Loop While, For Loops, (For...To...(Step)...Next),&nbsp;&nbsp;For Each Loop (For Each...In...Next)<br />Specifying Input and Output Type, Random Numbers, RANDBETWEEN(a,b)<br />Local &amp; Global Variables, Excel Objects (Range = cells, Shape), Excel Color (RGB), Doing VBA Events (.Rows.Count, .Value), Brackets for functions with input parameters and output, Private and Public Functions, GUI Control<br />Object-Oriented Programming (class, attributes, method)<br />Recursion<br /><br />Lab 1: Stock Market Buying and Selling (Excel non-VBA, Excel Functions: AVERAGE, IF, FLOOR)<br />Lab 2: Moving Around Hong Kong (Excel Non-VBA &amp; VBA, Excel Functions: IF, IFNA error checking,&nbsp;&nbsp;VLOOKUP, Macro)<br />Lab 3: &#039;Escape the Monster&#039; Game (Excel VBA)<br />(ActiveCell, IF, Cells (Row, Column), variables)<br />Lab 4: Eliza (Excel VBA)<br />InStr (Starting Position, From searching area, Target) for returning the position of the target (a number position)<br />Lab 5: Jigsaw Game (Excel VBA)<br />Nested loops, random numbers, strings<br />Lab 6: Music Keyboard (Excel VBA)<br />Mod - Remainder 7%5 =2, Mod = 2<br />Mid (from text, starting position, extracted length) <br />Lab 7: Shape Sculptures<br />Loops, RGB Color, Interpolations, GUI Control, Mod (Mod 2 = 0) - even numbers<br /><br />Better to buy a course book to practice more examples on codes<br />(Excel and Excel VBA Programming for Beginners - by David Rossiter and Gibson Lam) from the bookstore","Professor Rossiter has a very interesting, intriguing teaching style, I have attended every lecture of him and I am really enjoy his teaching.<br />I think he is one of my favorite professor in HKUST over 4 years of study<br />Lecture videos are provided to every lecture and you can do a revision on it<br /><br />Questions are asked to award the students who answer correctly and instantly on every lectures as their bonus marks&nbsp;&nbsp;+0.4% marks per question adding up in your total score (sitting on the front and wearing a special color of cloths will help to raise your chances to answer questions)","As both Midterm and Final exams are open-book, it indicates the difficulties (that&#039;s means even you have all the notes, you may still not know how to do the exam!!!)<br /><br />But printing all the notes and jotting down all the examples from the lectures are imperative, especially printing all the codes of every lab session (including the last lab!)<br /><br />Also, do all and print all the Midterm Sample and Final Sample Papers! Make sure you 100% understand why the answers work in a logical way.<br />I studied a few full days for the final exam to get a better score, to cover my low scores for the midterm. <br />If I continued to get a -0.83sd in the final, I would be sure I would get a C or C-<br /><br />Don&#039;t look down on the Basics of the course content (the loops, if functions), please have a 100% strong understanding and practice on the basics before moving forward to the advanced<br /><br />All the teaching materials and examples in lectures, labs and sample papers are relatively easier, YET the EXAMS are totally on a different level!<br />Again, DON&#039;T UNDERESTIMATE the difficulty of this course! <br />Programming rookies get a tough time to familiarize the programming language, styles and all the codes. <br />You will never do a better job as great as those CS majors, people who have studied ICT in DSE. Rookies are coming to put the mean down and favor the high-flyers","No attendance marks for lectures and labs, but I highly recommend you to go all for bonus marks in lectures, learning the principles and copying all the codes for the lab assignments<br /><br />Total 7 lab sessions, only 2nd - 6th lab projects count the grades<br />5 Labs: 5 X 8% = 40%<br />1st and 7th Lab does not count but the 7th lab about Interpolation is extremely essential for final exam. You must go to the lab session to complete the codes and understand how it works.<br />The last lab is very difficult for programming rookie like me<br /><br />Open Book Exams (Both Midterm &amp; Final)<br />Midterm Exam: 1hr 10mins<br />Final Exam: 2hrs 10mins<br />Time is limited and harsh for rookies, please do the exams precisely with a good time management. Don&#039;t stick on the questions you don&#039;t know. <br />Read more codes and practice by using the Excel on hands (I got a loop question correct in the final exam, only because I had done a Excel additional practice - sourced from the course website)<br /><br />If Midterm Result &gt; Final Result<br />Midterm Exam: 20%<br />Final Exam: 40%<br /><br />If Midterm Result &lt; Final Result<br />Midterm Exam: 0%<br />Final Exam: 60%<br /><br />My Case: <br />Lab: 500/500 = 40 (follow and copy every code given by the TA in lab session to make sure you don&#039;t have any mistakes)<br />Lab is important for rookies to save their grades<br />Midterm Exam:&nbsp;&nbsp;56/100 (-0.83sd) (mean 72) (sd: 19.2) = 0%<br />Final Exam:&nbsp;&nbsp;64/100 (-0.19sd) (mean 67) (sd: 15.9) = 64 * 60% = 38.4<br />Bonus mark (Answering questions in the lecture correctly and quickly): 1 question = 0.4<br />Total = 78.8 = Grade: B-<br />I only get -0.19sd in the final exam, it already grants me a B-<br />That&#039;s indicate you must get a mean to get a B<br /><br />When you review on other comments about this course<br />Total: 77.2 = Grade B- (-0.3sd in final exam)<br />Total: 76.2 = Grade: C+ (-0.4sd in final exam)<br />The B-range and C-range are very narrow, the course is extremely competitive, only with total 80% secures you a B<br />Imagine how many programming experts in this class competing with you <br />Excel the course with your Logical Intelligence and Carefulness <br />If you have an unclear logic, you have no any programming background and you are a programming idiot like me, try your best to avoid COMP classes (you go to take other QR Common Core courses, go exchange to transfer credit, or take some distance learning courses)<br />If not, I will bless for you!"
4,4,5,4,True,True,False,True,False,False,False,False,False,COMP1022Q,1000,,11.0,You can see other people.<br />Excel formula &amp; VBA<br /><br />no attendance required.,"Gibson teaching is quite clear and understandable. However, I didn&#039;t work hard on this course so I only get B grade. But this is my problem la. Gibson is good. As long as you work hard in this course, you can get good grade la I think.","light. <br />TA will teach you almost all the steps in lab. You just need to follow the instruction to type/copy the code from assignment page. (most of the time, code will be given in lab page.) Read careful the assessment requirements and fulfill it.<br />The difficulties of midterm is acceptable. However, the final exam is very difficult in this online semester. So the mean is very low.",This semester is online mode. The final exam is very difficult.<br />Assessment weighting:<br />4 lab each 10% (total 40%)<br />Midterm 20%<br />Final exam 40%<br /><br />mean:<br />lab 3 97.7/100<br />lab 4 97.1/100<br />lab 6 93.8/100<br />lab 7 96.3/100<br />Midterm 76.8/100<br />Final exam 51.2/100 SD=14.8<br />overall mean ~ 74.33%<br />me <br />4 lab all 100/100<br />Midterm 80/100<br />Final exam 48.89/100<br />me overall ~ 75.56%<br />Final grade = B<br />I think mean is B? So in UST this is quite a good grade course.
5,5,5,5,True,True,False,True,False,False,False,False,False,COMP1022Q,1000,0.0,11.0,First started with excel formulas and by mid-term student would some basic knowledge of VBA (Mainly creating Loops). After mid-term there would be more content on VBA. <br />Declaimer : Online course this sem due to pandemic.,"He spoke fast, nonetheless a super lovely lecturer. Still had a great time attending lectures even though its on zoom.",Light workload. Didn&#039;t attend any Labs as they were optional. But still shouldn&#039;t take a long time to do them on your own.,"Definitely good grades<br />However keep in mind that the final exams of this course in spring sem have been getting pretty hard. Therefore, I wouldn&#039;t say A range comes with ease and would still need to put in some work. <br /><br />Mid-term : Carried out online with Canvas. In quite a different format compared to the past as we were able to use excel on our own pc during the exam. To ensure fairness, there was only one &#039; deduce from the codes&#039; kind of question. And I was only able to take advantage of this situation (able to use excel) for one question. Still, mid-term became easier than past years<br /><br />Final : Also done in Canvas. Two papers, one hour each with 15 mins break in between. This time we weren&#039;t able to copy codes from the questions (They added tricks to the codes hence we could only copy a bunch of useless codes). So they put in variety types of questions (just like finals from the past)&nbsp;&nbsp;and they were difficult. <br /><br />Labs work (40%) full mark<br />Midterm (20%) 100/100&nbsp;&nbsp;Mean: 76.8&nbsp;&nbsp;&nbsp;SD:~17<br />Final (40%) 80/100&nbsp;&nbsp;Mean: 51.2&nbsp;&nbsp;SD: 14.8&nbsp;&nbsp;&nbsp;Highest: 96.7<br />Grade: A+ (Despite 16 marks lower than the highest in the final...) <br />No bonus mark for answering questions as Zoom lecture this sem.<br /><br />I had no CS background,&nbsp;&nbsp;you don&#039;t need it to get good grade."
5,4,5,4,True,False,False,True,False,False,True,False,False,COMP1022Q,1000,0.0,11.0,The first part is about excel formulas<br />The second part is about VBA,She is very kind and always answer your questions. She explains everything clearly.,"There are 8 labs, but only 4 is graded. You can get full marks easily if you follow the lab menu carefully.",Midterm: 94/100<br />Lab: Full mark<br />Bonus mark: 0<br />Final is cancelled<br />Grade: A<br />Very hard to get A+. The curve is very high because the content is relatively easy but it is a good course for you to pull up your GPA. Be careful in exams as there are trick questions.
5,4,5,5,True,True,False,True,False,False,False,False,False,COMP1022Q,1000,0.0,11.0,"Basic excel functions that everybody should know.<br />It is okay not to attend class before mt because only basic stuff are taught. But you should pay attention to the materials of VBA programming. If you cannot manage VBA concepts, then the course will be a holy hell to you.","Very funny teacher via Zoom. He tells a lot of jokes( some are little dirty but appropriate) that makes atmosphere chill. <br /><br />I can tell he is really dedicated to teaching, everytime he carefully explains the reasons behind the concept. I am not a engineering student but I had fun in the course. <br /><br />Gibson&#039;s teaching won&#039;t let you down.","Very Light workload.<br /><br />There are only 3 hand-in labs , 1 midterm and 1 final.<br /><br />For LABs, the tutor do demonstrations and you just need to follow. Often the only thing you have to do is 4 to 5 lines of coding ( very simple and straight-forward, no worries)<br /><br />The average time for me to finish one LAB is 1 to 2 hours. The course won&#039;t cost you too much time.",Final Grade B+<br /><br />MT above mean 1 sd<br />Final reach mean<br />3 LABs all full mark<br /><br />i think he gives a very lenient grading on all of us. It is one of the best grade courses in HKUST.
4,4,5,4,True,True,False,True,False,False,False,False,False,COMP1022Q,1000,,11.0,First excel then VBA. Should be easy if you can finish your homework on your own. If you want to study CS or CPEG don&#039;t choose this course.,Gibson is very funny and passionate. I am sure you will enjoy his class. He talks quite fast but still easy to follow.<br />TAs in lab are very helpful.,They say labs are compulsory but they are not indeed.<br />You can do the labs at home.<br />If you are really that lazy then you basically have one lab every 1-2weeks and just one final exam which is open book.,"Open book exam<br />Midterm is optional but I recommend you attend.<br />If you answer questions during lessons, you can get bonus points which count toward your final grade."
4,3,4,4,True,True,False,True,False,False,False,False,False,COMP1022Q,1000,0.2,11.0,"To be honest, before i get started writing on this review, i must warn you guys that COMP1022Q is not as good grade as you think. If u have gifted talents in CS,u will definitely do well in this course. But if u are a computer idiot(like me), DO NOT take this course or ur GPA will be spoiled. Actually I got A in other courses but for this so-called &quot;靚grade course&quot;, I got an appalling B- grade at the end. Therefore, DO NOT take this course&nbsp;&nbsp;WITHOUT any thorough consideration. Despite excel being easy, the codes in VBA can go insane in the final exam. So, i just sit there in the exam with arm folded 😢","Gibson&#039;s teaching is mediocre.As I didn&#039;t attend his online class very often, not too bad but not good.No much comment on his teaching performances","Light,just finish the lab by following TA instructions,easy to get full mark on that 4 lab assignments","I must stress once again,u can easily below mean if u are not interested in excel relating to coding. So, DO NOT repeat my footstep again<br /><br /><br />Final Exam Performance <br />Mean 51.2.&nbsp;&nbsp;&nbsp;&nbsp;&nbsp;&nbsp;&nbsp;SD:14.8<br />Max:96.7.&nbsp;&nbsp;&nbsp;&nbsp;&nbsp;&nbsp;&nbsp;&nbsp;&nbsp;Min:8.9<br />My score:43.33.&nbsp;&nbsp;&nbsp;&nbsp;&nbsp;&nbsp;Below mean -0.53 SD<br />My total course scores:70.33%<br />Final Grade B-"
5,5,5,5,True,True,False,True,False,False,False,False,False,COMP1022Q,1000,1.0,11.0,All content in PPT+ website<br />Easy if you have logic (got no logic problem)<br />Just read those VBA coding step by step <br />Answer will appear in your mind:),"NICE, and interactive<br />no need attendance","ummmm only need to attend LAB(cuz I dk how to do xd) TA will teach step by step (on cuz u can skip as well, some main steps provided in website jeng!!!)",two ways grading <br />Can all in final<br />me as example 70% of midterm 95% of final <br />So midterm do not consider in grading<br />turns out final score have 90% = A- at last
5,5,5,4,True,True,False,True,False,False,False,False,False,COMP1022Q,1000,0.3333333333333333,11.0,"I would say VBA is very interesting at the moment&nbsp;&nbsp;as I have not finished this course lol. But I would like to make this review because of Cecia &lt;3<br />For people who like mathematics/ solving logical problems, you will like this course.<br /><br />As I am not a student with CS-related background, this is my only COMP course in my u life. I would say it is a relatively simple course, easy to understand, train more on your thinking skills rather than memorising things.","I am in Gibson class. He is a funny guy, but I think he talked a little bit fast, I could not catch up with his pace (it may be my problem)<br /><br />Thanks to the online lectures, I can join other lecturers&#039; section. From then, I started attending Cecia&#039;s class. I really enjoy her class, she is very patient and so nice. She may include some warm up exercise to help us review the previous lecture content. In general, I really like her teaching. I think her class is very suitable for students who may need more time to digest the concepts.<br /><br />Also, Peter, our TA, is very nice too. He is delivering the lab content very clearly. and I rmb I emailed him for enquiries, then he replied me at 6am the other day. very responsive and helpful!","pretty light.<br />4 labs, midterm and final exam<br />labs: just pay attention to the TA, then you will get everything done within 1 hour for each lab.","I have not finished the course, I will update another review at the end of this semester.<br /><br />for exam, usually exam is more difficult than the practice tests and review questions."
5,5,5,5,True,True,False,True,False,False,False,False,False,COMP1022Q,1000,,11.0,"First part was about excel formulas, the later part was about VBA.<br /><br />All exam questions are short questions and open-book, so what you need is to think logically and give the correct final answers, steps are not important.","Good professor, you will not feel bored in his lessons.","Only 4 labs to hand in, and there are step by step guidelines and marking schemes on the website, so it is easy to follow and get high score.<br /><br />Beside labs, only midterm and final (which was cancelled in this semester).","Originally, there are two schemes and the better grade from the schemes will be calculated:<br />labs 40%, midterm 20%, final 40%; or<br />labs 44%, midterm 0%, final 56%.<br />In this way you can get a good grade even if you perform not so well in midterm.<br /><br />However, in this semester, it is changed to:<br />midterm 33.32%, labs 66.68%<br /><br />Also, the professor asks questions in the lecture, and randomly picks people to answer the question. You get 0.5% bonus points for each correctly answered question.<br /><br />For reference, my grades:<br />labs 100%<br />midterm 91%<br />Bonus 2.5 (5 questions answered)<br />Final grade A+"
4,5,5,5,True,True,False,True,False,False,False,False,False,COMP1022Q,1000,,11.0,基本上個課程好小野讀 一開始嗰啲加減乘除同你起中學用計數機冇乜分別 係VBA開始嗰到會多啲啲野 但係其實來來去去都係得幾條式 只要睇得明example基本上就冇大問題,佢起堂上面會周不時問人問題如果你怕悶嘅話唔使擔心 但係如果你想毒坐一角就可能麻煩小小 因為佢有時都幾中意抽啲唔係爆四位嘅人來問 大致上佢教學上係好清楚明白解釋得十分詳盡 同埋佢用大量嘅例子來解釋啲內容,做lab如果上齊堂來做唔會有啲咩大問題 不過如果reg中咗9點嘅lab就可能會辛苦小小,Mid term 100<br />Lab 100<br />Final ~90<br />Grade A+<br />雖然佢有兩個scheme 一個計mid term一個唔計 但係佢mid term之前考得容易過final好多 基本上輕輕讀一讀都可以8字頭 所以個人覺得寧願mid term認真啲去考 final輕鬆小小會更加開心
5,5,5,5,True,True,False,False,False,False,False,False,False,COMP1022Q,1000,,11.0,Basic formulae of Excel<br />Then head to VBA part<br />Not much hard concept.,He creates a very good atmosphere in every lesson by making jokes. He teaches very well as he always makes good explanation and demonstrations.,"Very little workload as lab work is very straight forward, only need to answer easy questions every lesson to get a bonus point.",Very good grading as all exams are open book exam.<br />Very easy to get A range if you try to do the past paper he gave and print out all the powerpoint and codes of the lab work.
4,5,5,5,True,True,False,True,False,False,False,False,False,COMP1022Q,1000,,11.0,Content is quite useful and helps you to get a bit of understanding of what programming languages are like.,He has a clear teaching style. Easy to understand.,Not much workload. But better attend labs so that you don&#039;t need to do the lab assignments by yourself.,"Not hard to get A. But make sure to get perfect scores on all lab assignments and review all ppts and that you can apply the knowledge in various situations. It is important if you can actually apply the theories into real life, unexpected situation, not the theories itself!"
5,5,5,5,True,True,False,True,False,False,False,False,False,COMP1022Q,1000,,11.0,VBA programming language specifically in Excel. An interesting although not entirely pragmatic course that teaches fundamental programming skills in entertaining ways. Content can pretty much be self-taught as it is not overtly difficult and his power points are concise and useful.,"By far the most entertaining teacher I&#039;ve had at UST so far. He has a quirky yet amiable sense of humor that makes the lectures seem to go by so fast. He frequently asks students questions pertaining to what he is teaching which can earn you an extra 0.5% to add on to your final grade if you get them right, or if he thinks you&#039;ve tried hard enough to answer. His English proficiency is in a whole nother category of its own in comparison to most UST professors.","Very managble. On average there is about one Lab assignment which can take 30mins to 2hrs depending on the specific one. Most require overlapping skills that are taught to you throughout the course so by the end of it you&#039;ll be easily able to complete the, without going to tutorials (they&#039;re optional).","You&#039;ll attain a good grade assuming you manage to score high on the relatively easy exams. Only issue would be that the means are so high that even small errors can cost you a while grade, but this in it of itself shouldn&#039;t be an issue as the questions asked in the Midterms and Finals are not that hard. Also the Lab assignments are provided to us with a mark scheme so its easy to check and predict your scores for them."
5,5,5,5,True,True,False,False,False,True,False,False,False,COMP1022Q,1000,1.0,11.0,"Before mid-term: basic excel (easy), and basic VBA<br />After mid-term: More difficult VBA",Rossiter 教得幾好，個人好funny，上堂氣氛好好，會上堂叫人答問題，唔識答唔緊要，答左會有bouns mark,workload 都叫輕鬆既，上堂去唔去都得，lecture同lab都唔會tick attendance，係你只要交齊lab work同final exam就得<br />啲lab基本上都比晒step你，得少部份要自己做，去齊lab基本上都找到滿分,"quite good, 有上堂 B range 唔難，但A range 少人拎到"
5,5,5,5,True,True,True,False,False,False,False,False,False,COMP1022Q,1000,0.0,11.0,"Easy content. Include basic VBA instruction and some excel function.<br />Pretty simple for those who have programming background or those who studied ICT in secondary school. Even if you have no previous knowledge , it is easy to catch up.",Good.David tries a lot to interact with the students and ask some questions.,Few easy assignments. Each take less than an hour to be done. Just follow the guidelines.,"Should be pretty good.<br />But due to university policy this semester, the final is canceled. Only assignments and mid term is counted. The cut off of the grades thus are high. <br />There are bonus mark in answering questions, these can be really helpful in achieving higher sub-grade."
5,5,5,5,True,True,False,False,False,False,False,False,False,COMP1022Q,1000,,11.0,a lot of basic stuff but really useful at the same time. actual programming starts in the second month.,"David is a wonderful professor, teaches in a funny way. there is a course website where you can find the materials for the course and teacher assistants will upload videos to assist in your labs.","only 5 compulsory labs I think, for the first 3 labs, the teacher assistants will go through them with you 100%","if you attend most of the classes, a b grade is guaranteed. Grades are based on midterms, finals, labs and additional questions asked by the professor during lectures"
5,5,5,5,True,True,False,True,False,False,False,False,False,COMP1022Q,1000,1.0,11.0,"一開始d 野比較簡單,當開始教vba嘅時候就會開始難.佢每堂都會有review questions,可以影低佢之後睇翻.","超好人,幽默風趣,有accent,但係係好清楚嘅accent,會聽得好清楚. 佢每堂都會問問題,會隨機搵人答佢問題,答錯唔緊要,唔會扣分.","有lab,個TA會同你一齊做一次個lab(除咗幾個hand in lab佢唔會做曬俾你睇). hand in lab 都會有marking scheme, 可以係交之前check 一次個marking.<br /><br />千其唔好只係將d code直接copy 落張cheat sheet度就算,一定要理解d code點解","靚grade, 但係要小心份卷會有d tricky 位, 睇清楚先好答."
5,5,5,5,True,True,False,True,False,False,False,True,False,COMP1022Q,1000,0.0,11.0,excel spreadsheat+ VBA technique<br />You will learn the logic behind the VBA programming. This course will be useful even to SBM students as they have to do a lot of analysis based on the stat or any stuff related to business intelligence,"I only attended lectures twice...<br />But the professor has a native accent that everyone can hear clearly.<br />Also, He is very funny and tries to create a vibrant teaching environment.",Very light<br />You just have to submit the lab assignment. 4 assignments in total.,"Overall: 100.5/100 ( 0.5 bonus mark)<br />Due to the situation of current Hong Kong, the final exam is canceled."
