rating_workload,rating_content,rating_teaching,rating_grading,has_midterm,has_final,has_quiz,has_assignment,has_essay,has_project,has_attendance,has_reading,has_presentation,course_name,level,upvote_ratio,insturctor_rating,comment_content,comment_teaching,comment_workload,comment_grading
5,5,5,5,True,True,True,True,False,True,False,False,False,COMP4211,4000,1.0,11,"Maybe we can start with a story: In Spring 2024-25, COMP4211 updates its prerequisite as a surprise, they added COMP3211 to the prerequisite to support the new AI major. Anyway, naturally, I decided to enroll COMP3211 at that time and because I had a time clash during COMP4211 time anyway.<br /><br />However, the prerequsite is then removed (to be enforced again in 2026 Spring -- they said (which is in fact, NOT enforced but only including COMP2211 as a prerequisite (reasonable in my opinion - Desmond&#039;s course is good anyway), and I can enroll (COMP2012 and stats/prob course only). Later, at the end of add drop period, my time conflict is also resolved. I enrolled COMP4211 on the last day of add-drop period. I was quite nervous as the first assignment is already there and I got 2 weeks to rush it (no skeleton code?) and the slides looks so intimidating (for a year 2, just finished COMP2211).<br /><br />Anyway, rip COMP4211 Fall 2025 waitlist... (full because people thought the prerequisite will change to include COMP3211 in the next semester, which creates a long chain of prerequisite)<br /><br />== Content == <br />In my opinion the course is indeed a very BFS (breadth-first search) of machine learning. You will be introduced to many topics and probably it helps your maturity (?) in understanding more advanced machine learning topics. I do wish there are more small implementation practice of each topics but well.. 2 big assignments + project is quite a lot no?<br /><br />Also, I generally recommend that you have COMP2211 background and linear algebra understanding (I took linear algebra in the same semester, but I learnt a good amount of it before) before taking the course.<br /><br />Anyway the content are as follow: (Prof hjx largely borrow slides from Prof DY, I think this is the standard machine learning course scope, maybe you can expect to see these in other offerings (after Prof DY retires...) and I think this topic scope is good)<br />Some of the topics are quite challenging for general CSE students (a lot of math to scare you in the slides - but actually they are not tested heavily. Or rather, actually they are OK topics, but the notations in the slides are just cryptic, so you can&#039;t really understand it by looking at the slides once)<br /><br />I will give some note one which one is math heavy and quite hard (with this topic scope, I think it generally starts off math heavy, and then relatively light after some time, and then slightly hard again around the end of the semester)... the course as a whole should not be too intimidating and should not scare you off.<br /><br />1. Linear Regression (You might recall this from your MATH2411 (if you did take it), but now we generalize this for n-dimension) - moderate amount of math<br />2. Logistic Regression &amp; Multiclass Classification - moderate amount of math<br />3. FFN (Feedforward Neural Network) - cryptic notations amount of math (compared to COMP2211), you may want to try deriving backpropagation once and write it on your cheatsheet for exams; multivariable calculus might help but not neccessary -- I think it was not tested math heavy in my semester<br />4. Deep Neural Network - moderate amount of math, it gets more chill from here<br />(from here on.. generally you won&#039;t see slides packed with equations except for SVM)<br /><br />5. Convolutional Neural Network - not too hard, COMP2211 repetition + explanation of ResNet<br />6. Recurrent Neural Network - not too hard, but note that the math expressions are to be cheatsheet&#039;ed -- just understand them on high level/heuristically is fine<br />7. Principal Component Analysis - moderate amount of math, please recall eigen{values,vectors} from linear algebra<br />8. Autoencoders - not too hard<br />9. Clustering - not too hard<br />10. GAN (Generative Adversarial Network) - moderate amount of math, mostly understand heuristically -- btw I find this part quite interesting, since this is the first time generative model is introduced<br />11. Transformers - moderate amount of math and unintuitive at first, really recommend watching: https://www.youtube.com/watch?v=eMlx5fFNoYc<br />12. SVM - Support Vector Machine (but actually just a hyperplane) - the most cryptic slides out of all - (quoting Prof hjx: &quot;No one really uses this nowadays&quot;) - need time to understand and please learn about plane equations if you haven&#039;t before -- but I don&#039;t think there is a need in understanding the equations fully<br />13. Decision Tree and Random Forest - not too hard","I think the teaching is the &quot;above average&quot; when you reach COMP4xxx courses (maybe same-ish quality as Prof DY). Prof hjx teaching is quite clear and he will provide pretty good amount of intution and interesting insights for each topics. I think he is also very welcoming to answer questions. <br /><br />Unfortunately, at this point of CS, I think Prof in general will not derive each equation for you in great detail. Prof hjx teaching pace is slightly on the slow side (He was slightly behind Prof DY&#039;s progress a few times.. 😅)<br /><br />I did write this review after taking Prof hjx COMP4901B (I think it&#039;s also another good course to introduce/BFS you to LLMs). His teaching style seems to be (review some part of the previous lecture for 20-30 mins), then start new topic.<br /><br />Just some side note but Prof hjx said a lot of &quot;out of scope&quot; (maybe because he usually teaches COMP5212 -- PG machine learning) and he did say &quot;out of scope&quot; and advertise COMP4901B when teaching about transformers.<br /><br />Piazza is useful for asking questions too - including for assignments - (asked lecture questions in batches a few day before the final exam, Prof DY thankfully answers me and clarified most of it)","I think you can read Grading<br /><br />The workload is in general more on the heavy side. But I think it&#039;s quite worth it.<br /><br />Anyway, just a note, I did COMP3511 and COMP3711 in the same semester. Still survived (?).","The grading is reasonable and quite good -- seems to be criterion referencing? But well the scheme is not a large amount in final exam<br /><br />== Grading Scheme and Assignment Comments ==<br />&gt; 10% Quiz ( There are usually 1-2 quiz per lecture, to be done on canvas after lecture -- but it is quite &#039;mean&#039; that there are no drop policy :( -- wrong 1 question will deduct final grade; there are about 20 quizzes.. but ok, most are easy if you understand the lecture) -- only those after add drop counts<br />&gt; 10% programming assignment 1<br />No skeleton code??? Write yourself on google colab from scratch... but questions are quite clear and reasonable. I actually end up even having sufficient time to do all the bonuses :) -- Please come to the tutorial if you want some guidance to do some part of the questions<br />&gt; 10% programming assignment 2<br />This semester it is about Joint Energy Model (another way of implementing generative model --- it&#039;s not explained it lecture at all and has strange equations -- but anyway I think this is expected in comp4xxx no 😅?)<br />&gt; 7.5% written assignment 1<br />Reasonable workload, if you do the written assignment you will have a thorough understanding of the lecture. There is a question to actually derive the n-dimension case of linear regression (so that&#039;s why the derivation is skipped in lecture)<br />&gt; 7.5% written assignment 2<br />Also reasonable workload, also helps to understand lecture topics<br />&gt; 15% project<br />So, here&#039;s the thing with this offering. I think when Prof hjx teaches COMP5212, he makes a kaggle competition. So now, instead of a free project, we have a kaggle competition. The task is about NER (Named Entitiy Recognition) in NLP.<br />To be honest, I am quite thankful that this is the case (I&#039;m quite bad at making good free project ideas), and it is good to have this &quot;guided&quot; experience to make a project, but I do think that the assignment makes me try many different approaches, only to realize that it&#039;s not the way it&#039;s supposed to be done at the end.<br />Me and my groupmate agreed that we should start gradually according to the topics introduced in class, we tried RNN, transformers, even find some embeddings online.. what happened? they indeed pass the baseline but it cannot surpass lower quartile of the competition😭. The solution? Go find a pretrained model on huggingface (time wasted on experiments: a lot). Yeah.. so that&#039;s how.. (anyway we did try different pretrained models too), even then I still get lower quartile for the kaggle competition. I get around mean because of the good report. Anyway, it doesn&#039;t matter because most people got 95+ grade in the project anyway.<br />The sad thing is that pretrained model is introduced slightly later when transformer is taught and there are no small examples to show us how to do fine-tuning (I just learned that this is a thing from the course -- the bitter lesson is I now understand how good they are).<br />Anyway, my general comment is a harder project is a good addition to the course (I do think I still lack ability to make AI projects because of this project scheme), but maybe make it as less stressful and give more guidance if possible.<br />&gt; 40% Final Exam<br />Under Prof DY, you can believe when he say there are not much math in the exam. There&#039;s even less math (but there is still some) compared to the written assignment. You do need to understand the heuristic view of all topics in general. <br /><br />However, the exam is very rushed (Prof hjx warned about this), there are about 12 MCQ (as the first question on all the topics) + ~10 long questions on almost every topic IN 2 HOURS!<br />This is the most time-packed exam I have ever seated.<br /><br />When I see the question (those with a lot of math and very looong) I was like: &quot;oh shoot - will I F this course?&quot; -- my general suggestion is to look at all questions first, and tackle those that looks easy, then come back to the questions you have skipped, for me it suddenly clicks (and because I have more time to think).<br /><br />The math-related questions are mostly on the first few topics on traditional machine learning. For the other questions, you can expect similar to written assignments in terms of difficulty. There are also True or False with &quot;provide reason&quot;<br /><br />At the end I still got time to double check everything :)<br /><br />=== Grades ===<br />My grade is in (...)<br /><br />Quiz: Wrong 2 out of all :) -- almost everyone got quiz correct (pls don&#039;t forget to do it even if you skip lecture, set an alarm or something if this is the case)<br />PA1: (100/100) [Mean=92.69, Lower Quartile=93, Median=99.5, Upper Quartile=100]<br />PA2: (100/100) [Cannot find for now, but expect classic PA distribution]<br />WA1: (100/100) [Cannot find for now, but generally close to full for everyone]<br />WA2: (100/100) [Cannot find for now, but generally close to full for everyone]<br />Project: (96.77/100) [Mean: 95, Lower Quartile: 93.18, Median: 95.5, Upper Quartile: 97.63] -- I guess need to put close attention to report too<br />Exam: (83.5/100) [Mean: 54.8, Lower Quartile: 39.5, Median: 53, Upper Quartile: 70.38]<br /><br />btw PA grading is more generous than expected, no need to be very concerned. Try to do all bonus if you can (can give +10 marks at max, but grade still capped at 100)<br /><br />This grade yields an A. (quite happy as a year 2 in this course I guess and considering all that had happened?)"
2,5,4,5,True,True,True,True,False,False,False,False,False,COMP4211,4000,0.0,11,,"Prof. DY’s teaching is very good. He explains concepts very clear, detailed with examples. <br /><br /><br />But DY has his own teaching style.<br />He puts emphasis on attendance<br />1. Lecture recordings only be released before add-drop, 1 week before midterm, semester ends.<br />2. Tutorial notes only will be released after classes.<br />3. <br /><br />But overall is very good<br /><br />But the TA Kai, Cindy, Siyuen…<br />Tutorials only can teach some programming skills which is only useful for PA.<br />Mr Kai teaches okay, not bad, can explain ideas well.<br />Miss Cindy also good.",,"Here is my score:<br />In class exercise: full<br />PA1: 95/100<br />PA2: 100/100<br />WA1: 97/100<br />WA2: 95/100<br />Midterm Exam: 79/100<br />LQ: 61<br />Mean: 67.14<br />Median: 70<br />UQ: 78<br />High: 96<br />SD: 16.68<br /><br />Final Exam: 59/100<br />LQ: 40<br />Mean: 52.9<br />Median: 53<br />UQ: 67.5<br />High: 89.5<br />SD: 17.8<br /><br /><br />Overall: 83.65%, A-<br />Yes, I fried the final exam as I am lower than UQ for a significant score. I think my final grade must be B+, but I got A- eventually, also is the last student in A-.<br /><br />Prof. DY must give at least 25% A-range, but whether give more than 25% is still beyond a question. Because the class contains of 99 students (1 student 1% of grading percentage), it will easily got rejected if A-range &gt; 25%."
3,4,5,5,True,True,True,True,False,False,False,False,False,COMP4211,4000,1.0,11,"This course has taught the topics shown below:<br /><br />1. Linear Regression<br />2. Logistic Regression<br />3. Feedforward Neural Networks<br />4. Deep Neural Networks<br />5. Convolutional Neural Networks<br />6. Recurrent Neural Network<br />7. Principal Component Analysis (PCA)<br />8. Autoencoders<br />9. Clustering<br />10. Generative Adversarial Network<br />11. Transformers<br />12. Support Vector Machines (SVM)<br />13. Decision Tree and Random Forest<br /><br />The subtopics in each topic may be discovered in 151044&#039;s review, you may check the link below: https://ust.space/review/COMP4211/view/wUWEeTf4qrduROlSAnf2kU4kwewhadvk<br /><br />In my opinion, some of the topics are not covered enough. Some important Maths concepts are not covered enough due to lack of Maths Background for CS students. Also, I think multivariable calculus is needed in order to learn Machine Learning stuffs, but CS requirements do not need MATH2011 or MATH2023. We cannot deeply understand the whole content of these ML topics. <br /><br />Generally, this course I will give a B for its content.","Professor D.Y Yeung is not bad. He explains the concepts well in classes. He is willing to answer questions after classes. However, most of the announcements are in posted in Piazza. So you need to read Piazza frequently. The TAs are responsible and they respond to our questions frequently. Therefore, the course arrangement is good and teachin quality is not bad. This part deserves an A.","The workload are the in-class exercises, two written assignments and two programming assignments, which is lower than before.<br /><br />There is no project in this semester, which is indeed replaced by midterm exam. The course therefore becomes less practical in general. The only practical things are the two programming assignments.<br /><br />The written assignments are indeed full of dry running but in exam the concepts examinated are lot deeper. Instead of relying on written assignments, you should Google or see some Youtube videos for deep understanding the content.","The course grading is criteria referencing (simply saying, norm-referencing in UST), said by DY. <br /><br />The grading scheme is as follows:<br />- 10% Inclass Quizzes<br />- 20% Written Assignments<br />- 10% Programming Assignment 1<br />- 15% Programming Assignment 2<br />- 15% Midterm Exam<br />- 30% Final Exam<br /><br />The grading scheme is a bit focused on written assignments and programming assignments. Therefore, you need to work well on daily assignments not to get a bad grade.<br /><br />The statistics for exam are shown below:<br /><br />Midterm Exam<br />- Lower Quartile: 61<br />- Median: 70<br />- Upper Quartile: 78<br />- Mean: 67.14<br />- Standard Deviation: 16.68<br />- High: 96<br /><br />Final Exam:<br />- Lower Quartile: 40<br />- Median: 53<br />- Upper Quartile: 67.5<br />- Mean: 52.9<br />- Standard Deviation: 17.8<br />- High: 89.5<br /><br />The midterm exam paper is distributed to us, which allows us to take paper home. This is not bad for us. But for final exam, there is no final paper checking since DY tells us that the primary purpose of the final exam is assessment rather than learning, he tells me individually that HKDSE does not allow for paper checking (but needs to pay money for reviewing), this is a pretty odd reason honestly.<br /><br />The final letter grade is pretty much surprising me. My midterm exam score is at Lower Quartile and my final exam is at Upper Quartile, with other assignment scores full yield a B+. However, my friend gets a total overall course score 0.45 higher than me and gets an A-. It is confirmed that the cutoff is between my score and my friend&#039;s score. Therefore, I am also depressed at the same moment.<br /><br />But overall. it is quite satisifying and so I give an A for grading part."
1,3,4,4,True,True,True,True,False,False,False,False,False,COMP4211,4000,,11,"Major Topics:<br />Linear regression<br />Logistic regression<br />Feedforward neural networks<br />Deep neural networks<br />Convolutional neural networks<br />Recurrent neural networks<br />Principal component analysis<br />Autoencoders<br />Clustering<br />Generative Adversarial Networks<br />Transformers<br />Support vector machines<br />Decision trees and random forests<br /><br />Overall, it provides a certain understanding of the basics of machine learning, but I feel that it is often filled with a lot of mathematical formulas without the instructor providing the derivation process in the PPT. As a result, I sometimes spend a considerable amount of time trying to understand the formulas.<br /><br />At the same time, I have to mention that for the midterm, the teacher allowed one double-sided A4 cheat sheet. However, for the final exam, which covers all chapters including those before the midterm, only one A4 cheat sheet is still permitted, and I just don&#039;t quite understand this.","Overall, the teacher&#039;s instruction is quite good, but I feel that the speed of speaking might be a bit slow, which often made me feel a bit bored at the beginning, and as a result, I basically stopped attending later on.","I feel that each PA contains too many tasks, with over ten or even twenty questions, each requiring some coding. There are also bonus questions, which overall takes a significant amount of time to complete each PA. Additionally, one PA takes about 20-30 minutes to run each time, which is quite time-consuming. WA is relatively more manageable. The workload for each PA is indeed a bit excessive.","Basically, with the help of some tools, PA, WA, and quizzes can easily score full marks. However, it&#039;s worth noting that sometimes there are two quizzes in one day, and I missed one because I didn&#039;t pay attention.<br /><br />Stats:<br />Midterm:<br />Mean: 67.14<br />Standard deviation: 16.68<br />Highest score: 96<br />LQ: 61<br />Median: 70<br />UQ: 78<br /><br />Final:<br />Mean: 52.9<br />Standard deviation: 17.8<br />Highest score: 89.5<br />Lower quartile: 40<br />Median: 53<br />Upper quartile: 67.5<br /><br />For me, final grade: B ( It&#039;s still somewhat acceptable since I haven&#039;t spent much time on this course myself. :))))&nbsp;&nbsp;&nbsp;)"
