rating_workload,rating_content,rating_teaching,rating_grading,has_midterm,has_final,has_quiz,has_assignment,has_essay,has_project,has_attendance,has_reading,has_presentation,course_name,level,upvote_ratio,insturctor_rating,comment_content,comment_teaching,comment_workload,comment_grading
1,3,5,5,True,True,True,True,False,False,False,False,False,COMP4211,4000,1.0,11,"I won&#039;t type out all the topics taught here as others have already done so. I think the scope is good. BUT the problem is that with most of the students lacking the necessary mathematical background (e.g. multivariable calculus and linear algebra[not the simple ones taught in MATH2111]) and not including courses like MATH2023 etc. as prerequisite, prof. just teach the simplest concepts for each topic. In the SVM part, you can even see there are almost no deviations for all the formulae in the notes, so you can basically only memorize or write them on your cheat sheet. This course, combined with 2211 and 3211 are just the basic intro. to the AI field, so if you want to dive deeper, take other AI courses (e.g. COMP4471, COMP4901[depends on what courses are available]) that are more specific in a certain area.<br /><br />Moreover, I don&#039;t understand with a double in the amount of topics covered in the final exam (compared to midterm, which stops at RNN), we are still only allow to bring one double-sided A4-size cheat sheet. By the way, to those who want/need to take this course, I highly recommend creating the cheat sheet by yourself cuz during which, you will need to read through all the notes and select the most important ones to write down. This process already helps you revise on the topics. Nowadays, with the help of LLM and the web, I don&#039;t think it will be hard to get real-time explanation on hard/unclear concepts.<br /><br />Furthermore, prof. says that the final exam is an assessment, not an opportunity for learning and he and the TAs cross-checked on the marking a few times, so no paper checking. I don&#039;t even understand this logic... At least give out the solution for people to have a chance to review on what they have done wrong.","Prof. explain things clearly. But after add-drop period, I have been struggling with the assignments of other courses (since I have FYP, COMP4471 and also COMP4901B [a LLM course]) so pretty much after CNN, I haven&#039;t listened to the prof. during lectures.<br /><br />At least for the first half of the course, I can&#039;t find unclear concepts and logical loopholes that I can challenge the prof. and require a clearing explanation or definition on terms (which I am able to during my 3211 the sem before (24-25 Spring)).<br /><br />I haven&#039;t gone to tutorials so I can&#039;t comment on the quality of the tutorials.","Three weeks are given for each assignment.<br /><br />Bonus parts exist for you to recover the missing points that you have made in the normal parts, cap at 100, i.e.<br />your PA final mark = min(total marks you earned in PA, 100)<br /><br />Besides coding, there are also some inline written questions for the PAs. As a side note, in my case, one bonus inline question in PA2 requires some explanation using some linear algebra derivations, such as span, column spaces, etc. So you probably need to pick up the math knowledge that you have learned before when answering these bonus parts. They don&#039;t care about your background so you may even see something out of syllabus.<br /><br />If you exclude the bonus part for PAs, then the PAs are manageable.<br /><br />If not, a total disaster. For PA1, you need to build the whole thing by yourself. No skeleton code is given. For PA2, it is the first time designed by the UGTAs. Yes, UGTAs. So a lot of mismatch between the guidance and the marking scheme. Also, you would need to start this one as early as possible. Since I completed the whole bonus part to play safe, this takes up all 5 GPU hours free quota on Colab so either you have your own GPU or you need to open multiple accounts to do it. I don&#039;t understand why the teaching team does not reserve some GPUs from the department/ITSC for this, which my COMP4901B lecturer did.<br /><br />For the WAs, it is okay if you understand the concepts well but the workload depends on your personality. If you are striving for perfection for your answers like me, the problem is that they never expect you to think deeply and thoroughly, unlike 2711 and 3711. I use the 2711 and 3711 way (i.e. defining a bunch of notations to get a mathematical representation of something, etc.) to answer the questions, which is extremely tedious and leads to twenty something pages for each WA. Their solution is just 4-5 sentences for each sub-question...","According to prof. &#039;s answer on Piazza, this course is not using norm-referenced grading. (So I assume absolute grading?)<br /><br />They are generous in grading.<br /><br />I guess almost every student should get full marks on the PAs and WAs, given that they have put some effort in finishing these assignments. Yet, I do not understand why only the PAs have bonus part but not for the WAs. Isn&#039;t coding much easier compared to writing for engineers?<br /><br />With the help of AI chatbots and searching in the lecture notes, I also don&#039;t think the in-class quizzes would be a problem. These quizzes are on Canvas during the lecture period and act as a mean of taking attendance, so you can basically skip some of the lectures if you do not have the time due to midterm or hw. BUT the thing is that the correctness of the quizzes matters... I don&#039;t even understand why.<br /><br />So the only places that differentiate you from other students will be the 2 exams (No project this sem). Even with cheat sheet, the math is mostly not assessed (except the part for calculating number of params, output sizes). You will be tested on your understanding on the concepts. For example, something like will changing the margin lead to a change in the hyperplane, will K-Means give zero SSE given a certain condition. You will need some logical deductions based on clear conceptual understanding to arrive at the answer, so good luck on this part! The part the cheat sheet can help you is answering something like what will be the impacts of applying such techniques, what techniques can be used to reduce overfitting.<br /><br />For both exams, I get the UQ and for others, I get the full marks, so if prof. is really generous, I could possibly get a A-.<br /><br />Stats:<br />Midterm:<br />Mean: 67.14<br />Standard deviation: 16.68<br />Highest score: 96<br />LQ: 61<br />Median: 70<br />UQ: 78<br /><br />Final:<br />Mean: 52.9<br />Standard deviation: 17.8<br />Highest score: 89.5<br />Lower quartile: 40<br />Median: 53<br />Upper quartile: 67.5<br /><br />The following is for your reference, I am still struggling with 3 deadlines during the study break. So I am left with only 2 days (only sleep for 2-3 hrs) to revise the 14 topics and build the cheat sheet. I cannot judge my ability among all students taking the course but based on my past experience, I am roughly floating at UQ for most 3000-4000 CS courses, unless those I am interested in (like 3111H). So hope this give you an approximation on how much time you need to spend on revision.<br /><br />Edit: Got an A."
4,5,4,3,True,True,True,True,False,False,False,False,False,COMP4211,4000,1.0,11,"I do not recommend this course.<br /><br />I give this an A simply in comparison with my review of 3211 and the width of the topic. The depth of which the content is explored or discussed honestly warrant a B or C in my opinion.<br /><br />Detailed list of content is exactly the same as the past offering so it will not be repeated here.<br /><br />In almost every topic, you can feel that DY cannot teaches the whole thing due to the math foundation of an average CS student (or rather, the lack thereof). This renders almost all theoretical explanation or discussion extremely weak. <br /><br />For example, the explanation of linear regression uses the manual and tedious calculus based approach (which arguably uses more math to justify) instead of the much more elegant and easy pure linear algebra proof. If the easiest topic in the course have such weak exploration and math foundation, then i think you can imagine how nonexistent the other math used in the course really is...<br /><br />As a result, many of the topic becomes extremely shallow and have a math &quot;explanation&quot; that is no different to gibberish to people with no foundation, to me,&nbsp;&nbsp;the (despite the possibility of proper explanation) (looking at you SVM)<br /><br />So, what this course teaches is really just yappy empirical results that you basically just takes the prof&#039;s word for, which is extremely unsatisfactory and makes your understanding no better than chatgippity with a Medium subscription.<br /><br />I highly recommend any one who wishes to actually learn machine learning to take many of the other available courses like math 4432 or comp 4471.... This course really feels more like 2211 honours than anything....","The notes is clean and concise without missing the point most of the time (with some pointer to additional content which i really appreciate). But require some own work to fill in the gap. <br /><br />This is fine until you consider many of them would be impossible to fill without either trusting google search result or learning at least some semesters of actual math to understand.<br /><br />As a result, it is mostly just superficial understanding of almost all topic which i really hate<br /><br />Can&#039;t say anything about the tutorial as i basically never went.","Without the project, the whole course is honestly wholly trivial. <br /><br />The written assignment is fairly easy and is just dumb dry run or basic concept checks.<br /><br />The programming assignment is mostly just figure out how to use tensorflow then use tensorflow correspondingly. This is more just frustrating and time wasting and I do not feel like I have learnt much of anything in this course.<br /><br />Honestly this course should have a third written and programming assignment now that the project is gone...<br /><br />Like, the whole course already have no resemblance to being theoretical. Now you don&#039;t even have good assignments to make it practical... What&#039;s the point of taking this course anymore","There is midterm in this course now (presumably to test out a project-less structure for the new AI major)<br /><br />Grading scheme:<br />n-class quizzes: 10% (only scores after add/drop period are counted)<br />Programming assignments: 25%<br />Written assignments: 20%<br />Midterm exam: 15%<br />Final exam: 30% (missing the final exam will fail the course)<br /><br />Needless to say, this grading scheme is extremely unbalanced. Considering PA and written everyone will get near full mark, it makes missing quizzes extremely punishing in comparison to the midterm and the final.<br /><br />Midterm:<br />Mean: 67.14<br />Standard Deviation: 16.68 <br />Highest: 96<br /><br />Final:<br />TBA"
2,4,3,4,True,True,True,True,False,False,False,False,False,COMP4211,4000,,11,I have not much complains on the content. It goes into some very complicated math. For me it is understandable. But you really need to read them carefully. Try use GenAI and ask questions about concept you don&#039;t understand. There are also YouTube videos to understand part of the concepts. They help a lot.<br /><br />1. Linear Regression<br />2. Logistic Regression<br />3. Feedforward Neural Network<br />4. Deep Neural Network<br />5. CNN Convolutional Neural Network<br />6. RNN Recurrent Neural Network<br />7. PCA Principal Component Analysis<br />8. Autoencoders<br />9. Clustering<br />10. GAN Generative Adversarial Network<br />11. Transformers<br />12. SVM Support Vector Machines<br />13. Decision Trees and Random Forests,"Professor is fine. His voice is quite low at times but his teaching is at least understandable. He goes pretty slowly with the lectures and explains them in detail. I think it is worth attending them.<br /><br />The tutorials are pretty meaningless. The first few tutorials were really good though. Kai Chen explains the concepts while also shows the code in python. It helps us a lot when we try to build a model or work on PA1. Other than that, the tutorials are not worth attending at all. I will talk about PA2 in workload. They not only didn&#039;t explain the concepts clearly, their accent plus the voice really not good at all. It really is just recap of the lectures. If you have questions to ask, go to piazza. That might be another issue which I will mention in workload also.","Written Assignment is easy. There is one question that is really hard to do though. My hint is to ask students who have taken this course before.<br /><br />PA1 is moderate. Is pretty much the same as previous semester. <br /><br />PA2 is an another story. They didn&#039;t manage the assignment well at all. The instruction is very unclear. Like there was a few questions where I had to complete functions given in the skeleton code, BUT IT WASN&#039;T EVEN THERE IN THE FIRST PLACE! I asked that question in Piazza and it took them 5 days to answer. IF THEY DIDN&#039;T POSTPONE THE DEADLINE, I WOULD HAVE GOTTEN A VERY LOW SCORE. The models also took me so loooong to finish training. I have faced many times where Colab has used up all the GPU and I have to either make another account so I can run in GPU again or use CPU which takes about half a day if not more than that to finish train a single model. Imagine if it suddenly lose connection? Well good luck on rerun the codes again! What a disgusting thing I have to deal with. Please don&#039;t do this to future students I beg!!!!!!!! I thought these assignments are for better understanding on ML. NOT A QUEUEING SIMULATOR!!!!!!!!!<br /><br />Also, there are bonus parts for you to complete optionally. They don&#039;t give you extra points. But it ensures you to get full mark from the mistakes in the main part. Some are out of syllabus. It is not too crazy for me as I have learnt some slightly more advanced probability and statistics.",Not sure if it is good. Will update on this.<br /><br />10% In-class quizzes<br />25% PA<br />20% Written Assignment<br />15% Mid Term<br />30% Final Exam
3,3,3,3,True,True,False,False,False,False,False,False,False,COMP4211,4000,,11,"Course is detailed in ML concept ranging from Linear Regression to CNN, RNN, Transformer and other. Lots of overlapping content with COMP 4471 though this is slow paced and more detailed.","Pretty good as the professor go through every line of slide and explain everything in details. <br />If provided enough attention in class, not difficult to understand the subject matter although it can be mathematically intensive.",Not much if you have previously basic understanding of Machine Learning. Just need to go over lecture slide and just some practice would be sufficient.,"40% of grade comes from quiz , and Homework. The homework have 2 assignment and 2 project although it changes from semester to semester. Homework are straightforward but midterm requires deep understanding of subject matter."
3,5,5,4,False,True,True,True,False,True,False,False,False,COMP4211,4000,0.8888888888888888,11,"I checked some reviews from 24-25 Fall. I think the syllabus is mostly the same and those reviews are good enough. Please check them instead if you are interested in the content part. I think the content are well prepared and rewarding.<br /><br />One insteresting thing is that I found the syllabus of COMP 4471 is very similar to COMP 4211. Actually, I dropped 4471 because 4211&#039;s teaching is much better :)","Both Prof. He Junxian and Prof. Yeung Dit Yan are good (I went to both sessions in this week). Personally, I prefer Prof. He. I will give some details below.<br /><br />Prof. He&#039;s lectures may be one of my best learning experience in UST. I found his lectures very exciting and fruitful, without wasting a single minute. You can tell from his lecture that he is not only very knowledgable in this field, but also good at presenting. He likes to give many examples to make the concepts easier to understand. His lectures are fast-pased, and he usually add more content that is out of the slides (he also distribute his own slides which has some extra pages). The quality of his lecture really make me feel that I&#039;m studying in MIT in Aisa XD.<br /><br />Prof. Yeung, compared to Prof. He, tends to stick to the slides more and give slower and more detailed (sometimes seeming unnecessary to me) explanations. He always explains things very clearly. As for me, however, I found his tone a little bit to flat and the pace is somehow too slow, which makes me sleepy (or maybe because his lecture is earlier &gt;.&lt;). But I&#039;m sure many people would like his lectures. <br /><br />In general, they are both good, kind and devoted to teaching, but I would recommend Prof. He if you can catch up and feel comfortable with more fast-paced lectures.<br /><br />By the way. I think Prof. He may be one of the three instructors that I like the most at HKUST so far. The other two are Desmond (usually teaches 2012/2211, and 1023 in the next semester) and Sunil (usuallly teaches 2711H/5712). For these three good guys, I would enroll their classes even though I may not be very interested in the content, just because they are teaching. (Yes, I&#039;m doing commercial :D)<br /><br />For the tutorial part, I think the TAs did not do a good job, at least in the add-drop period. Few people listen to them and the tutorials are not so helpful. I would prefer learning by myself. Good news is that there is no attendance for this part.","I think it depends. The workload is high undoubtedly, but it can still vary depending on what courses you have taken before. The official pre-requisites of the course are:<br />- [Before Spring 2026]<br />{COMP 2012 AND a statistics/probability course}<br />- [Starting from Spring 2026]<br />{COMP 3211 AND a statistics/probability course}<br />However, I think those are not enough. I think the courses/content below will help you understand the content or tackle the programming parts of this course and therefore reduce your workload. If you don&#039;t have any of them, then you may have a very hard time.<br /><br />- A python programming course (necessary)<br />Of course I don&#039;t mean COMP 1021. That one is too simple, sometimes naive. I think you will need COMP 1023 (starting from Fall 2025) or COMP 2211 here. They will equip you with the necessary skills that you will need in PAs and project.<br /><br />- A linear algebra course (necessary)<br />I think this is VERY important. In lectures, they may assume that you have learned linear algebra and use things like inner product of vectors and also matrix multiplication. Actually, linear algebra is a fundamental tool in ML. If you don&#039;t know any linear algebra, you may run into big trouble and miss some beautiful ideas.<br /><br />- Some statistics/probability knowledge (maybe necessary)<br />I think you don&#039;t need a whole course for this part. Considering the syllabus of MATH 2411 and MATH 2421 only have a little part of overlap in the basic things, I think what needed in this course is also basic. Anyway, I haven&#039;t seen the need to take a whole MATH 24x1 for this course. However, now that they put it in the prerequisite, I think you&#039;d better take one. (they rejected a lot of waivers this semester)<br /><br />- Some multivariable calculus knowledge (not that necessary?)<br />MATH 2011 / MATH 2023 is good. I find it helpful in gradient descent part.<br /><br />- Some basic ideas about AI (not necessary but I would highly recommend)<br />COMP 2211 is good enough for this part. If you take it before 4211, you will find some content of 4211 easier to understand. Things you learn in 2211 labs and PAs will also help you in 4211.<br /><br />You may have noticed that I didn&#039;t mention COMP 2012 and COMP 3211, which are in the old/new official prerequisites. Actually, I can&#039;t see any point to put them in the prerequisite. For OOP, one of COMP 1023 or 2211 is definitely enough. For AI basics, COMP 2211 will be enough (and even better than COMP 3211, which is actually more about some old things). Anyway, try to be used to the unreasonable prerequisites in UST :(<br />(Extra note: it seems that they will not approve any waivers for COMP 3211 in the future, so make your plans early)<br /><br />---------<br />p.s. Well, should I write all these things in the workload part? &gt;.&lt;","I&#039;m writing the review at the beginning of the semester, so I&#039;m not able to write about the distribution and so on. I will provide some general descriptions below:<br /><br />- In-class quizzes: 10%<br />1-2 MC on canvas quiz. Basically the things that are taught in the lectures. Actually this is not really in-class because you can finish them after class. (In this semester, L1 by Prof. Yeung is at TuTh 9:00-10:30 and L2 by Prof. He is TuTh 10:30-12:00. The quiz is due on 14:00 on the same day of each lecture. Don&#039;t forget to do it after class!) However, there is one problem. The quiz questions seem to be made by Prof. Yeung and some of the content is only mentioned in L1 but not L2. Sometimes this is annoying. Most of the questions are easy, though.<br /><br />- Written assignments: 15%<br />Haven&#039;t started yet.<br /><br />- Programming assignments: 20%<br />PAs are somehow crazy and time-consuming. PA1 is basically about using some popular python libraries such as pandas, matplotlib and sklearn. However, you should write everything from scratch and tackle many many problems. It also needs a report. Make sure you start early.<br /><br />- Group project: 15%<br />Each group contains 2 people. The project is a kaggle competition about name entity recognition in NLP. You can choose any model you like. Your score will depend on the rankings on kaggle. However, most people got very close scores here because the f1 score of everyone&#039;s models are pretty close.<br />Actually, I think the project part can be improved, because it seems that almost everyone ended up in fine tuning pretrained models. The various models you learn in lectures are somehow all useless with the dominant solution just there.<br /><br />- Final exam: 40% <br />2 hours, closed books with 1 cheatsheet. Time is very limited because there are so many questions. The form of the questions are like the quiz and written assignments. I cannot make many comments here because they did not allow us to check the papers, so I have no idea where I got wrong.<br /><br />No midterm! Yay~~~<br /><br />---<br /><br />I think most of the people got close to full in quiz, PAs, written assignments and even project, so the course is somehow all in final. I have to say I don&#039;t like this scheme.<br /><br />I forgot 2 quiz, got full in all PAs and written assignments, 99.6/100 in project and 72/100 in exam. The letter grade is A-. I guess they give close to 25% A range because my final score is just above UQ."
