rating_workload,rating_content,rating_teaching,rating_grading,has_midterm,has_final,has_quiz,has_assignment,has_essay,has_project,has_attendance,has_reading,has_presentation,course_name,level,upvote_ratio,instructor_rating,comment_content,comment_teaching,comment_workload,comment_grading
5,5,5,5,False,True,False,True,False,False,False,False,False,COMP1029P,1000,,11,simple python knowledge. If you have experience of computer since you will know how to deal with the content easily.,"idk since this class only have PPT, you need learn all the contents by yourself.","The workload of this class is only few labs. It would not take you much time.&nbsp;&nbsp;The coding is easy, you only need 10~20 min for a lab","This class only have pass or fail, so the grading is not a issue. You can get a Pass if you get 60 in the final exam."
5,5,5,5,True,True,False,False,False,False,False,False,False,COMP1029P,1000,,11,"This is an excellent, low-pressure course designed specifically for individuals with prior programming experience who need to quickly get up to speed with Python. It successfully serves its purpose as a bridging or starter course, providing a smooth transition into the language without overwhelming the student.<br /><br />The content is well-structured, progressing logically from fundamental programming concepts (like variables, functions, and control loops) to more advanced Python-specific topics. The curriculum doesn&#039;t waste time on absolute programming basics, instead focusing on how to apply existing programming knowledge within Python&#039;s syntax and paradigms. The guided programming exercises are particularly effective, reinforcing the self-learned material from the provided resources.","The purely online format is executed very well. Course materials are clearly organized and accessible, allowing for self-paced learning. The structure supports independent study while providing the necessary guidance through exercises and, presumably, instructor availability for questions. It&#039;s an ideal setup for someone who is disciplined and prefers flexibility.","The workload is accurately described as light. The requirement of approximately one lab or exercise set per week is very manageable, even for students balancing other commitments. This makes it possible to engage meaningfully with the material without it becoming a significant source of stress.","The Pass/Fail grading scheme is one of the course&#039;s best features. It removes the anxiety associated with letter grades and allows students to focus purely on learning the material. As noted, the grading is fair and the course is designed for success; anyone who engages consistently with the weekly exercises is virtually assured of passing. This creates a supportive and positive learning environment."
4,5,5,5,True,True,False,False,False,False,False,False,False,COMP1029P,1000,,11,"The course covers the fundamentals of Python programming in a step-by-step manner. Topics include variables, lists and strings, loops (for and while), functions, recursion, file input/output, and an introduction to object-oriented programming. There are also some small projects like Conway’s Game of Life and using turtle graphics to draw trees, which make the material a bit more engaging compared to just reading.","Since this is an online bridging course, there are no traditional lectures. All the material is provided on the CSE website, and students are expected to go through it independently. The explanations are simple and direct, so beginners should be able to follow without too much difficulty. However, because there is no real teaching or live guidance, you need to be self-disciplined. If you are juggling multiple other courses or responsibilities, it can feel harder to keep up.","The workload is moderate. While the overall content is manageable, some exercises can be time-consuming, especially if you are completely new to programming. If you plan your time well and steadily work through the material, you should be fine.","This is a pass/fail course. The requirements are:<br /><br />Submitting at least three out of four exercises and achieving 60% overall for them.<br /><br />Scoring at least 40% in the final exam.<br /><br />The final exam is not very difficult, and most students can pass if they’ve done the exercises."
5,5,5,5,False,True,False,True,False,False,False,False,False,COMP1029P,1000,1.0,11,"Lesson 1 - Introduction to Python<br />Lesson 1.1 - Getting Started with Python<br />Lesson 1.2 - Variables<br />Lesson 1.3 - Strings and Lists<br />Lesson 1.4 - Booleans<br /><br />Lesson 2 - Essential Programming in Python<br />Lesson 2.1 - Functions and Making Decisions<br />Lesson 2.2 - Variable Scope<br />Lesson 2.3 - For Loops<br />Lesson 2.4 - While Loops<br /><br />Lesson 3 - 2D Arrays and the Game of Life<br />Lesson 3.1 - Two Dimensional Arrays<br />Lesson 3.2 - Conway&#039;s Game of Life<br />Lesson 3.3 - Print, Clear Screen and Delay<br /><br />Lesson 4 - Advanced Features<br />Lesson 4.1 - Dictionaries<br />Lesson 4.2 - User Input and Dealing with Errors<br />Lesson 4.3 - File I/O<br /><br />Lesson 5 - Recursion and Object-Oriented Programming<br />Lesson 5.1 - Recursion<br />Lesson 5.2 - Turtle Graphics<br />Lesson 5.3 - Drawing Trees<br />Lesson 5.4 - Introduction to Object-Oriented Programming",所有材料擺哂上Canvas<br />唔會用任何face to face堂<br />自己搵時間睇就得<br />Concept都解釋得好清楚<br />Example都足夠<br />淺白易明,Total有4份exercise<br />一個exercise一個mini game/application<br />平均2-3個星期一份exercise要做<br />如果諗唔到點做可能要用多少少時間研究下<br />個template已經做好一部份<br />基本上只係fill in the blanks<br /><br />考試係online + open book<br />一個鐘20題<br />臨考前一晚睇一睇D syntax用法就ok<br />會有MC題同fill in the blanks<br /><br />總括而言個workload唔大,P/F Course<br />4份Exercise總分最少要60%<br />Final Exam總分最少要40%<br /><br />Exercise for Lesson 2 (Scrabble Word/Letter Score): 100/100<br />Exercise for Lesson 3 (The Game of Life): 100/100<br />Exercise for Lesson 4 (A Phone Book Database): 100/100<br />Exercise for Lesson 5 (Recursion Tree): 100/100<br /><br />Final Exam: 75/100<br /><br />Grade: P
3,3,2,4,False,True,False,True,False,False,False,False,False,COMP1029P,1000,0.5,11,Basic python.<br /><br />Introduction to Python<br />Essential Programming in Python<br />2D Arrays and the Game of Life<br />Advanced Features<br />Recursion and Object-Oriented Programming,Just reading. Google is more useful.<br />Do more yourself.,"The sample final is ridiculously simple compared with the online final I took. DO NOT TRUST THAT!!!<br />20 questions 1 hour, 3 min for one, haha. It reminded me of the JAVA, 1022p final. The questions the codes are longer than the sample. The sample only has 13 questions and it is much simpler than the online final. I trusted it and I didn&#039;t be that careful while reviewing. <br />If you prepared this final as I did, then it is quite easy to GG.","Mysterious.<br />This 1 credit course, according to its final exam, seems to require we put in a similar amount of effort as the 1021 3 credit course.<br />Mean of the final exam was 59.7/100 this semester."
5,4,4,5,False,True,False,True,False,False,False,True,False,COMP1029P,1000,,11,"Course contents are given in 5 weeks:<br />*Lesson 1: Basic Python syntax, variables, strings, lists, boolean operators<br />*Lesson 2: Function writing, variable scope, for and while loops<br />*Lesson 3: 2D arrays, print and clear screen, delay function<br />*Lesson 4: Dictionaries, user input, try-except-else, file I/O<br />*Lesson 5: Recursion and turtle graphics<br /><br />When compared with what is taught in COMP1021 (the regular Python introductory course), I think COMP1029P retains most of the contents of COMP1021.<br /><br />As most Python learners will tell you, Python is actually quite easy to learn. (Professing it is another issue tho) When comparing the difficulties of learning Java in COMP1022P as a newbie at that time (in which I took in Fall Sem in 2021), Python is really much much easier...<br /><br />And as usual with other programming classes, practice helps, especially considering the fact that COMP1029P is a self-learning course. In general, the course is quite a nice filler course for the long holidays to keep your brain running.","Same as what you&#039;ve seen on the class schedule and others said, this is a self-learning course. Course contents are given on a weekly basis (and you can&#039;t access future contents). The emails of both Professor Lam and the TA (Peter Chung) is given for students to ask questions.<br /><br />Professor Lam gives helpful responses regarding courses, and this even extends to some more out-of-scope contents: for example, he responded to my question why Python file I/O don&#039;t work for Microsoft Word--on Sunday, which I didn&#039;t expect.<br /><br />On the other hand, when I asked for a technical problem on one of my assignment, Peter Chung insisted that my code is wrong, and his responses only increased my confusion instead of clarifying my question. What&#039;s next? I still get full marks for that assignment the next day.<br /><br />That said, as I only have 2 occasions to contact the professor and TA with email, my opinions here may not be too representative.","In general, nearly zero workload (though more workload than spam courses like PHYS1003).<br /><br />There are a total of 4 assignments since week 2, and you are given with a week to deal with each of them. In fact, they are so easy that I can finish all of them within 2 to 3 days after the assignment is released.<br /><br />There will also be 2-3 review questions per week, designed to encourage practicing the course content. While all of them won&#039;t count towards the final grade (?), review questions for week 2 is a component part of the week&#039;s assignment.","Like other COMP1029* courses, COMP1029P adopts the pass-fail mechanism. You get a pass if you get more than 60% for the mean of all assignments, and 40% for the final exam. For me, I get full mark for all assignments, and scored of 75/100 for the final exam.<br /><br />The professor also claimed that there should be enough easy questions in the exam, which is true per my experience. At the end at least one guy failed miserably (?*2) at a score of 38 for the exam, showing even those who performed bad in programming may even have a chance to pass this course.<br /><br />While meaningless to a course which don&#039;t pull the curve, most of the homeworks have a mean of over 80%, and the exam&#039;s mean is 76.92/100."
5,5,5,5,False,True,False,True,False,False,False,False,False,COMP1029P,1000,,11,some elementary syntax about python. also introduce some more advanced features(OOP/recursion) in the last part of the course.,it&#039;s based on a self-learning website. nothing much to comment about.,the workload is adequate for a 1-cre course.<br />There&#039;s an easy assignment once a week and a total of four of them. simply follow the web instruction and it should be done in one or two hours.,"it&#039;s a P/F course. <br />need to get at least 60% out of 100% of the assignments and 40% of the final exam to pass.<br />I feel like if you do understand the content, it&#039;s easy to pass."
5,5,5,5,False,True,False,True,False,False,False,False,False,COMP1029P,1000,1.0,11,"Lesson 1 Introduction to Python<br />Lesson 1.1 Introduction<br />Lesson 1.2 Variables<br />Lesson 1.3 Strings and Lists<br />Lesson 1.4 Booleans<br />Lesson 2 Essential Programming in Python<br />Lesson 2.1 Functions and Making Decisions<br />Lesson 2.2 Variable Scope<br />Lesson 2.3 For Loops<br />Lesson 2.4 While Loops<br />Lesson 3 2D Arrays and the Game of Life<br />Lesson 3.1 Two Dimensional Arrays<br />Lesson 3.2 Conway&#039;s Game of Life<br />Lesson 3.3 Print, Clear Screen and Delay<br />Lesson 4 Advanced Features<br />Lesson 4.1 Dictionaries<br />Lesson 4.2 User Input and Dealing with Errors<br />Lesson 4.3 File IO<br />Lesson 5 Recursion and Object-Oriented Programming<br />Lesson 5.1 Recursion<br />Lesson 5.2 Turtle Graphics<br />Lesson 5.3 Drawing Trees<br />Lesson 5.4 Introduction to Object-Oriented Programming","Self-learning<br />Actually, if you study all the material, you can pass.<br />There are some exercises or questions will ask you after the materials. If you do all the materials, passing the course is not a problem. Overall, there is no teaching and it just depends on you. However, if you want to study python from this course, it will be hash when you have too many things to do or study another course in winter.<br />Also, you just learn the simple and basic overview in this course so it may not be suitable for people who want to study python deeply. Maybe the regular 3 credits course will suit for you.","The workload is not too much but some exercises are actually used up lots of time. If you want to study this course, you need to keep your time free. If you study it with other courses or you have other things need to do, you may have difficulties to chase your time.","To pass the course, you need to:<br /><br />1. Submit at least three exercises and achieve 60% out of 100% of the four exercises altogether<br />2. Get at least 40% in the final exam at the end of the semester"
5,4,4,5,False,True,False,True,False,False,False,False,False,COMP1029P,1000,,11,"A introductory course for students who are interested in Python as Python is getting popular in the computer world, especially for Deep Learning development. However, this course is way from sufficient for those keep learners. But considering the short duration, amount of content is acceptable.","Though videos are already available for demonstration, especially those assignments, it will be even better if videos are also available in course content given the current teaching method is almost texts, making it a bit boring and not friendly to beginners.",4 lab exercises in total with 1 final exam within the one month duration in Winter semester.,"A course with only Pass or Fail.<br /><br />To pass COMP1029P, you have to fulfil following requirements:<br />1. on average, 60% or higher of the 4 exercises total mark (at least to submit 3 exercises)<br />2. 40% or higher in the final exam"
5,5,5,5,False,True,False,True,False,False,False,False,False,COMP1029P,1000,1.0,11,"A nice introduction to Python. Since Python is dynamically typed, compared to languages like Java and C++, Python is generally more liberal and easier to write. Thus IMHO transitioning from Java/C++ to Python is, in general, easier than vice versa.<br /><br />Topics included:<br />1️⃣ Introduction to Python<br />&nbsp;&nbsp;&nbsp;&nbsp;&nbsp;&nbsp;🔶 Introduction<br />&nbsp;&nbsp;&nbsp;&nbsp;&nbsp;&nbsp;🔶 Variables<br />&nbsp;&nbsp;&nbsp;&nbsp;&nbsp;&nbsp;🔶 Strings and Lists<br />&nbsp;&nbsp;&nbsp;&nbsp;&nbsp;&nbsp;🔶 Booleans<br />2️⃣ Essential Programming in Python<br />&nbsp;&nbsp;&nbsp;&nbsp;&nbsp;&nbsp;🔶 Functions and Making Decisions<br />&nbsp;&nbsp;&nbsp;&nbsp;&nbsp;&nbsp;🔶 Variable Scope<br />&nbsp;&nbsp;&nbsp;&nbsp;&nbsp;&nbsp;🔶 For Loops<br />&nbsp;&nbsp;&nbsp;&nbsp;&nbsp;&nbsp;🔶 While Loops<br />3️⃣ 2D Arrays and the Game of Life<br />&nbsp;&nbsp;&nbsp;&nbsp;&nbsp;&nbsp;🔶 Two Dimensional Arrays<br />&nbsp;&nbsp;&nbsp;&nbsp;&nbsp;&nbsp;🔶 Conway&#039;s Game of Life<br />&nbsp;&nbsp;&nbsp;&nbsp;&nbsp;&nbsp;🔶 Print, Clear Screen and Delay<br />4️⃣ Advanced Features<br />&nbsp;&nbsp;&nbsp;&nbsp;&nbsp;&nbsp;🔶 Dictionaries<br />&nbsp;&nbsp;&nbsp;&nbsp;&nbsp;&nbsp;🔶 User Input and Dealing with Errors<br />&nbsp;&nbsp;&nbsp;&nbsp;&nbsp;&nbsp;🔶 File IOs<br />5️⃣ Recursion and Object-Oriented Programming<br />&nbsp;&nbsp;&nbsp;&nbsp;&nbsp;&nbsp;🔶 Recursion<br />&nbsp;&nbsp;&nbsp;&nbsp;&nbsp;&nbsp;🔶 Turtle Graphics<br />&nbsp;&nbsp;&nbsp;&nbsp;&nbsp;&nbsp;🔶 Drawing Trees<br />&nbsp;&nbsp;&nbsp;&nbsp;&nbsp;&nbsp;🔶 Introduction to Object-Oriented Programming<br /><br />The unique features of Python include data structures like lists and dictionaries, and also the way to subset strings and lists using slicing notations. Some elements of Python such as tuples, sets, and lambda functions are not covered, but this is acceptable for an introductory bridging course.","Just like other COMP1029 bridging courses, there are no face-to-face lectures and all materials are offered online. The content is well structured and clearly delivered, so you should find no problem understanding the course content.",4 petty assignments and a final exam. Skeleton codes are provided in the assignments and our work was just to fill in a few lines of code. These should be easy jobs for most of us.,Pass or fail.<br /><br />Need to get above 60% overall in the assignments (by finishing at least 3 out of 4 of them) and 40% in the final exam. These should be a piece of cake as soon as you pay attention to the deadlines and revise for the exam.
5,4,4,5,False,True,False,True,False,False,False,True,False,COMP1029P,1000,,11,"The content includes basic data type, arrays and dictionaries, for loop and while loop, input and output handling and basic recursion.","This is an online course, which means that there is no lecture. You need to learn by yourself by reading though the course material in the CSE website.","Workload is very light. There are four exercises in total, and each takes less than an hour to complete. You only need to complete one exercise every 2-3 weeks.","This is pass or fail course.<br />To pass one of these bridging courses, you need to:<br />obtain 60% or higher of the four exercises total mark, and:<br />obtain 40% or higher in the final exam<br />It is extremely easy to get over 40% of grade in the final, so you do not have to worry at all."
4,5,4,4,False,True,False,True,False,False,False,False,False,COMP1029P,1000,1.0,11,"All the lecture notes are offered online, no attendance is needed. The content is easy to follow for beginner. There is only one final exam and a few assignments. The instructor would offer some&nbsp;&nbsp;codes for you to finish the assignment, you don&#039;t really need to write down a big paragraph of codes to do the assignment. It is more like filling the blank. And the exam questions are only MC and filling the blank questions.","It is a self-learning course, all the learning are done online, but the lecture notes given by the instructor is complete and useful. I only meet the instructor until the final exam..haha..","As it is a one credit course, the workload is acceptable. For a beginner without any knowledge in python, it might still need time to digest the course material in order to finish the assignment by yourself. In general, the workload is okay for 1 credit course.","This course is pass or&nbsp;&nbsp;fail course, so the grading is actually not that bad unless you get a F...Unless you didn&#039;t read the lecture notes, it is hard to fail the course."
