hash,semester,instructors,is_author,author,date,title,comment_content,comment_teaching,comment_grading,comment_workload,rating_content,rating_teaching,rating_grading,rating_workload,has_midterm,has_final,has_quiz,has_assignment,has_essay,has_project,has_attendance,has_reading,has_presentation,upvote_count,vote_count,voted,is_upvote,comment_count,attachments
PIIBCU4cSiHQNOWIBXqihCCNvItzGiTA,2023-24 Fall,"[{'id': 1826, 'name': 'SHEN, Jiasi', 'rating': 1}]",False,Sune,"May 21, 2024","Take her version to avoid Charles, it&#039;s far better (and actually good!)","Topics list, copied from Canvas<br /><br />Unit 0: Conversion from C++ to Java (Self-study)<br />Unit 1: Course and logistics overview; Introduction<br />Unit 2: Objects and classes<br />Unit 3: Strings<br />Unit 4: Inheritance and polymorphism<br />Unit 5: Exceptions and Text I/O<br />Unit 6: Abstract classes and interfaces<br />Unit 7: Generics<br />Unit 8: Inner classes<br />Unit 9: Functional programming and lambda expressions<br />Unit 10: Event-driven programming<br />Unit 11: Parallel and Concurrent Programming<br /><br />Prof. Shen will teach you basic syntax and some simple features from libraries. I believe she wants us to explore the language on our own, so don&#039;t expect to master the language from lectures alone.<br /><br />Also, I could tell she didn&#039;t like (to use) Java GUI, she skimmed over the content very quickly.<br /><br />I must also say, Prof. Shen uses IntelliJ for Java, which is a very good thing. (Who likes Eclipse anyway?)<br /><br />Key thing: Revise some programming and OOP concepts (inheritance, generics, etc...) and it&#039;ll be a smooth ride (mostly), concurrency is probably the most difficult part of the course.","Prof. Shen&#039;s lectures are very laid-back. The iPRS questions (correctness is not important) generally contribute to the lectures. At the beginning of the semester, given that it&#039;s her first semester teaching, she did not know how to pace her content, and ended up finishing the first three lectures worth of content in one. As someone who likes programming and has a decent knowledge in OOP, it was fine since the content was about C++ vs Java. If she did this in later topics, however, I&#039;m sure the effect would not be similar.<br /><br />She didn&#039;t really know what she wanted to cover at the start, but as the semester went along she definitely got more grasp of the entire teaching thing. One thing to take note of is that her research area involves quite a bit of artificial intelligence. So in her lectures she sometimes demos concepts using chatGPT. I don&#039;t know if it&#039;s because of our lack of reaction, but she stopped doing it after a while.<br />Starting from the middle of the semester, she found that she would be going through the contents too quickly, so she would prepare examples to run and demonstrate in-class. These examples sometimes are on par with COMP2011/2012 &quot;give me output&quot;-question level, so it is quite useful for practice.<br /><br />For those who are concerned about her accent, it&#039;s completely fine in my opinion, her accent doesn&#039;t affect her delivery at all.<br /><br />The lab exercise are one of the best parts of this course. Since the LA section was scheduled at 09:00, the TA allowed us to attend through Zoom (very nice). The lab exercises are also designed in a way where you progress it through the semester in one GitHub repository. The instructions are mostly clear and it does mostly make use of content in the course, I do wish more time was put on concurrency though.<br /><br />Right before the final exam, she also practiced some past paper questions with us, which is something I find interesting and useful.<br /><br />The 2 TAs and Prof. Shen all respond to emails quickly whenever I bother them, so that was nice.","8% iPRS attendance<br />21% PA1<br />21% PA2<br />8% Labs (11 of them)<br />42% Final exam<br /><br />For iPRS, you only need to answer, it doesn&#039;t matter what you answer. She does these anytime in a lesson, usually half-way, so be on the lookout for that. She wrote, and I quote, &quot;To get full marks for lecture participation, you must participate in at least 15 (out of ~20) of the in-class exercises.&quot; I answered 22 times so she asked around that many times. (I attended most lectures)<br /><br />The 2 programming assignments aren&#039;t difficult. They aren&#039;t trivial, but they are definitely not heavy in terms of workload. You would do both PAs with a GitHub repo each.<br />One good thing about it is you can use any libraries you want (not sure about external ones aside from JUnit, as JUnit is essential for the testing), so you don&#039;t have to manually declare array of fixed sizes for tasks. I am definitely not salty over not being able to use vector in COMP 2012 PAs. At the start of the semester the teaching team mentioned about a bonus scheme for PAS, but that was never executed so I have no idea about that.<br /><br />Labs, as I stated in the teaching section of this review, were very good. Combined with the PAs above, you actually learn some software engineering. So... for those CPEGers wanting to learn a bit of SE concepts and wanting to avoid COMP 3111(H) (which is smart), you could learn a bit from here.<br /><br />The final exam. We were assigned the 08:30 timeslot, so we already weren&#039;t fully awake. Combined with the fact that it was open-book (hard-copy), we were scared. She released Desmond (yes, that Desmond)&#039;s past paper from the one time he taught this course, and that paper was... quite difficult. What Prof. Shen gave us put Desmond&#039;s in the medium difficulty category. Truly an MIT-level paper. (Context: Prof. Shen got her PhD from *the* MIT)<br /><br />The final exam paper goes like this: Full MCs, every question has at least one correct answer, meaning for a question with ABCDEF, there could be 6 correct answers. <br /><br />The scores you get are calculated this way: If you answered any incorrect option, 0. Else, the score you get is FLOOR(s*x/n), where s is the score of that question, x is the amount of correct options you answered and n is the amount of correct options. An example, if a question worth 3 points with choices ABCDE has AD as its answer, if your answer has B, C or E, 0. Else if you answered A or D, you get FLOOR(3 * 1 / 2) = 1, if you answer AD then 3 points.<br />Another example, question worth 6 points has 8 options ABCDEFGH (yes one had 8 options) with answers ABDEG, you answered 2 correct, AB, for instance, you get FLOOR(6 * 2 / 5) = 2 etc. <br />Hope this is clear enough.<br /><br />I&#039;ve never felt chills over a final exam paper. It genuinely tests how confident you are with your knowledge in Java and how much you know. (particularly if you over-rely on libraries)<br /><br />Oh, I must mention, our final exam didn&#039;t test anything regarding JavaFX, labs and PAs didn&#039;t do anything with it either (Glad I basically gave up that part)<br /><br />Attendance - 8/8 (answered 22 times, which is far over the needed amount)<br />Labs - 11/11<br />PA1 - 100/100<br />PA2 - 94/100<br />Final exam 42/100<br /><br />This resulted in an A-.","Workload isn&#039;t high at all. Labs can be done in at most 2 hours if you know the content and the PAs are definitely easier than COMP2000-level PAs. Whether showing up to lectures and answering the iPRS is high workload is debatable.<br /><br />For PAs, be careful about inconsistencies between comments in code and PA description, always ask TA for clarifications.",5,4,4,5,False,True,False,True,False,False,True,False,False,9,11,False,False,0,[]
xcuujzffulfg2aNLb51WQh8rRKQOOv9A,2021-22 Spring,"[{'id': 110, 'name': 'ZHANG, Charles Chuan', 'rating': 1}]",False,一點寒芒,"Jun 01, 2022",失望既一個course,不再贅述,prof 既teaching還好，上堂氣氛都幾輕鬆,"grading完全係亂嗮，選擇性make up根本就唔公平<br /><br />-最離譜既係midtern同final都有make up, final原本話係15分鐘，跟住有兩個TA 搞錯時間開多咗5分鐘 ，最後沒有任何處理唔公平既方法，個個人都可以去make up<br /><br />-份PA4，TA話過到佢既test case就可以滿分，結果又係另外一回事，如果你用其他方法去做而TA覺得唔符合佢哋個預期方法，就會被扣分，如此特別既處理手法真係令人失望",it&#039;s fine<br />有4個PA，每個難度都算容易，上網查下就做到<br /><br />啲TA在final period 出PA同埋assignment,3,3,1,2,True,True,False,True,False,False,True,False,False,11,15,False,False,0,[]
xHsFA6QnuaLwy6H7AC9NVHMyPBVtUsO7,2024-25 Fall,"[{'id': 1826, 'name': 'SHEN, Jiasi', 'rating': 1}]",False,L.T.,"Dec 02, 2024","Based on this pattern, let me guess, next sem is Charles? (^^ゞ","𝙞𝙣 𝙨𝙝𝙤𝙧𝙩<br />❭ 𝗜𝗻𝗵𝗲𝗿𝗶𝘁𝗮𝗻𝗰𝗲, 𝗽𝗼𝗹𝘆𝗺𝗼𝗿𝗽𝗵𝗶𝘀𝗺, eg interface, inner class<br />❭ 𝗙𝘂𝗻𝗰𝘁𝗶𝗼𝗻𝗮𝗹, eg lambda expression<br />❭ 𝗣𝗮𝗿𝗮𝗹𝗹𝗲𝗹, 𝗰𝗼𝗻𝗰𝘂𝗿𝗿𝗲𝗻𝘁, eg Synchronization <br /><br />𝙥𝙨<br />❭ Pretty good introduction for beginner like me, but if u r very experienced in Java u might find it tedious/ useless","▲ Discord<br />▲ TA is really responsible and provide many extra learning materials, especially UGTA spend whole lot more time on this than normal (appreciate on that)<br />▲ Prof rly knowledgeable and able to explain examples clearly<br />▼ UGTA and professor dont really have a good coordination in terms of lecture, many times UGTA ask questions that disturb the normal class flow and confuse both students and professor<br />▼ Lecture is not interactive, I can tell professor did try asking questions etc, just mostly &amp; sadly she got no reply… (but tbh it is more like a both-way effort thing, ie 雙向奔赴)<br /><br />𝙥𝙨<br />❭ I am not 𝓁𝓊𝒸𝓀𝓎 enough to hv another one to teach me for comparison, but I think overall it is better than average ust teaching so B.","𝙨𝙩𝙖𝙩𝙞𝙨𝙩𝙞𝙘𝙨 (Percentage%) [LQ/ Median/ UQ/ ME/ FULL] <br />❭ 𝗙𝗶𝗻𝗮𝗹 (44) [27.71/40.42/54.17/50.83/100]<br />❭ 𝗣𝗮𝟮 (24) [75/90/95/100/100]<br />❭ 𝗣𝗮𝟭 (16) [75.42/90/100/100/100]<br />❭ 𝗟𝗮𝗯 (8) [32/40/40/32/40]<br />❭ 𝗤𝘂𝗶𝘇 (8) [9/9/9/8.5/9]<br />❭ 𝗧𝗼𝘁𝗮𝗹 𝗦𝗰𝗼𝗿𝗲 [56.66/69.78/78.63/76.32/100] &lt;- estimated <br />❭ 𝗟𝗲𝘁𝘁𝗲𝗿 𝗚𝗿𝗮𝗱𝗲 B+<br /><br />𝙥𝙨<br />❭ Most ppl manage to get full marks in labs/quizzes/projects, so it is basically a one-off hell-level full mc compiler simulation final competition. Personally dont really like this.<br />❭ I think professor maximised the range according to discord discussion","❭ 𝗣𝗮*2 only demanding work of the whole courses, at least spend 1 week on it if u r new to Java<br />❭ 𝗟𝗮𝗯*11 ez lab takes around 1-2 hrs<br />❭ 𝗤𝘂𝗶𝘇*5 1 past paper question, post in class of random date, submitted next day 2359<br /><br />𝙥𝙨<br />❭ keep track of the lecture even if it is midterm period else u can happy happy happy on pa2<br />❭ if u r new in java, make sure plays with ur compiler for each topic from time to time and also be creative (prof is gonna be more creative than u could imagine in final)<br />❭ make sure u hv copilot (it is free for student), not trustworthy for parallel &amp; concurrent task but it did save u lots of time to google",5,4,4,4,False,True,True,True,False,False,False,False,False,7,8,False,False,4,[]
o6hifzfh0kHgYmbvdNWeKH2kaUh8xYos,2023-24 Spring,"[{'id': 110, 'name': 'ZHANG, Charles Chuan', 'rating': 0}]",False,Deadgod,"May 20, 2024",Is 2024 and is this the same,"REMEMBER THIS IS 2024<br /><br />Pls go read the history of this course, you will be surprie<br /><br />SHIT COURSE PLANNING, READ FROM OTHERS, You will be going to youtube alot, class is boring and have in class exerice so you cant skip class. PA and lab are all unclear (IS SO FKING HARD NOW TOO, FEEL LIKE A 4000 LEVEL COURSE. THE PA DESCRIPTION IS SO UNCLEAR AND WILL TAKE YOU THE WHOLE WEEK TO DO, feel like outsource from low pay programmer). GOOD LUCK",REMEMBER THIS IS 2024<br />like other comment for charles,"REMEMBER THIS IS 2024<br /><br />Lecture Participation Weekly 5%<br />Lab Work Weekly 5%<br />Three Assignments March, April, May 36%<br />Interview Random 8%<br />Final 46%<br /><br />INTERVIEW IS BACK!!!!!!!!!!!!!!!!!!!!!!!!!!!!!!!!!!!!!!!!!!!!!!!!!!!!<br />INTERVIEW IS BACK!!!!!!!!!!!!!!!!!!!!!!!!!!!!!!!!!!!!!!!!!!!!!!!!!!!!<br />INTERVIEW IS BACK!!!!!!!!!!!!!!!!!!!!!!!!!!!!!!!!!!!!!!!!!!!!!!!!!!!!<br /><br />Interview is not random cause no one take this course anymore only around 20-30 people.","LIke I said the assigment is so difficult now, will take up so much of your time. Trust me just go to youtube and learn JAVA, no point take this course.",1,1,1,1,False,True,True,True,False,True,True,False,False,6,6,False,False,0,[]
B2I8m3XesqtCLg0xd41dINmYqdiiBBC2,2018-19 Spring,"[{'id': 799, 'name': 'LAM, Ngok', 'rating': 1}]",False,Kit9973,"Jun 09, 2019",,"Introduction to Java programming. Fundamentals include language syntax, object-oriented programming, inheritance, polymorphism, exception handling, multithreading and lambdas. Standard libraries for input/output, graphics programming, built-in data structures. Programming for events, generics and higher-order functions.",,"As my programming courses COMP1022P and COMP2012H&nbsp;&nbsp;both were taught by a bad guy Dr. Tsoi, what I expected in the midterm and final was very difficult:(<br /><br />But Alex is a good guy. His questions only focus on the basic concept or problems commonly occur. Unlike the bad guy, the questions are very tricky or about some uncommon code. <br /><br />Score:<br />midterm mean: 72.8/100 me: 92/100<br />final mean: 75.2/100 me: 84/100<br />PA and Lab: full<br />overall:91.6%<br />Grade: A-<br /><br />Btw Alex also said that &quot;I am a kind person, the questions should not be difficult for all of you.&quot; in the COMP3021final exam. <br />But he didn&#039;t said in the final of COMP2611, and the questions were very hard for me :( <br />Eventually, I got C in the 2611. So Alex may be also a bad guy actually:(","comparing to the copm2012, the PA is very easy and there are clear instruction for you.",5,5,4,5,True,True,False,False,False,False,False,False,False,8,10,False,False,5,[]
ygJfDZxE5qI79yyHuZdOCOWtkTbWJG3u,2024-25 Fall,"[{'id': 1826, 'name': 'SHEN, Jiasi', 'rating': 0}]",False,APKB,"Dec 15, 2024","I thought this course could help my 3111 project, but it was just a waste of time and credits","+ Introduction to Java (could be slightly useful for your 3111 project)<br /><br />- Just like your 2011/2012 series, asking some tricky codes and contents that you don&#039;t know when you will use those knowledge<br /><br />? Java implementation of 3511 parallelism is also included","I attended lecture in class for the whole September and skipped all classes afterwards.<br /><br />+ Jiasi has plenty of coding examples and demonstration in class<br />+ Jiasi replies to Discord message or email fast<br />- Jiasi is just talking to herself during the lecture instead of interacting with students and be aware of whether students understand or not<br />- She is just using Desmond or other previous lecturers&#039; slides and read it out with the boring flat tone<br />- The coding examples are in a separate PPT file, which is only released after the lecture, students cannot jot notes on the examples (explanation and expected output of the codes will not be released)<br />- The UGTA is always asking very difficult questions in class, Jiasi cannot answer pretty well and confuses us",Lecture Quiz 1.6% * 5 = 8%<br />Lab 1% * 8 = 8%<br />PA1 16% (OOP)<br />PA2 24% (Lambda &amp; Parallelism)<br />Final Exam 44%,"Lecture quiz is ridiculous. Jiasi just post it in the Canvas and asked you to do, even if you went to lecture, you still probably cannot get full marks in the quiz (Exam-type questions).<br /><br />Weekly lab is tough, we are making something like GoodNotes or what system. We have to keep our codes in github and process weekly, it may be quite annoying for the first few OOP exercises, but some TAs are in the lab session that they are happy to help you to figure out your problems. Lambda and parallelism can be handled by AI. TAs don&#039;t really check your code, just a screenshot of your result.<br /><br />PA1 is quite easy and I finished it in 2-3 days and passed all test cases accidentally.<br /><br />PA2 is so difficult (maybe just because I got lost in the content) and I could not manage to get full marks.",3,2,3,3,False,True,True,True,False,False,True,False,False,4,4,False,False,0,[]
orn39liRYvbyRMCmscbqiZQKRPFyaJDG,2019-20 Spring,"[{'id': 799, 'name': 'LAM, Ngok', 'rating': 1}]",False,hidden,"Apr 14, 2020",最輕鬆嘅COMP course,教Java 12。一開波預你識C++，會教Java同C++之間有乜分別，用幾個week由零開始重溫OOP同Polymorphism。Mid-term之後開始教新嘢(Interface/Abstract Class/JavaFX/multiThreading)。,Alex教得幾好，好有耐性解答同學問題。個人本身好nice。,,"每個禮拜一個勁簡單嘅Lab, 唔需要即日交。Assignment同Comp2012差唔多，但由於係Java嘅關係實在係容易得多。分兩至三日慢慢寫好輕鬆就完成，而且assignment嘅指引好清晰，唔會跟唔到。",5,5,4,5,True,True,False,True,False,False,True,False,False,5,6,False,False,0,[]
rjoVeWTveb9FyngQ67U7IxyMbEl3Hmrg,2016-17 Fall,"[{'id': 118, 'name': 'CHEUNG, Shing Chi', 'rating': 1}]",False,ああああ,"Jan 26, 2017",,Java零底入去is ok，但基本oop講得好快，基本上預你無唔記得晒comp2012<br /><br />基本上講晒Java所有Syntax，包括java8嘅lambda，差無講annotation<br /><br />去到sem尾基本上final boss係javaFX、multithreading (ReentrantLock)、generic class (ArrayList&lt;? extends Number&gt;)<br /><br />CS人想出來做野之前可以有信心咁話自己識一隻language，呢科就唔可以錯過啦，鬼叫無一科C++ programming咩,講得幾清楚，prof幾好人，落堂喺走廊繼續講is ok，網上一堆extra野，咁囉,Attendance (iPRS) / Lab / Assignment * 2 / Mid-term / Exam<br /><br />mc係多選型，錯一個即成題無分，於是就無得亂撞<br /><br />midterm同exam嘅mean去到六七十，個final exam淨係寫一個class有getter setter已經有一堆分(long question兩條其中一條)，條curve偏高，好多失分都係喺mc度失<br /><br />搵到notes有錯嘅話每次送0.5%，呢個我覺得幾好，可以鼓勵人提早去睇，不過差唔多只適用於已經識java嘅刷grade黨<br /><br />功課改得幾仔細，有次個TA compile唔到send email問我，我就同佢一齊搵咗個bug出來，應該扣咗啲分掛，不過唔會好似2011 2012呢啲大course咁比個零你<br /><br />功課有bonus，自己propose additional features然後email比prof比佢地睇，最多+功課分10%<br /><br />lab可以事後send email叫佢地睇github,九點正iPRS應該都算係workload嘅一部份掛<br /><br />功課最好等人問出FAQ先做，如果唔係就等收檔<br /><br />兩份assignment，skeleton接近零，真係要識design program嘅人先寫得出，唔再係啲幾十行嘅河內塔，而係750~1000行嘅怪獸,5,4,4,4,True,True,False,False,False,True,True,False,False,5,6,False,False,0,[]
SQuzCScl0ChMttK9ucYNpx1f2LR2vM3O,2022-23 Fall,"[{'id': 118, 'name': 'CHEUNG, Shing Chi', 'rating': 1}]",False,ustjj,"Dec 28, 2022",Back to normal comp3021,"Same as previous semesters, basically teaching COMP2011 and 2012 but in Java, with the main addition being multi-threading and interface, which are quite java specific<br /><br />You can definitely say that you are a competent Java programmer after taking the course","SCC quality teaching as usual, enthusiastic, patient, and knowledgeable in both java and software engineering in general<br /><br />He&#039;s always explaining why the java designer make restrictions/syntax as they are, rather than just talking about the resulting designs<br /><br />TAs are quite friendly, so do actively find them for help if you are stuck in PAs or labs.","42% assignment (3 of them, each 14%)<br />42% final (3% each for 20 MC questions, 40% for short questions)<br />8% lab (nearly all people get full marks)<br />8% quiz (you get full mark by participating in the zoom poll, you can actually take this attendance at home rather than having to be physically present in the classroom)<br /><br />Unlike the chaotic last semester, the grading is clear and fair at least. I think it is way better than expected, I didn&#039;t even get upper quartile but got an A in the end.","Main workload are the PAs, where you really need to start earlier (at least 1 week before deadline) to finish it. Rather than being tedious, they are generally shorter than the 2011/2012 ones, but require good understanding of the concepts and lots of googling in order to know how to implement some parts.<br /><br />Labs generally take &lt;1 hour to finish. 1 or 2 of them may be harder, but you can always ask the TA or even the prof for tips.<br /><br />Final exam is open-book where you can bring anything (in paper) into the exam venue, so you don&#039;t have to spend time memorising the stuffs. The exam questions are quite tricky, so you should spend some time trying different special cases before the exam.",4,5,5,4,True,True,False,True,False,False,True,False,False,3,3,False,False,0,[]
0kvDrN2iPpyIFHBYTt1ylBRzicjxbd37,2020-21 Fall,"[{'id': 118, 'name': 'CHEUNG, Shing Chi', 'rating': 1}]",False,Pccw,"Dec 29, 2020",,"for the first half semester, mainly focus on the basic OOP. after that it mainly focus on 	<br />Java Multi-Threading<br />Generics<br />Lambda Expressions and High-order Functions<br />Exception Handling<br />Java Event-Driven Programming (inner class)","his teaching is quite good, he speaks slowly and explains the concept clearly with some concrete examples. the quiz questions are also quite good for understanding concept (though it is much much easier than the MC in the final). he is also willing to answer questions.","Quiz - 8%, full<br />Lab - 8%, full<br /><br />PA - 45%, 15% each<br />PA1 mean 87, I got 100<br />PA2 mean 82, I got 100<br />PA3 mean 58, I got 82<br /><br />Final - 39%<br />Exam mean 51, I got 61/100<br /><br />i finally got A in this course, quite good grade","quiz (2 polling for zoom), start at the beginning of each lecture, basically everyone can get full mark because no need correct answer, kind of attendance. <br /><br />Lab, everyweek have a lab session which is required for 15 mins attendance, but can submit lab work later, most can finish within 1 hours<br /><br />PA, PA1 is quite easy and should be finish in 3 days (just about some basic thing of OOP), PA2 is quite time consuming if you do not know anything about JavaFX, I spend around 1 week to finish it (the hardest part should be handling application thread), for the PA3, it is a bit easier than PA2, mostly about multithreading, I spend around 3 days. Maybe its deadline is in exam period so it is really not too hard.<br /><br />Final, very hard for MC, even though open book, for each question with 5 choices, there may be not only one answer. For LQ, mainly focus on generic and lambda.",4,5,4,3,False,True,True,True,False,False,False,False,False,5,7,False,False,0,[]
