hash,semester,instructors,is_author,author,date,title,comment_content,comment_teaching,comment_grading,comment_workload,rating_content,rating_teaching,rating_grading,rating_workload,has_midterm,has_final,has_quiz,has_assignment,has_essay,has_project,has_attendance,has_reading,has_presentation,upvote_count,vote_count,voted,is_upvote,comment_count,attachments
aucakqlmiQVHK4RUOPJT4IVndP8C0Rrp,2021-22 Spring,"[{'id': 110, 'name': 'ZHANG, Charles Chuan', 'rating': 1}]",False,misky,"May 31, 2022",Comp3021 Introduction to Emotional control and problem solving,"lab, assignment,demo, exam all bugged, only ta is accountable. Lab bug? make up lab. Demo bugged? make up demo. Exam bugged? Make up exam. Test case bugged? Make up test cases. Instructions bugged? Make up instructions (after grading). Did something wrong? Just make up excuses.<br /><br />Comp3021 Introduction to peoblem solvig<br /><br />Sorry type wrong title. Let&#039;s do a make up on the course title","lab, assignment,demo, exam all bugged, only ta is accountable. Lab bug? make up lab. Demo bugged? make up demo. Exam bugged? Make up exam. Test case bugged? Make up test cases. Instructions bugged? Make up instructions (after grading). Did something wrong? Just make up excuses.<br /><br />Comp3021 Introduction to peoblem solvig<br /><br />Sorry type wrong title. Let&#039;s do a make up on the course title","lab, assignment,demo, exam all bugged, only ta is accountable. Lab bug? make up lab. Demo bugged? make up demo. Exam bugged? Make up exam. Test case bugged? Make up test cases. Instructions bugged? Make up instructions (after grading). Did something wrong? Just make up excuses.<br /><br />Comp3021 Introduction to peoblem solvig<br /><br />Sorry type wrong title. Let&#039;s do a make up on the course title","lab, assignment,demo, exam all bugged, only ta is accountable. Lab bug? make up lab. Demo bugged? make up demo. Exam bugged? Make up exam. Test case bugged? Make up test cases. Instructions bugged? Make up instructions (after grading). Did something wrong? Just make up excuses.<br /><br />Comp3021 Introduction to peoblem solvig<br /><br />Sorry type wrong title. Let&#039;s do a make up on the course title",1,1,1,1,True,True,True,True,False,False,False,False,False,17,17,False,False,0,[]
H6mMW9QejuP9h5pmv1s3pBgUFZrkDr78,2023-24 Fall,"[{'id': 1826, 'name': 'SHEN, Jiasi', 'rating': 1}]",False,151044,"Dec 16, 2023",The Road to Hell is Paved With Good Intentions,"As someone who uses Java as their primary programming language, I appreciated the topics selected since they do provide a nice and solid foundation for you to explore more on your own.<br /><br />Topics:<br />Classes and Objects<br />Strings<br />Inheritance and Polymorphism<br />Exceptions and Text I/O<br />Abstract Classes and Interfaces<br />Generics<br />Inner Classes<br />Functional Programming and Lambda Expressions<br />Event-Driven Programming (with a JavaFX example)<br />Multithreading and Concurrent Programming<br /><br />One thing I dislike about COMP programming courses in HKUST in general is the lack of coverage of collection types - the STL in C++ and the Java Collections library would be really nice additions to the respective courses.<br /><br />(Prof really likes functional programming - she spent the most time on elaborating on concepts (and sneaking in some lambda calculus in this course, lol). She and Lionel (COMP 3031 Prof) would get along swimmingly).","The teaching quality improved significantly throughout the semester - possibly caused by her lack of teaching experience before. <br /><br />In the beginning, she had a weak grasp of lesson planning and often speedran the contents of last semester&#039;s slides. She is also a ChatGPT enthusiast (ChatGPT was used to fill in the gaps when she can&#039;t figure out what to explain) and wasn&#039;t very confident.<br /><br />She improved quite a bit during the semester as she got adjusted to teaching. She was able to prepare her own examples for the trickier points of Java&#039;s behaviour, and preparing her own materials enabled her to structure her teaching a bit better. At the end, she was at least an above average prof when she figured out she&#039;s doing.<br /><br />The labs prepared by the teaching team were generally pretty good, and provided hands-on experience to add on the topics presented in the lecture.<br /><br />B for showing improvement throughout the semester and at least trying to do her job properly (which some people *cough cough 3111* were unable to do).","When combined with the low difficulty of the assignments and labs in general, the grading scheme is heavily skewed towards the (explosively difficult) final exam.<br /><br />8% Attendance (15 iPRS responses out of a total of ~25 are enough for the full score, graded on response and not on correctness)<br />42% Programming Assignments (21% each, 2 assignments)<br />8% labs (11 Labs)<br />42% Final Exam<br /><br />Assignments<br />=================<br />Assignments are actually smaller than normal COMP 2012(H) PAs despite carrying a large percentage of the grade. The first assignment was on general OO design and Java collections. The second was on&nbsp;&nbsp;event-driven programming and multithreading. None of them were too tricky nor difficult - the most annoying thing might&#039;ve been PA1&#039;s logic.<br /><br />Despite mentioning a &quot;bonus scheme&quot;, none of thee PAs had any bonus whatsoever. Maybe an oversight?<br /><br />Final Exam<br />=================<br />The final exam was where the &quot;hell&quot; in the title came from. It was a 2 hour pure MC test, and every single question ranged from &quot;moderately difficult&quot; to &quot;ungodly hard&quot;. The MCQs nearly all had multiple answers, and the marking scheme strongly discouraged guessing - any wrong answer in a multi-answer question instantly made you lose all marks for the entire question, and your answers are graded on floor(correct * question_score / total_correct). The entire thing combined led to the lowest mean (30.7/100) I&#039;ve ever seen in an HKUST exam, and possibly the hardest final paper I&#039;ve had the (dis)pleasure of sitting through.<br /><br />This is not to say that the final was set badly though. Each question definitely examined how clear your concepts are - get them slightly wrong and you&#039;re screwed. It is a great way to make sure you&#039;ve got most of Java&#039;s trickier behaviours down.<br /><br />The final exam is the real grade differentiator. Since everyone gets full marks in the PAs/labs/attendance, this means that each mark in the final matters much much more than anything else. The &quot;one-exam-kills-all&quot; approach is why the grading is a C here.<br /><br />Getting full for labs and attendance, 99/81 for the PAs (oops), and 54/100 for the final results in an A.","The workload for this course is actually really low.<br /><br />The labs are not difficult (mostly) and can be finished in under an hour if you&#039;re unfamiliar with the topic. <br /><br />The assignments are very easy unlike COMP 2011/2012/2012H assignments. There are not a lot of hidden test cases to screw you over, and you can leverage the entire Java standard library to make your code more concise. It should take you no longer than 5 hours to finish one if you have listened to the lectures.",5,4,3,5,False,True,False,True,False,False,True,False,False,16,17,False,False,0,[]
4AEC05pqjpnCJWXpYgmJiPhW7qmaMSm7,2021-22 Spring,"[{'id': 110, 'name': 'ZHANG, Charles Chuan', 'rating': 1}]",False,anonymouscomp,"May 31, 2022",Avoid Charles in every course if possible,"Bad Bad Bad<br />Ok an java course.<br />There is nothing special just like 2012 and 2012H<br />I see the past exam, it is good so I decide to take this course.<br />But I regret now.<br />Charles try to make it fair but he got a really bad idea<br />Do not take course if he teach<br />Regret to take this",He is ok but dont need to attend lecture because we have lecture note,55% assignment<br />Minor mistake will get large penalty<br />Make up everything<br />Got deduct point for the scheme that we don&#039;t know before<br />(It is added later because everyone got high score),Quite light for this semester,1,1,1,1,False,True,False,True,False,False,False,False,False,14,14,False,False,0,[]
YkGcWHSnHLpiIavQa6rksKCNC2mZNB35,2021-22 Spring,"[{'id': 110, 'name': 'ZHANG, Charles Chuan', 'rating': 0}]",False,YARRRRRR,"Jul 18, 2022",SUS?,"The lecture contents were okay. Students are assumed to be familiar with basic programming concepts like OOP, functions and variables. Java specific details about these concept were taught. Some new concepts untouched by COMP2011 and COMP2012 like producer/consumer, multithreaded programming are present.<br /><br />The slides generally were adequately paced. Although you may need to chew on specific slide and look for online resouces to get a full grasp on more complicated subjects. <br /><br />The assignments were too trivial and instructions are often unclear. <br />Important java specific concepts were not tested thoroughly in these assignments and you won&#039;t be improving significantly after completing them. Only the first assignment (OOP) put up to a moderate challenge and the others were a breeze. <br />Instructions were often unclear and leave some questions unanswered. You can ask the TAs or figure it out yourself. The added benefit is that you have to be more concious on the general behaviour on you program, but those who require detailed instructions may find it difficult.<br /><br />The labs were actually harder and will test your knowledge on taught matters. There were some instructions given but you will have to figure out many things out by yourself.<br /><br />C for actually teaching me java and got me an internship xD.","I never really paid attention in lectures so I can&#039;t comment on them.<br /><br />But HOHO, the teaching team is very SUS.<br /><br />Wrong/bugged files were given for labs. Test cases for assignment 4 are actually wrong and doesn&#039;t evaluate your code correctly. Wrong questions delivered for mid-term. Different exam length for different groups...<br /><br />and they forgot to schedule my mid-term makeup session even if I informed my unavailability on the day that it was announced. Leaving me very confused when they released the mid-term marks. I&#039;ve also heard that the new makeup mid-term (which I took) were harder than the original one, so that is a bit unfair for me.<br /><br />Overall its like they make a mistake on every announcement and had to do a makeup for every real-time assesment that they made. It&#039;s like the professor never talks to the TAs and all of them are very SUS.<br /><br />Rated E for Ejected.","The grading were a complete shit fest, only if i can show you the complaint board. The grading scheme is like a quantum superposition where it would be different everytime you observe it.<br /><br />They even released an assignment with a &lt;24h deadline during the exam period to &quot;evaluate whether you did plagarism in assignments&quot;. It later changed to a zoom meeting where the TA seems to be reading questions and assess your program based on &quot;correctness&quot;. It resulted in mark deductions out of nowhere on assignment 4 for nearly all student which (obviously) led to out outrage and (luckily) they revoked it.<br /><br />Final exam was 20T/F questions, like W(hat) T/F.<br /><br />The grades were arse as nearly everyone got everything correct. Tbh only the final exam mattered and its T/F.<br /><br />Since the final exam is an T/F, I will also give a T/F mark, so thats a E.","one moderate/challenging lab per week (can miss up to two)<br /><br />random exercies on lectures as attendance, you get marks as long as you upload the file (can miss up to two)<br /><br />1 okay assignment (OOP)<br />2 easy assignments (lambda exp, multithreaded)<br />1 brain-dead assignment (???BASIC STRING MANIPULATION???)<br /><br />a written assignment which evaluates your understanding of one assignment and ask a design related question if you have to re-design the assignment to access a different skill (like lambda exp) <br /><br />2 live mid-term coding demo (I actually think its a good type of assessment but they messed it up)<br /><br />the legendary 20 T/F question exam<br /><br />aaaannndd the mysterious assignment that appears during the exam period with 24h deadline and disappears after 30 minute like my hope for living.<br /><br />aaaaaaaaaaaaaaaaannnnnnnnndddddddddddddd a coding interview after the fucking semester is over.<br /><br />LMAOOOO have a E.",3,1,1,1,True,True,False,True,False,False,True,False,False,12,12,False,False,0,"[{'key': 'W2twU2GJ226CrBz6riP6nAQBOkrILrZX', 'name': 'Sus', 'format': 'png'}]"
U6GJp8oqOtB3XjJ7sMxu2x9J4RgBxE7D,2023-24 Fall,"[{'id': 1826, 'name': 'SHEN, Jiasi', 'rating': 1}]",False,JoshKwong,"Dec 16, 2023",Worst COMP course i&#039;ve ever taken,"Unit 0: Conversion from C++ to Java (Self-study)<br />Unit 1: Course and logistics overview; Introduction<br />Unit 2: Objects and classes<br />Unit 3: Strings<br />Unit 4: Inheritance and polymorphism<br />Unit 6: Abstract classes and interfaces<br />Unit 7: Generics<br />Unit 8: Inner classes<br />Unit 9: Functional programming and lambda expressions<br />Unit 10: Event-driven programming<br />Unit 11: Parallel and Concurrent Programming<br /><br />Compared to Prof. Shing Chi Cheung, I&#039;ll say the content cannot give a deep understanding of Java. If you just learn from lectures, you probably end up with some basic syntax and the simplest usage of some Java features, which will be totally different with what will be examined in the final.","i can see that Prof. Shen Jiasi is a young lady with a passion for teaching but she was reading the slides (hmm though she changed some wording to avoid just reading the slides, but it did not make a difference), literally, every single lecture, which was pretty tedious especially with her flat tone as always. I attended the lecture merely for not to miss the participation credit, and so do other classmates i guess.<br /><br />TAs are not responsive. yet I did not receive a response to the email that I sent when I was preparing for the final exam to ask some questions.","In-class Quizzes and Participation	8%<br />Laboratory exercises	&nbsp;&nbsp;&nbsp;&nbsp;&nbsp;&nbsp;&nbsp;&nbsp;&nbsp;&nbsp;&nbsp;&nbsp;&nbsp;&nbsp;&nbsp;&nbsp;8%<br />Project assignments*2	&nbsp;&nbsp;&nbsp;&nbsp;&nbsp;&nbsp;&nbsp;&nbsp;&nbsp;&nbsp;&nbsp;&nbsp;&nbsp;&nbsp;&nbsp;&nbsp;42%<br />Final exam	&nbsp;&nbsp;&nbsp;&nbsp;&nbsp;&nbsp;&nbsp;&nbsp;&nbsp;&nbsp;&nbsp;&nbsp;&nbsp;&nbsp;&nbsp;&nbsp;&nbsp;&nbsp;&nbsp;&nbsp;&nbsp;&nbsp;&nbsp;&nbsp;&nbsp;&nbsp;&nbsp;&nbsp;&nbsp;&nbsp;&nbsp;&nbsp;42%<br /><br />Attend lectures and during some of them, iprs quizzes would be given and you can get 1 participation credit as long as you submit something.<br />I got full marks in participation, labs, and pa1(pa2 mark not yet released).<br />There is no midterm which is good for who are busy doing revision during midterm period. But the final exam was a nightmare. 33 mc and you should choose ALL THAT APPLY. If you get one of your choices wrong, you get 0 for that question. I do think the strategy you use for the paper is more important than how you actually understand Java to achieve higher score.<br /><br />Final exam stat:<br />mean: 30.7<br />sd: 11.2<br /><br />I got 33/100 which scared me at the beginning, but i started laughing after i saw the stat. I&#039;ll update this part as long as it updates.<br /> Updates:<br />Final scores updated to 34/100<br />I got a B.<br /><br />From syllabus:<br /><br />Bonus Scheme<br /><br />Objective: Encourage students to further explore beyond the programming assignments<br />Means: When you have completed a bonus task in the assignment, you will get the bonus points accordingly<br />Bonus scheme: Be used as a &quot;safety blanket&quot; on the assignments capped by the maximum score (e.g. 100). It motivates hard-working students without sacrificing the less hard-working students<br />Examples:<br />If a student got 95 out of 100 for the basic tasks, but he got 6 bonus points, the final score will be: MIN(95+6, 100) = 100<br />If a student got 100 out of 100 and got 0 bonus points, the final score will be: MIN(100+0, 100) = 100",Workload is low. Every week you get 1 lab assignment to finish which is easy. All you need is just follow what&#039;s described in the slides (no need to attend the lab or watch the recording which is a waste of time).<br />Besides you have 2 Pa. First one was building a course registration system and second one was related to event-driven programming. both were simple.<br />Note that the comment given in the skeleton code can be confusing. It usually contradicts with the description given in the pdf file and waste your time on understanding it. Just contact the TA and they will tell you &quot;the comment is useless&quot; lmao.,3,2,3,5,False,True,True,True,False,False,True,False,False,11,12,False,False,0,[]
1jumox8h7gkjWK6M8bBdYu4zrWNmVdGw,2023-24 Spring,"[{'id': 110, 'name': 'ZHANG, Charles Chuan', 'rating': 0}]",False,dt1dr,"May 28, 2024",非常に新鮮で、非常においしい,"1. Object and Classes<br />2. Strings<br />3. Inheritance and polymorphism<br />&nbsp;&nbsp;*Did not explain the comparison well with C++. <br />4. Exceptions and text I/O<br />5. Abstract classes and interfaces<br />6. Generics<br />&nbsp;&nbsp;*Did not explain the comparison well with C++. <br />7. Inner Classes<br />8. Functional programming and lambda expressions<br />9. Event-driven Programming with Java FX<br />&nbsp;&nbsp;*No GUI programming is required here<br />10. Parallel and Concurrent Programming with Java<br />&nbsp;&nbsp;*Probably the most useful content here.<br /><br />可能是你在科大找到的质量最低的一门专业课。Lecture 的内容对于学习Java编程但凡有一点用也不至于一点用没有。但是相比去年仍然有进步。<br /><br />1. I/O, collections framework, 多线程 这种Java特性基本一笔带过，讲得很浅，但是基于课时有限，可以理解。<br />2. WHERE IS REFLECTION? 不是哥们反射都不讲的吗?<br />3. JavaFX这块值得表扬，能够结合业界现状把GUI这块直接砍掉，只解释了最基本的Event-driven programming.","Charles 教授为人和善幽默风趣，以下评论仅针对教学本身。<br />和往年的其他评论一样:&nbsp;&nbsp;&nbsp;POOR AND CHAOS<br />但是还是有进步的 所以给个D<br /><br />If the university truly wishes to provide a superior programming education, it must overhaul this course and its irresponsible design.","Lecture Participation (attendance) Weekly 5%<br />Lab Work Weekly 5%<br />Three Assignments March, April, May 36%<br />PA Interview 8%<br />Final 46%<br /><br />灾难级的给龟<br /><br />Grading and Stat:<br />Lecture Participation:&nbsp;&nbsp;&nbsp;&nbsp;&nbsp;&nbsp;4.17/5<br />Lab Work Weekly:&nbsp;&nbsp;&nbsp;&nbsp;&nbsp;&nbsp;&nbsp;&nbsp;&nbsp;&nbsp;&nbsp;&nbsp;5/5<br />PA1(OOP basic):&nbsp;&nbsp;&nbsp;&nbsp;&nbsp;&nbsp;&nbsp;&nbsp;10.14/12<br />PA2(lambda):&nbsp;&nbsp;&nbsp;&nbsp;&nbsp;&nbsp;&nbsp;&nbsp;&nbsp;&nbsp;&nbsp;&nbsp;&nbsp;&nbsp;11.25/12<br />PA3(Multithreading):&nbsp;&nbsp;&nbsp;10.64/12<br />PA Interview&nbsp;&nbsp;&nbsp;&nbsp;&nbsp;&nbsp;&nbsp;&nbsp;&nbsp;&nbsp;&nbsp;&nbsp;&nbsp;&nbsp;&nbsp;&nbsp;&nbsp;&nbsp;&nbsp;&nbsp;8/8<br />Final Exam&nbsp;&nbsp;&nbsp;&nbsp;&nbsp;&nbsp;&nbsp;&nbsp;&nbsp;&nbsp;&nbsp;&nbsp;&nbsp;&nbsp;&nbsp;&nbsp;&nbsp;&nbsp;&nbsp;62/100<br />PA Bonus&nbsp;&nbsp;&nbsp;&nbsp;&nbsp;&nbsp;&nbsp;&nbsp;&nbsp;&nbsp;&nbsp;&nbsp;&nbsp;&nbsp;&nbsp;&nbsp;&nbsp;0+0.84+0.87/3.6<br /><br />期末出得太难了，这个题量和考试时长严重脱节, 完全是阅读大赛<br />Final stat: <br /><br />High 71/100<br />Mean 46.62/100<br />Median 49/100<br />UQ 55/100<br />LQ 37/100<br /><br />Total Grade:<br />77.7/100 (Without bonus)<br />79.4/100 (With bonus)<br />Result: B+<br /><br />30个人的班拿A range的可能没有3个吧，真的按照Grading policy给分了吗？<br />Letter Grade 完全不具备任何参考价值。今时今日这种对待教学的态度只会损害reputation， 尤其是这种面向就业的专业课程。<br />我既学不到本领也没提高绩点，太失望了，言尽于此。",Moderate to me but it is too heavy as a 3-credit course. <br />三份PA逐步实现了一个 Python-AST Engine. 写作业的过程能够较好地帮助学生了解课堂上根本不会提及的知识细节。而且相关细节会出现在Final Exam中所以请确保是自己亲自写的作业.,1,2,1,2,False,True,True,True,False,False,True,False,False,10,11,False,False,0,[]
