hash,semester,instructors,is_author,author,date,title,comment_content,comment_teaching,comment_grading,comment_workload,rating_content,rating_teaching,rating_grading,rating_workload,has_midterm,has_final,has_quiz,has_assignment,has_essay,has_project,has_attendance,has_reading,has_presentation,upvote_count,vote_count,voted,is_upvote,comment_count,attachments
hco5sLITsV6NpYBgyozDq2ChTlX5EkAm,2024-25 Fall,"[{'id': 1826, 'name': 'SHEN, Jiasi', 'rating': 1}]",False,DankME,"Dec 26, 2024",Java Syntax Bootcamp: Become a Human Compiler,"🚩 Issues:<br />- Too much overlap with COMP2012. It’s not worth taking if you’ve already taken COMP2012.<br />- Only learned something new during the last lecture of the semester (e.g., multithreading).<br />- Final exam felt disconnected from the lecture content.<br />- The final was extremely challenging, and your grade depends heavily on your performance in it. You must be super familiar with Java syntax.<br />- You need to act like a human compiler to predict outputs and identify compilation errors. ⚙️<br /><br />🔍 Example Questions:<br />- Many questions ask which version will compile and produce the correct output.&nbsp;&nbsp;<br />&nbsp;&nbsp;Example:&nbsp;&nbsp;<br />&nbsp;&nbsp;- How to use `PrintWriter` inside a `try-catch` block to produce the correct result?&nbsp;&nbsp;<br />&nbsp;&nbsp;- Which of the following will equal `b`?&nbsp;&nbsp;<br />&nbsp;&nbsp;&nbsp;&nbsp;- char(a - 1)<br />&nbsp;&nbsp;&nbsp;&nbsp;- char(a - &#039;1&#039;) <br />&nbsp;&nbsp;&nbsp;&nbsp;- char(&#039;a&#039; - 1)<br /><br />📝 Format:<br />- 20 MCQs in the final exam.<br />- Some questions were harder versions of ❗️class examples❗️and quizzes.<br /><br /> ➡️ Quiz Question Examples:<br />1. Which of the following statement(s) will compile successfully and print `1` when executed?&nbsp;&nbsp;<br />&nbsp;&nbsp;&nbsp;- A. `System.out.print(1.toString());`&nbsp;&nbsp;<br />&nbsp;&nbsp;&nbsp;- B. `System.out.print(&#039;1&#039;.toString());`&nbsp;&nbsp;<br />&nbsp;&nbsp;&nbsp;- C. `System.out.print(&quot;1&quot;.toString());`&nbsp;&nbsp;<br />&nbsp;&nbsp;&nbsp;- D. `System.out.print(((Integer)1).toString());`&nbsp;&nbsp;<br />&nbsp;&nbsp;&nbsp;- E. `System.out.print(Integer(1).toString());`&nbsp;&nbsp;<br />&nbsp;&nbsp;&nbsp;- F. `System.out.print(((Character)(char)1).toString());`&nbsp;&nbsp;<br />&nbsp;&nbsp;&nbsp;- G. `System.out.print((1 + &quot;&quot;).toString());`&nbsp;&nbsp;<br />&nbsp;&nbsp;&nbsp;- H. `System.out.print((1 + &#039;&#039;).toString());`&nbsp;&nbsp;<br /><br />2. Consider the following program in `MyClass.java`:<br /><br />&nbsp;&nbsp;&nbsp;```java<br />&nbsp;&nbsp;&nbsp;public class MyClass {<br />&nbsp;&nbsp;&nbsp;&nbsp;&nbsp;&nbsp;&nbsp;public static void main(String[] args) {<br />&nbsp;&nbsp;&nbsp;&nbsp;&nbsp;&nbsp;&nbsp;&nbsp;&nbsp;&nbsp;&nbsp;try {<br />&nbsp;&nbsp;&nbsp;&nbsp;&nbsp;&nbsp;&nbsp;&nbsp;&nbsp;&nbsp;&nbsp;&nbsp;&nbsp;&nbsp;&nbsp;System.out.print(1/0);<br />&nbsp;&nbsp;&nbsp;&nbsp;&nbsp;&nbsp;&nbsp;&nbsp;&nbsp;&nbsp;&nbsp;} catch (ArithmeticException e) {<br />&nbsp;&nbsp;&nbsp;&nbsp;&nbsp;&nbsp;&nbsp;&nbsp;&nbsp;&nbsp;&nbsp;&nbsp;&nbsp;&nbsp;&nbsp;System.out.print(&quot;A&quot;);<br />&nbsp;&nbsp;&nbsp;&nbsp;&nbsp;&nbsp;&nbsp;&nbsp;&nbsp;&nbsp;&nbsp;&nbsp;&nbsp;&nbsp;&nbsp;throw new RuntimeException();<br />&nbsp;&nbsp;&nbsp;&nbsp;&nbsp;&nbsp;&nbsp;&nbsp;&nbsp;&nbsp;&nbsp;} catch (RuntimeException re) {<br />&nbsp;&nbsp;&nbsp;&nbsp;&nbsp;&nbsp;&nbsp;&nbsp;&nbsp;&nbsp;&nbsp;&nbsp;&nbsp;&nbsp;&nbsp;System.out.print(&quot;B&quot;);<br />&nbsp;&nbsp;&nbsp;&nbsp;&nbsp;&nbsp;&nbsp;&nbsp;&nbsp;&nbsp;&nbsp;} finally {<br />&nbsp;&nbsp;&nbsp;&nbsp;&nbsp;&nbsp;&nbsp;&nbsp;&nbsp;&nbsp;&nbsp;&nbsp;&nbsp;&nbsp;&nbsp;System.out.print(&quot;C&quot;);<br />&nbsp;&nbsp;&nbsp;&nbsp;&nbsp;&nbsp;&nbsp;&nbsp;&nbsp;&nbsp;&nbsp;}<br />&nbsp;&nbsp;&nbsp;&nbsp;&nbsp;&nbsp;&nbsp;&nbsp;&nbsp;&nbsp;&nbsp;System.out.print(&quot;D&quot;);<br />&nbsp;&nbsp;&nbsp;&nbsp;&nbsp;&nbsp;&nbsp;}<br />&nbsp;&nbsp;&nbsp;}<br />Which of the following statement(s) is/are true?<br /><br />A. The program compiles successfully and prints &quot;ABCD&quot; when executed.<br />B. The program compiles successfully and prints &quot;ACD&quot; when executed.<br />C. The program compiles successfully and prints &quot;AD&quot; when executed.<br />D. The program compiles successfully but prints none of the above.<br /><br />3.Consider the following incomplete program in MyClass.java:<br />java<br /><br />class BaseClass {<br />&nbsp;&nbsp;&nbsp;&nbsp;void print(String s) {<br />&nbsp;&nbsp;&nbsp;&nbsp;&nbsp;&nbsp;&nbsp;&nbsp;System.out.println(&quot;BaseClass&quot; + s);<br />&nbsp;&nbsp;&nbsp;&nbsp;}<br />}<br />class SubClass&lt;E&gt; extends BaseClass {<br />&nbsp;&nbsp;&nbsp;&nbsp;void print(E e) {<br />&nbsp;&nbsp;&nbsp;&nbsp;&nbsp;&nbsp;&nbsp;&nbsp;System.out.println(&quot;SubClass&quot; + e);<br />&nbsp;&nbsp;&nbsp;&nbsp;}<br />}<br />public class MyClass {<br />&nbsp;&nbsp;&nbsp;&nbsp;public static void main(String[] args) {<br />&nbsp;&nbsp;&nbsp;&nbsp;&nbsp;&nbsp;&nbsp;&nbsp;___________________________<br />&nbsp;&nbsp;&nbsp;&nbsp;}<br />}<br />Which of the following way(s) to fill in the blank will produce a program that compiles successfully and prints BaseClass1 when executed?<br />A. SubClass&lt;Integer&gt; obj = new SubClass&lt;Integer&gt;(); obj.print(&quot;1&quot;);<br />B. SubClass&lt;Object&gt; obj = new SubClass&lt;Integer&gt;(); obj.print(&quot;1&quot;);<br />C. SubClass&lt;Object&gt; obj = new SubClass&lt;Object&gt;(); obj.print(&quot;1&quot;);<br />D. SubClass&lt;Object&gt; obj = new SubClass&lt;String&gt;(); obj.print(&quot;1&quot;);<br />E. BaseClass obj = new SubClass&lt;String&gt;(); obj.print(&quot;1&quot;);<br />F. BaseClass obj = new SubClass&lt;Integer&gt;(); obj.print(&quot;1&quot;);<br />G. BaseClass obj = new SubClass&lt;Integer&gt;(); obj.print(1);<br />H. BaseClass obj = new SubClass&lt;Object&gt;(); obj.print(&quot;1&quot;);<br />I. BaseClass obj = new SubClass&lt;Object&gt;(); obj.print(1);<br /><br /><br />4.Consider the following incomplete program in MyClass.java:<br /><br />interface MyInterface {<br />&nbsp;&nbsp;&nbsp;&nbsp;int compute(int x);<br />}<br />public class MyClass {<br />&nbsp;&nbsp;&nbsp;&nbsp;public static void main(String[] args) {<br />&nbsp;&nbsp;&nbsp;&nbsp;&nbsp;&nbsp;&nbsp;&nbsp;MyInterface i = _______________________;<br />&nbsp;&nbsp;&nbsp;&nbsp;&nbsp;&nbsp;&nbsp;&nbsp;System.out.println(i.compute(10));<br />&nbsp;&nbsp;&nbsp;&nbsp;}<br />}<br />Which of the following way(s) to fill in the blank will produce a program that compiles successfully and prints 100 when executed?<br />A. x -&gt; x * x;<br />B. x -&gt; return x * x;<br />C. x -&gt; { return x * x; };<br />D. new MyInterface() { int compute(int x) { return x * x; } };<br /><br />5.Consider the following incomplete program in MyClass.java:<br /><br />public class MyClass extends Thread {<br />&nbsp;&nbsp;&nbsp;&nbsp;private String name;<br />&nbsp;&nbsp;&nbsp;&nbsp;static Integer count = 0;<br />&nbsp;&nbsp;&nbsp;&nbsp;public MyClass(String name) {<br />&nbsp;&nbsp;&nbsp;&nbsp;&nbsp;&nbsp;&nbsp;&nbsp;.this.name = name;<br />&nbsp;&nbsp;&nbsp;&nbsp;&nbsp;&nbsp;&nbsp;&nbsp;count++;<br />&nbsp;&nbsp;&nbsp;&nbsp;}<br />&nbsp;&nbsp;&nbsp;&nbsp;public void write() {<br />&nbsp;&nbsp;&nbsp;&nbsp;&nbsp;&nbsp;&nbsp;&nbsp;System.out.print(name);<br />&nbsp;&nbsp;&nbsp;&nbsp;&nbsp;&nbsp;&nbsp;&nbsp;System.out.print(name);<br />&nbsp;&nbsp;&nbsp;&nbsp;}<br />&nbsp;&nbsp;&nbsp;&nbsp;public static void main(String[] args) {<br />&nbsp;&nbsp;&nbsp;&nbsp;&nbsp;&nbsp;&nbsp;&nbsp;new MyClass(&quot;A&quot;).start();<br />&nbsp;&nbsp;&nbsp;&nbsp;&nbsp;&nbsp;&nbsp;&nbsp;new MyClass(&quot;B&quot;).start();<br />&nbsp;&nbsp;&nbsp;&nbsp;&nbsp;&nbsp;&nbsp;&nbsp;___________________________<br />&nbsp;&nbsp;&nbsp;&nbsp;}<br />}<br />Which of the following way(s) to fill in the blank will produce a program that compiles successfully and prints either AABB or BBAA but never ABBA or any other combinations when executed?<br />A. ;<br />B. public void run() { write(); }<br />C. public synchronized void run() { write(); }<br />D. public static synchronized void run() { write(); }<br />E. public void run() { synchronized (this) { write(); } }<br />F. public void run() { synchronized (count) { write(); } }","- The lectures were very boring. 💤Although the professor had an American accent, which was nice, it didn’t help much with engagement. 😕<br />- The teaching style didn’t match the difficulty of the exam. It’s disappointing that she used relatively simple examples during the lectures that were easy to understand, while the final exam was much harder. 😔<br />- It would be much better if she taught harder material in the lectures, so it would be more similar to the final exam. 😩 It would also be helpful if she taught us how Java compilation works. That would improve the learning experience.",My Performance:<br />- PA1: 88&nbsp;&nbsp;<br />- PA2: 95&nbsp;&nbsp;<br />- Quizzes: Full marks ✅&nbsp;&nbsp;<br />- Final Exam: 34.25&nbsp;&nbsp;<br />- Final Grade: B+<br /><br /> 📈 Final Exam Statistics:<br />- Mean: 42.45&nbsp;&nbsp;<br />- Median: 40.42&nbsp;&nbsp;<br />- High: 83.33&nbsp;&nbsp;<br />- Low: 13.42&nbsp;&nbsp;<br />- Upper Quartile: 54.17&nbsp;&nbsp;<br />- Lower Quartile: 27.71&nbsp;&nbsp;<br /><br /> 📉 PA Statistics:<br /><br /> 🧮 Programming Assignment #1:<br />- Mean: 82.27&nbsp;&nbsp;<br />- Median: 90&nbsp;&nbsp;<br />- High: 100&nbsp;&nbsp;<br />- Low: 0&nbsp;&nbsp;<br />- Upper Quartile: 100&nbsp;&nbsp;<br />- Lower Quartile: 75.42&nbsp;&nbsp;<br /><br /> 🧮 Programming Assignment #2:<br />- Mean: 82.23&nbsp;&nbsp;<br />- Median: 90&nbsp;&nbsp;<br />- High: 100&nbsp;&nbsp;<br />- Low: 5&nbsp;&nbsp;<br />- Upper Quartile: 95&nbsp;&nbsp;<br />- Lower Quartile: 75,"- You can use ChatGPT or Copilot to complete PAs and labs.&nbsp;&nbsp;<br />&nbsp;&nbsp;- For me, I finished the assignments very quickly without typing much code myself.&nbsp;&nbsp;<br />&nbsp;&nbsp;- If the code wasn’t correct, I just asked Copilot or ChatGPT to fix it. 🤖&nbsp;&nbsp;<br />- Overall, the workload is manageable if you rely on AI tools.",2,3,5,5,False,True,True,True,False,False,False,False,False,4,6,False,False,0,[]
FuinalhxQeW8Qq9FwV6cLEHNQOaGRlfO,2024-25 Fall,"[{'id': 1826, 'name': 'SHEN, Jiasi', 'rating': 1}]",False,sheepy,"Dec 25, 2024",Still a hard course,"Looks like introduction to Java but its actually not.<br /><br />Content <br />1.intro to java<br />2. obj and classes<br />3. strings <br />4. inheritance, polymorphism<br />5. exceptions, text I/O<br />6. abstract class, interfaces<br />7. generics<br />8. inner class<br />9. functional programming and lambda<br />10. event-driven programming (little content from JavaFX)<br />11. parallel and concurrent programming<br /><br />Generic and multithreading parts are really confusing even with the examples given. <br />Need some knowledge from comp3511 if you have never learnt multithreading before.<br /><br />Lab<br />There are few optional labs in the beginning of semester with the info of useful tools like git or debug mode. Lab practise let you pratice the topics learnt during lessons.",The prof gives examples for each topic and they includes the tricky part (and also how Java treats stuff). The lectures are OK. <br /><br /><br />The lab only went throught the lab powerpoint about the tasks and oftne finish in 5-10 minutes. Attend the lab in person if you want to ask questions.,"No midterm.<br />8% canvas quiz <br />8% lab tasks<br />16% PA1 (class,parsing,list usage,etc.)<br />24% PA2 (generic,multithreading,synchronization,etc.)<br />44% Final (Mean: 42.5 (much higher than last year),SD: 14.7)<br />Open book, open notes final <br /><br />Both final and canvas quiz are in MC but it may have more that one answers. If the final answer contains any wrong answer then it will give you a 0 for that question. Really harsh system especially with answers that look really similar and you thought they would work the same way but actually not.<br /><br />I got C+ as my final was around lower quartile.",Pop up quiz that release during lesson (can be done within the day)<br />Weekly labs<br />2 Programming Assignment (around 3 weeks time)<br />One final <br /><br />Both PA and labs can use AI tools.<br />But the PAs are really heavy and hard. The first PA often collide with other tasks during those weeks and not much test case is given.&nbsp;&nbsp;The instruction are often unclear and require explanation from the TAs.<br /><br /> PA2 for me is a disaster as most tasks are generic and we have not learnt multithreading at all during release. I dont even know what DAG and data depency graph is at that time and I used a lot of support from online sources and claude. The tasks are pretty abstract and hard to figure out what to implement. Especially last tasks requires running time speed up (lenient grading used already).,4,4,3,2,False,True,True,True,False,False,False,False,False,2,2,False,False,0,[]
KZApBiORW72h3u0VEy9Zz42Fz4AxBUUL,2022-23 Fall,"[{'id': 118, 'name': 'CHEUNG, Shing Chi', 'rating': 1}]",False,DrainGang,"Dec 28, 2022",Good course with bad grading,"Java programming, consider it an extension of COMP2012.<br /><br />Quite the overlap with C++ OOP in the first half of the semester, with new contents in the second half. Overall it is quite nice picking up a new language.","Good.<br /><br />While he&#039;s no Desmond, Professor Cheung&#039;s lessons are interesting, with good live coding demos, useful quizzes and good explanations on topics. There&#039;s a quiz every lecture to count attendance, but it is conducted on Zoom so technically you don&#039;t have to be there. <br /><br />However, it is recommended that you do attend the lectures because they are worth the time and since there are no lecture recordings.<br /><br />Tutorials and Labs can be skipped fully, just complete the Labs and hand them in, the tutorials simply explain what to do in the Lab, which isn&#039;t necessary.","In-class Quizzes and Participation (8%): 2 quizzes every lecture, conducted on the Zoom, the questions are very useful for clearing up concepts, answers for them are released making for great study materials as well.<br /><br />Laboratory exercises (8%): Simple labs, just follow the .md file in the project and complete them. <br /><br />Course assignments (42%): 3 PAs, all around the implementation of a Sokoban game, PA1 plays in the terminal, PA2 runs in a GUI and PA3 implements a multithreaded replay system. Again all are simple and most people get over 90%. <br /><br />Examination (42%): 1 final exam, unfortunately this is where the course gets worse. 20 MCQs, and 5 short programming questions, however all 5 short questions about generic programming, no multithreading, no javaFX, no inheritance. The MCQs are very difficult with multiple correct answers, and you get 0 points if you choose just 1 incorrect answer. Average is around 50%.<br /><br />1% total below mean, C+, bad grading.","Typical for COMP course, similar to COMP2011/12.<br /><br />All labs take around 1-2 hours to complete, PAs may take a week or so.",4,5,3,4,True,True,False,False,False,False,False,False,False,2,2,False,False,0,[]
R3RBaz1Z120lul81VQJNjD5yVncVqZOF,2024-25 Fall,"[{'id': 1826, 'name': 'SHEN, Jiasi', 'rating': 1}]",False,nicaiwoshishei,"Dec 23, 2024",sjs new grade god,Objects and Classes<br />Strings<br />Inheritance and Polymorphism<br />Exceptions and Text I/O<br />Abstract classes and interfaces<br />Generics<br />Inner classes<br />Functional programming and lambda expressions<br />Event-driven programming<br />Parallel and concurrent programming,"Prof Shen has a very fluent English and strong American accent, which makes it comfortable to listen to her teaching. She basically uses Charles&#039;s ppt and switch to her own to demonstrate some corner cases and tricky examples. However, the UGTA often asked hard questions during class and Jiasi could not answer it. Also, the English accent of UGTA is really awful. I barely understood what he was talking about almost every time he asked a question. This makes it kind of waste of time.","Grading scheme:<br />labs 8% (11)<br />in class quizzes 8% (5)<br />PA1 16%<br />PA2 24%<br />final exam 44%<br /><br />Some statistics:<br />almost everyone gets full in labs<br />in class quizzes:<br />mean: 4.13/5 me: 4/5 (I chose a wrong option in the last quiz and got 0 for that)<br />PA1:<br />median: 90 uq: 100 high: 100 me: 100<br />PA2:<br />median: 90 uq: 95 high: 100 me: 95<br />final:<br />median: 40.42 uq: 54.17 high: 83.33 me: 66.25<br /><br />The final exam is a full Multiple ANSWER Questions. There are 20 problems and each worth 5 points. If you choose one wrong option and you will get 0 for that question. Also, almost all of the questions are very tricky, requiring you to be very confident about Java syntax. This is why the median is only 40.<br /><br />Final grade: A+<br />I expected an A since I lost some points for quizzes and my final exam score is more close to uq than to high. Turned out to be an A+. Very generous grading, at least pretty broad A+ range I guess.","Light workload comparing to COMP2012. Labs are very simple. You can finish each lab within an hour every week. PA1 is about very basic java features. You can easily finish it within an afternoon. PA2 is a lot more challenging, especially those new to functional programming and parallel programming. I spent almost a week to finish PA2. The good thing is that this course allows the use of AI. You can lighten your workload if working properly with gpt. However, the exam has totally nothing to do with the labs and PAs. The best tip I can give about preparing for the exam is to review sjs&#039;s examples several times until you fully understand every page. This helps your exam A LOT. After that, the exam questions might not look like as hard as it seems.",3,4,5,5,False,True,True,True,False,True,False,False,False,3,5,False,False,0,[]
YJhMNJMuqHFg9TS72MnWMn3NAOnpDKnd,2023-24 Fall,"[{'id': 1826, 'name': 'SHEN, Jiasi', 'rating': 1}]",False,SrtYdc,"Jan 03, 2024",体验非常不错,"For content detail, check other comments.<br />最近的3021相比前几年review里描述的，删掉了令人厌恶的JavaFX前端，添加了一些多线程的内容，感觉还是非常实用的<br /><br />作为Minecraft玩家兼一点点的模组开发者，上完这课的最后一个topic深切的体会到了多线程优化的艰难，我为我之前骂Mojang和P社多线程优化垃圾而忏悔。",Much better than other PPT readers.<br />沈教授毕竟还是教学经验比较少，课堂整体比较平淡，但看得出来为了提高课堂质量付出了不少努力，上课的互动性不错，可以随时提出疑问并得到“Let&#039;s try it！“的回应<br /><br />沈教授准备了许多examples，上课的时候通常是把Zhang Chuan留下来的ppt过一遍就开始讲解那些examples。<br />单从课堂体验来说teaching大概是大概有B左右，是还可以的平均水平，但那些examples实在是精品中的精品，只要把他们的输出完全啃懂了那相关的topic也基本可以说是被mastered了<br />个人来说其实平常上课都是摸鱼没怎么听，最后两天把examples给啃了就直接去考final了,考试是地狱多选题，2小时33题，但部分题目是一整页代码和另一整页七八个选项，多选！！！！<br /><br />而且也有许多选项非常tricky，选错一个就整题没分导致mean极低，只有大约30分同时sd只有10<br />不过这也到导致只要你把Java啃透啃熟了就能比较轻而易举的拿到高分并甩开你的同学一大截<br /><br />看了下下学期(2324 Spring)是改回了Zhang Chuan教授教，应该会改回和pastpaper里差不多一半选择一半实现了<br /><br />有Attendance，不过一学期只要上15次就是满分，还是合理的,Very Low<br />我是waive掉了2012直接来上的，同时这学期也在上2012<br />截止Event Driven Programming(大概是midterm期间后一点，虽然这课没midterm)，进度和2012出奇的一致，workload基本为0<br /><br />这门课的最精华有用的部分还是在理解Java的lambda背后牵扯的匿名内部类 接口等等各种交织在一起的概念，以及最后浅尝的多线程概念。<br /><br />这门课总共有十几个lab，但因为instructions基本都写在文件里了，加上这课开放GPT，只要你确保你不会落下进度你就可以使用GPT一分钟速通lab，个人来说midterm后所有lab都是这么直接交的，当然最后作为复习还是把多线程和lambda的那几个lab自己写了一遍<br /><br />个人的体验还是非常优秀的,5,5,5,5,False,True,True,True,False,True,True,False,False,5,9,False,False,0,[]
cBmymzuA05YXoeGMLlpFXKD3ylVM9nut,2021-22 Fall,"[{'id': 118, 'name': 'CHEUNG, Shing Chi', 'rating': 1}]",False,enor2017,"Oct 07, 2022",Excellent Professor &amp; Content but difficult,"Using Java 17, the latest java version!! Wonderful!<br /><br />1. Java language fundamentals<br />Basics<br />Classes and Objects<br />Java Development Tools (IntelliJ)<br />String Processing and Text Input / Output<br />Inheritance and Polymorphism [*Important*]<br />Interfaces and Inner Classes [*Important*]<br />Unit Testing<br />Exceptions<br /><br />2. GUI Programming<br />Graphics<br />Event Handling [*Important*]<br /><br />3. Advanced Topics<br />Multithreading [*Important*]<br />Generic Programming [*Important*]<br />Lambdas and functional programming [*Important*]<br />Built-in Functional Interfaces and Streams [*Important*]","One of the best professors I met at HKUST.<br /><br />Professor Cheung is a very passionate professor, and his classes are of high quality. He has a deep understanding of software engineering, explains things clearly, and will always tell you HOW and WHY programmers (especially Java developers) do this instead of just teaching things. <br /><br />He is willing to answer all your questions and respond to emails quickly (I usually get a reply in 10 minutes).<br /><br />It&#039;s also valuable that he teaches the latest Java version with new features included.","[IMPORTANT] If you want a good grade, PAY FULL ATTENTION TO HIS LECTURES. You may think his slides are easy, but he will do lots of demos during lectures containing very tricky stuff. He will also emphasize important points during class.<br /><br />Remember to watch the recording before the exam in case you forgot the early lectures. : )&nbsp;&nbsp;It will definitely help.<br /><br />Grading Scheme <br />- In-class Quizzes and Participation 8%. mean 7.87, me 8<br />- Laboratory exercises 8%, almost everyone full<br />- Course assignments 45%<br />-- PA1 mean 87.94, me 96.39<br />-- PA2 mean 94.69, me 100<br />-- PA3 mean 87.76, me 100<br />- Examination 39%<br />-- MC questions, full 52, mean 20.63, me 42.33<br />-- Short questions, full 48, mean 32.76, me 45.5<br /><br />Grade: A+","I think the workload is good. PA1 is a bit complicated since you need to think of all stuff clearly and there are a lot of codings. I think finish the PA is easy but it&#039;s hard to make it elegant.<br /><br />PA2 and PA3 are shorter, as long as you understand the content, you can finish it very quickly.<br /><br />Perhaps one of the workloads is the polling before each class (since 1 of the 2 classes is 9:00 AM), but as long as you participate in the polling, you get full marks.<br /><br />The final exam is very difficult (if you have experienced his polling questions, you will know). There are 26 multiple-choice questions, each worth 2 points. Multiple correct answers are possible; you will lose all points if you select any one of the incorrect answers, and will get 2 * x / y points if you select x correct answers out of y correct answers. (This is really a workload for TA to calculate scores lol)<br />Remaining 48 points are programming questions, hand-written codes. They are basic stuff, and you should be okay if you pay attention to his lectures.",5,5,5,5,False,True,True,True,False,False,False,False,False,4,7,False,False,1,[]
eGE6ktggzeSq1xl6G3QNsCw4bOE19psA,2024-25 Fall,"[{'id': 1826, 'name': 'SHEN, Jiasi', 'rating': 0}]",False,Matthew YU,"Feb 10, 2025",Crazy course ruined by TAs,"Content is more less than COMP2012. Just copy the slides from previous year. <br /><br />WARNING:THE EXAM IS CRAZY, YOU CANNOT DEPEND WHAT YOU&#039;VE LEARNT FROM CLASS IN THE EXAM!",Professor Shen got a decent American accent. BUT one UG TA totally ruined this course. <br />He always interrupted in class with some questions that professor cannot handle and it turned out being I don&#039;t understand what he was saying due to his poor English. <br />And that&#039;s not the end of story. This crazy man prepared 30-40 pages ppt each tutorial. Each page was filled with very complicated and technical terms.&nbsp;&nbsp;And those ppt does no help to neither exam nor programming assignment. Almost no one comes to tutorial at last.,"2 PAs<br />Quizzes<br />Labs<br />Final<br /><br />One PG TA graded PA1 poorly and other grading is perfectly ok.<br />To be more precise, if you appeal for PA1, your assignment will be regraded under a much more lenient criteria. But this TA didn&#039;t tell students that. So I got a much lower marks than those who had done similar job because I didn&#039;t appeal.","Class intensity is OK. No midterm, but the final is SUPER SUPER crazy.",3,3,2,2,False,True,True,True,False,False,False,False,False,0,0,False,False,0,[]
