hash,semester,instructors,is_author,author,date,title,comment_content,comment_teaching,comment_grading,comment_workload,rating_content,rating_teaching,rating_grading,rating_workload,has_midterm,has_final,has_quiz,has_assignment,has_essay,has_project,has_attendance,has_reading,has_presentation,upvote_count,vote_count,voted,is_upvote,comment_count,attachments
LkJh54zJDe6YmhDi7U0XVjDoW9tanjWz,2021-22 Spring,"[{'id': 110, 'name': 'ZHANG, Charles Chuan', 'rating': 0}]",False,高海千歌,"May 30, 2022","EVERYTHING IS FUCKED UP, EVERYTHING!!! (Alert : Long comments)","(Update 21/10/2022)<br />As my comment floats to the top and the 4 Es may deflect the judgement of people who want to enroll this course in the furture. I make a disclaimer here.<br /><br />If you see 4 Es in this comment session, those are ONLY applicable for 2022 Spring, or any session where the name &quot;ZHANG, Charles Chuan&quot; appears on the name of the instructor in the future (I hope it will never happen though...). For other professors, they are fine and you can consider enrolling their session. Originally, this is a good course but it is completely ruined by this professor, as well as the ratings here.<br /><br />Anyway, I still encourage you to read this comment to see how shxt this professor is and try to avoid him in the future.<br /><br />Ah, btw, I get a B- eventually. I dont know what happened but I sincerely appreciate for Charles&#039;s last pity for not killing me straightly. However, I will still regard this learning experience as TRASH. Don&#039;t think a non-C-range can bribe me and change my mind Charles<br /><br />------------------- Disclaimer end --------------------<br /><br />1. Object and Classes<br />2. Strings<br />3. Inheritance and polymorphism<br />4. Exceptions and text I/O<br />5. Abstract classes and interfaces<br />6. Generics<br />7. Inner Classes<br />8. Functional programming and lambda expressions<br />9. Event-driven Programming with Java FX<br />10. Multithreading<br />11. Aspect-oriented Programming in Java (Optional)<br /><br />Content-wise, it is still OK as it teaches the fundamental of Java. For a Java beginner, I still learn something. The only problem is it still teaches outdated Java FX. Fine, the professor also knows it is outdated so he just skim through the topic in like one to two lectures. However...<br /><br />WHY THE FUCK YOU HAVE TWO LABS WITH JAVAFX??? WITH BUNCH OF METHODSSSSSS TO BE IMPLEMENTED??????<br /><br />Teaches the least, contains the most content in labs...<br /><br />Ok so if you think this has been the worst part of the course, don&#039;t worry, please read the other three titles.","Since this part is ultimately long so I put the central idea first : When you see this prof teaching this course, PLEASE DON&#039;T REG. THIS GUY IS DEKAI 2.0. Wait for SC Cheung or Alex. Or if you don&#039;t mind your elective requirement then just find another elective. FreeCodeCamp is your good friend for learning Java. Anyway, STAY AWAY FROM THIS PROFESSOR!!!<br /><br />Great, talk about the teaching, I am indeed speechless but I still try to describe it out with words so that other people can know what is happening.<br /><br />First, talk about the professor, he is a quite chill guy. He plays music before lecture starts. However, he speaks very very slow. Even I play the lecture recording in 1.25x I still find no difference from a normal person talking. Also, he hesitates a lot. These make me hard to concentrate. Moreover, it seems like he doesn&#039;t know Java very clearly. Quite often when students asked questions, he didn&#039;t know how to answer. I think he is not a really professional Java programmer.<br /><br />However, the lecture is not the worst thing. The worst thing is his course management strategies. <br /><br />The most annoying thing is, his plan keeps changing. At the first lecture, he proposed for 3 PAs and a regular final exam. But at a particular instance of the semester, he changes his mind by adding one more PA (which due during final exam period), shrinking (not cancel) the scale of final (in terms of both amount and grade proportion) and adding unknown amount of assessment tasks. THANK YOU PROF <br /><br />Ok so these are still not quite a big deal compared to the below things. Here comes the real annoyance <br /><br />When everyone feels happy and relieved about the semester finally ends...<br /><br />Professor : SUrPRisE MoThERFuCkER<br /><br />Guess what. He add an assessment task (2nd coding interview) AFTER THE FINAL EXAM, without any prior notification. It just comes randomly, arbitrarily, out of thin air. WHAT THE FUCK? <br /><br />Originally, the coding interview was announced on 26 May and due on 27 May (I am not lying, one day due). This triggered a lot of students because 27 and 28 May still has final exam (For me I have COMP2211 and COMP3111 final in these two days) and the due date is short. Therefore, he changes his mind AGAIN. Instead of asking every students to submit a respond document, he randomly picked 60 students (in 109 students) to have a Zoom interview on 30 May, which is today.<br /><br />I just can&#039;t get it why he insists to hold a interview RANDOMLY and AFTER FINAL. Do you know how I feel about that? <br /><br />I think many of you have played New Super Mario Bros Wii right? When I played it for the first time, I feel relieved that Bowser is finally defeated in the last castle stage. However, a witch comes out and after some magic, Bowser recovers and become giant. When I see that I think : OMG I still need to beat Bowser again? That&#039;s my feeling<br /><br />For some translation : When I feel relieved that final period ends, this course ends, the whole semester ends, this motherfuxker gives out a pop-up assessment, which frustrates me deeply. I just want some rest.<br /><br />Also, I can&#039;t get it why he randomly picked 60 people only, which will make the situation more unfair.<br /><br />Another thing really triggered me is that, even though the course is in complete chaos and professor is clearly torturing us, he still thinks that he is a nice person, these things help us and he does a good job. He claimed that these policies are helping us to &quot;overcome the hard covid period&quot; and &quot;give us more practical practice for Java&quot; . I just got annoyed by these nonsense.<br /><br />Then, the TAs, which are the assistants of professor torturing us. They are not only useless in the lab (Only repeat the ppt), but also nearly made mistakes in any part of their work, which worsen the situation. They are like coming to troll and sabotage us. Here are some examples :<br />1. Labs contained many bugs<br />2. PA contains BUGS and WRONG TEST CASES<br />3. In the midterm coding demo, they gives out WRONG TEST CASES as well, which seriously affect the judgement of students under such a pressure test<br />4. In the final, two of the TAs mistaken the exam time from 15 mins to 20 mins<br /><br />I think these mistakes are very ridiculous, unreasonable and unprofessional. I have never meet a programming course which contains these huge amount of mistakes (We all should appreciate the professional COMP2011 and COMP2012 teaching team). <br /><br />So everything went wrong, and how did the professor deal with it? Make-up. Make-up. Make-up. Anything went wrong just make-up. All midterm and final has make-up (Not maximum policy, so if you screwed up in make-up. Congratulations, you waste time and effort in decreasing your score). I just feel tired when we have 4 midterms and 2 finals in one course. When I am dealing with this course, I hope my life can also have a make-up then I will straightly jump mushroom right now. Unfortunately this is not true. <br /><br />Although prof try to compensate us by offering make-up, I just got annoyed by them. Instead of make-up everything, he should ensure things do not go wrong (Just look at 2011 or 2012, will these programming course be this chaotic?). This is the duty and responsibility of being the course coordinator. It is infuriating that the teaching team made a lot of mistakes but students need to take the accountability and join the make-up. Why? What did we do wrong? We did nothing. All mistakes come from your fucking stupid teaching team. And now we need to waste more time and effort to prepare for those make-upssssss in order to compensate your fault?????? Moreover, the repeated mistakes also implies that professor and TA never learn from history, which is very disappointing.<br /><br />Also, although the professor tries to make the course more fruitful and more practical, unfortunately, they need to be executed CORRECTLY. Otherwise, it will backfire. This professor genuinely does not know how to manage a course but he keep proposing more ideas to make the situation even worse. Currently, everything went wrong and every student in this course is suffering. This course is off the track in any possible direction and it is full of unfairness. It is a catastrophic failure. If you cannot ensure things can be executed correctly, then please don&#039;t propose them out. Just adopt the usual course structure. Your proposed changes just created a more unfair situation and tortured students more. WHAT IS THE POINT?<br /><br />The only good thing from this course is that the professor opened a complain board (forum), where students can complain anonymously. GOOD, because now everyone can see how we suffered from this piece of shit. Everyone can see how desperate, helpless, frustrated and angry we are. <br /><br />Very probably the fucking prof and TAs deal with none of the complaints; but have been reading it with a big smile on their face, just like those celebrities watching player falling from the glass bridge one-by-one in Squid Game.<br /><br />If you are interested, please access the website below (I swear it is not virus or rickroll. If it is then i get five Ds in this semester)<br /><br />Website of complain board : https://xoyondo.com/mb/2WXq6OJsZWP5cZk<br /><br />I use 3 songs to summarize this course. Prof I recommend you to play them in your lecture because they fits you:<br />https://www.youtube.com/watch?v=X-KwYX2u8e4<br />https://www.youtube.com/watch?v=gkTb9GP9lVI<br />https://www.youtube.com/watch?v=_B0CyOAO8y0 <br />(ps : 1.25x speed is recommended for the third one)<br /><br />(I can&#039;t believe I used half hour to criticize a course...But I am very angry about this course so I just did it. If here has option of F I will definitely give all Fs)<br /><br />(Update 31/5/2022)<br />Now the prof made a new BIG TROLL. For our PA4, he proposed a new marking scheme today suddenly. Aside from the correctness of the code (output checking), now the semantics are also take into account. Specifically, &quot;Whether your code is robust and close to the best practice for the programming task&quot; (From prof. email). That is, if your output is correct but you write spaghetti code then you will still got point deduction.<br /><br />(The above coding review part is applicable for non-interview students only. For interview student, they will consider interview performance instead.)<br /><br />In 109 of students, 78 students got marks deduction, either -12 marks or -24 marks out of 100 marks<br /> <br />I GOT DEDUCTED BY 24 MARKS. WOW<br /><br />I mean...it is good to ask student not to write spaghetti code and practice for a good programming habit. However,<br /><br />YOU NEVER MENTION IT BEFORE<br /><br />How can your marking scheme change suddenly after we submitted the assignment? Does that even sound fair??? University always emphasize honesty and warns student not to cheat, but now this professor shows ZERO HONESTY and cheated on us. <br /><br />I start suspecting the whole teaching team did these things deliberately due to some reasons (Revenge?). I can&#039;t imagine the whole teaching team is stupid as fuck and did EVERYTHING wrong.&nbsp;&nbsp;Moreover, the teaching team start trolling and sabotage us after the SFQ is due so that we cannot change the ratings. GOOD. I will blacklist this prof forever.<br /><br />Anyway, I am done with this course. As long as you don&#039;t give me F then I am contented.<br /><br />(Update 31/5/2022 13:27)<br />Fine, since too many students complained, the professor finally gives up this new policy","1. Labs 10%<br />2. Lecture exercise 10%<br />3. Programming assignments (10%+15%+15%+15%)<br />4. Mid-term coding show (5%+10%)<br />5. Final exam (10%)<br />6. Coding interview (??%+??%)<br />7. Bonus of finding error (+2% max)<br /><br />The only thing I would say is : GARBAGE<br /><br />The proportion of daily assessment and exam assessment is 75:25. For a programming course, it is a nightmare. Because everyone will just get full marks in daily assessment, which means everyone has got 75% by default (If not then you have already died). Moreover, the mid-term coding shows are also easy. Many people just get &gt;90% or even get bonuses. <br /><br />So the only component to determine your fate is the final. And guess what is the format?<br /><br />20 T/F questions, in 15 mins<br /><br />Great, my grade just comes from luck. Even if you don&#039;t know something, you can treat it as a random lottery and you may still get good grade because P( getting a question right) = 1/2. RIDICULOUS. <br /><br />As a result, everyone will very likely to get &gt;90%, and imagine getting overall &gt;90% but ends up a C range, how will you feel? <br /><br />Someone makes joke:<br />100% : A<br />99% : B<br />98% : C<br />97% : D<br />&lt;=96% : F<br /><br />I doubted whether it is joke now<br /><br />These assessments and grading scheme just failed to discriminate students&#039; ability so they are indeed TRASH.<br /><br />Moreover, if you ask why do I put question marks in the proportion of coding interview, that&#039;s because even the professor nor the course website didn&#039;t mentioned the proportion at all. The two coding interview just popped out randomly. We are being told and threatened that they may affect our grade and if we don&#039;t do the interview then we will receive marks deduction. That&#039;s all. It is non-transparent as fuck<br /><br />Ok so now I finally know what the coding interview is for. Please see the updated part (the last paragraph) in &quot;TEACHING&quot; (Update 31/5/2022)<br /><br />Grade has not been released yet. After released I will update. But being a newbie of Java and make quite a few mistakes, very probably I will get C range. RIP my cga<br /><br />Even though the grade is unexpectedly good, I will still regard this course is a trash course since the arrangement is in chaos and ridiculous.","1.) 9 Labs (2 can be skipped) + 4 PAs<br />Usual programming course work. Nothing special.<br /><br />One interesting thing is, for this course, labs are even harder than PA. I don&#039;t know why. Moreover, in this course, labs and PA lacks instructions. Quite often I just got lost when reading the lab ppt or PA description. TA are also useless so you will got lost easily.<br /><br />2.) Lecture exercise<br />a.k.a. attendance. Not every lectures have but it is pop-up randomly so you cannot skip class unless you have friends to carry you. Even though you submit piece of shit you still get the point. <br /><br />3.) 2 midterm coding demo (+ 2 make-up)<br />Midterm exam. However, it is in coding format. Specifically, you will get the problem description at the beginning of the midterm. Then, you need to write programs to solve it and submit to Canvas. The time limit is short, if you are not familiar enough you may got stuck and cannot finish the tasks.<br /><br />Unfortunately, the logistics are in a mess. As mentioned in &quot;Teaching&quot; part. TAs perform badly in handling the exam as they can gives out WRONG TEST CASES. Moreover, we are divided into four timeslots to attend the exam. Some students claimed that the problem in different time sessions are same or similar and this may lead to cheating or unfair situation. As a result, both midterms got make-up<br /><br />4.) Final (+ make-up) <br />As mentioned before, 20 T/F questions. Lottery time<br /><br />Also, as mentioned before, due to two stupid TAs mistaking the exam time limit and the subsequent unfair situation, we got to make-up AGAIN<br /><br />5.) 2 coding interview<br />You will need to propose modifications or new features to existing lab tasks or PA (Maybe prof or TAs are lazy to design the tasks for next year). The first one you need to submit document. The second one is Zoom interview and only 60 out of 109 students need to attend.<br /><br />------------------------------------------------------------<br />As a 3 cred course, the workload is somewhat equivalent to or even more than comp2011 or comp2012, which are 4 cred course. And the number of exams...BRAVO<br /><br />Moreover, I think the toughest workload is that we need to bear the repeated and repeated mistakes made by the TAs and the unreasonable arrangement from the professor. The psychological impact and frustration is much more heavier than those physical workload. At the end of the course, my heart is just tired as fuck.",1,1,1,1,True,True,False,True,False,False,True,False,True,78,78,False,False,0,[]
K4pd82csRcXz9G9sbgYGlgcx5jcPl3jz,2021-22 Spring,"[{'id': 110, 'name': 'ZHANG, Charles Chuan', 'rating': 0}]",False,MissSomebody,"May 29, 2022",應該會係COMP3021 教得最垃圾既一個SEM,1. Object and Classes<br />2. Strings<br />3. Inheritance and polymorphism<br />4. Exceptions and text I/O<br />5. Abstract classes and interfaces<br />6. Generics<br />7. Inner Classes<br />8. Functional programming and lambda expressions<br />9. Event-driven Programming with Java FX<br />10. Multithreading<br />11. Aspect-oriented Programming in Java<br /><br />咩年代 仲教Java FX? 邊個用,"條友以為自己教得好好 但其實勁垃圾<br />堂堂LECTURE都播歌以為自己好Chill 教好d書先啦<br /><br />最好笑既係 上堂問佢lecture入面d answer 佢好好野叫你自己去compile 唔好乜都問佢<br /><br />記得有一堂有個同學問佢野 唔知佢係唔識定點 話下堂會講 點知下堂都無答到 <br /><br />整個complaint board出黎 都唔知有冇睇<br /><br />d TA 又向左走向右走, midterm final 乜都可以remake 可唔可以remake埋個prof同ta佢?<br /><br />最向左走向右走係 完L左SEM 仲加份唔知乜春Assignment interview, 連佔overall幾多%都唔講 都CLS. 咁L得閒<br /><br />總結：<br />根本學唔到野 全部chapter都係自己上網學 多謝charles zhan g you are a good guy<br />gg la ha",1.	Lab Participation 10%<br />2.	Lecture Participation 10%<br />3.	Assignments	4份 55%<br />4.	Midterm Coding Show 15%<br />5.	Final Assessment 10%<br /><br />Final exam True/False 15分鐘 20條 根本睇運氣<br /><br />Overall 96/100 食B 好野,"what is workload exam period出一堆additional work 又加assignment interview <br />做左既人就慘了 一開始仲要扣分制interview 見到自己扣分都唔好話唔驚 個cut off 1,2 分就一個subgrade. 點知到最後全部cancel, 又白驚又白做.<br /><br />Conclusion:<br />In Charles, We trust.<br />Charles: 彈出又彈入 你吹得我漲啊",1,1,1,1,False,True,True,True,False,False,True,False,False,37,37,False,False,0,[]
