hash,semester,instructors,is_author,author,date,title,comment_content,comment_teaching,comment_grading,comment_workload,rating_content,rating_teaching,rating_grading,rating_workload,has_midterm,has_final,has_quiz,has_assignment,has_essay,has_project,has_attendance,has_reading,has_presentation,upvote_count,vote_count,voted,is_upvote,comment_count,attachments
4VxCz3dQgFGXV7G778iXNPrEZzaKAZmr,2023-24 Spring,"[{'id': 1901, 'name': 'WEI, Victor Junqiu', 'rating': 0}]",False,Bits,"May 26, 2024",Ilya Sutskever will fail this final.,"Topic is good, I actually learned something (by myself). <br />However, trying to comprehend the information conveyed in the slides felt like solving a sudoku puzzle. The slides did not directly express the key points and concepts. Instead, I had to use logical reasoning and deduction to figure out what the slides were attempting to communicate. The slides lacked clarity and straightforward explanations, requiring significant mental effort to extract the underlying meaning.",The instructor is very similar to &quot;Eliza&quot; the chatbot.<br />He&#039;s just reading the slide with adding &quot;OK&quot; at each end of sentence (just like the code below).<br /><br />``` <br />content = ocr(slide)&nbsp;&nbsp;&nbsp;&nbsp;&nbsp;&nbsp;<br />prof.read((&quot;OK&quot;).join(content.splitlines()))<br />```,"The final exam is like a inverse-turing test. If you pass the exam, you are not a human, you are a robot. Because it&#039;s nothing about knowledge, it&#039;s just a huge amount of calculation. No one can do this much of calculation by hand in 3 hours.<br /><br />I&#039;ve never experienced this kind of final exam in my whole life. So stupid.","Light, but we learned nothing from the assignments. We need more exercises! More PyTorch coding!!!<br /><br />Overall, I&#039;d say the instructor was so lazy. He didn&#039;t take this course seriously at all, and this was very disrespectful to all the students who took his course :(",3,2,1,3,True,True,False,True,False,True,False,False,False,18,18,False,False,1,[]
mfX02EVOLJdlZI6xr2DsZfVbzcAv9soT,2018-19 Spring,"[{'id': 104, 'name': 'WU, Dekai', 'rating': 1}]",False,2042XXXX,"Jun 04, 2019",if (professor == dekai) { students-&gt;course.drop();},"The content of this course is supposed to be rich, giving students ideas what NLP is.<br /><br />There are 3 assignments, midterm and final in the course.<br /><br />The assignment in this course is full of idealism that Dekai wishes the TA to design yet the TA has no time to do it at all. I personally felt bad for the TA as <br />1. The TA don&#039;t even have any materials sent by Dekai<br />2. The TA is asked by Dekai to asked question that he never mention and define in class (Search Bias), so basically the TA doesn&#039;t know what does it mean either.<br /><br />All in all, there are 3 assignments in this course for this semester, in which assignment 1 was a easy and basic one, and I already get lost in assignment 2 and 3 as I have no way of catching up and understanding his ideas.<br /><br />As a sidenote, the assignment 3 was broken up into Part A, B and C and suppose we would hand in part by part. This caused a lot of confusion to the class at first and the deadline was unclear at the first.<br /><br />The Midterm consists of discussion in class about ethnics and some basic hazards he thinks AI could do to humanity (not strictly related to NLP but that&#039;s his style), some POS tagging which he spend only one lecture and giving no exercise to us and suppose we will achieve 100% marks from that after weeks of introduction. Seriously is this set up to fail us? I don&#039;t know, but most of us can&#039;t even understand the POS tag basics during that lecture.<br /><br />Let&#039;s be clear that I did not study for the final because I have already given up the course by that point. It consists of a lot of pseudo programming using C++ syntax and also some question yet again discussed in class.<br /><br />All exams are open handwritten notes (although the definition of &quot;handwritten notes&quot; is not clearly defined by the professor and TA)","Although I gave the grade E here, but let&#039;s admire him for one of the very few professor that in UST who teaches with passion and energy. I do think he really does a great job of enhancing the atmosphere of the classroom.<br /><br />These traits, however, is neglected by how unclear, messy, unstructured and unreleased lecture notes to further help understanding to the deep and wide knowledge I wish the course provides to me.<br /><br />I wish he knew that not all and actually most of his students are not genius and would like step by step approach to have a better introduction to this matter. While I&#039;m okay with his introduction of the backgrounds, his content and difficulty skyrocketed as he is skipping many ideas without even explain it slowly, and not having any contents on what he&#039;s trying to say in class just made everything worse and worse.","Dekai never gave any clear definition of the grading scheme of the course, but I got C-. He does say you will get guarantee grading on achieving certain point, but I saw some reviews already include this so I am not bothering to repeat here.<br /><br />Let just say it is relatively good as I didn&#039;t do 75% of assignment 3, and most things I wrote in the final, I actually have no ideas what I am doing. I was expecting to get an D or F, but C- was really unexpected.","Very heavy. with assignments released and due in a week, many students found it hard to complete with in time. He, however is willing to extend the deadline often as quite clearly the class has stated that we all have no idea what you homework is all about.<br /><br />And lastly to those who read all of my grumble till to this very end, thank you and please, if you want some introduction to NLP, don&#039;t take this course. It is not worth your time to waste here.",1,1,4,1,True,True,False,True,False,False,False,False,False,15,15,False,False,1,[]
FwFklphRlqrdDqia1s9H8eUI0s145mnv,2019-20 Spring,"[{'id': 104, 'name': 'WU, Dekai', 'rating': 0}]",False,A0,"Jun 13, 2020",DO NOT TAKE THIS COURSE!,"DO NOT TAKE THIS COURSE!<br /><br />Do not take this course if you want to learn natural language processing. Go to MIT / Standford / Coursera / Udemy instead.<br /><br />What I learnt:<br /><br />1. How to use Dekai&#039;s forum. <br />We spent 2 lectures to register our account in the forum.<br />And spent 2 lectures doing discussions on the forum.<br /><br />2. How to play Dekai&#039;s translation game.<br />We spend 2 lectures playing his translation game.<br />I understand that this game teaches us about the difficulty of language translation, but sorry, playing the game for two lessons feels like a waste of time.<br /><br />3. How to simulate Dijkstra Algorithm with washers and strings","DO NOT TAKE THIS COURSE!<br /><br />Well, this semester&#039;s teaching is done through ZOOM so you won&#039;t have the problem of missing a lecture or write notes since you can just re-watch the lecture recordings.<br />So the problem of not giving out lecture notes mentioned in previous reviews would not be as big of a problem than normal face to face lectures.<br />But it would be better if Dekai can released the lecture notes since without the lecture notes, I needed to type the lecture notes myself in a word document during the lecture, which is annoying.<br />Some students asked Dekai during lecture to release the lecture notes, because the equations are quite complicated, he agreed, but never did.<br /><br />His English is okay, but it is hard to understand the content, since some of the content is difficult such as the Hidden Markov Model, CKY parsing, ITG hypothesis...","DO NOT TAKE THIS COURSE!<br /><br />Grade weighting<br />Exams 	0% (due to university coronavirus measures)<br />Pop quizzes	~10%<br />Class participation 	~15%<br />Forum participation 	~10%<br />Assignments 	~65%<br /><br />My grades for pop quiz:<br />I don&#039;t know, there were no pop quizzes in the whole semester. And Dekai didn&#039;t mention where the points from pop quiz is allocated to. So it is a mystery.<br /><br />My grades for assignment:<br />Assignment 1: 100/100 (Some students obtained 5 more points for bonus)<br />Assignment 2: 100/100<br />Assignment 3: 100/100<br />Assignment 4: 100/100<br /><br />My grades for class participation:<br />I don&#039;t know my grades for class participation, because Dekai never released the grades for this part.<br />I would just guess that I get a mean mark for this part, since I would consider my participation in the class would be normal.<br />But still, I don&#039;t know how this part is graded because a clear marking scheme for class participation is not there for us to see.<br />So if he wants, he can just gives you bad grade just because you look ugly, or gives you good grade, if you kept on liking his boots.<br /><br /><br />My grades for forum participation:<br />I don&#039;t know my grades for forum participation, because Dekai never released the grades for this part.<br />But I would just guess that I got a pretty good grade for forum participation, since I would say that I was quite active in the forum, answering questions and asking questions.<br />Again, no one knows how this part is graded, since he never released the marking scheme for this part.<br /><br />My grade: B+<br />Overall grading was not good.<br />Only 13 students enroll in this class, and in the first lecture, he said he was quite lenient for giving A range grade that he usually need to beg ARR for allowing him to give out more A ranges than usual.<br />So I figured that for grading 13 students in a curve, a lenient A range, full marks assignment, okay class participation and good forum participation, then I would expect an A-. But he gives B+ for me, lower then I expected.<br /><br />With no grading detail and mark release for class and forum participation, weighting percentage (with the disappearing pop quiz). The grading was not transparent at all. So expect your final grade to be marked subjectively.","DO NOT TAKE THIS COURSE!<br /><br />Mid-term/Final:<br />No mid term and final for this semester, so you don&#039;t need to memorize how Dekai Wu is spelt. (To be honest, I think every CS student in HKUST knows his name since he was quite infamous for his teaching, just look at the other reviews)<br /><br />Assignments:<br />Assignments are due in one week ~ 1.5 weeks, and it is quite hard to finish them in time especially if you are year 4 with FYP or took a lot of courses in that semester.<br /><br />Assignment 1: Dijkstra Anagram<br />Assignment requirement is to write a program to do Dijkstra algorithm for generating anagram.<br />This first assignment is okay, not too difficult. <br />But for getting the 5 points bonus it is quite hard, since your program need to run fast enough within 20s for 14 character length word, which required you to use some sort of pruning to achieve that efficiency.<br /><br />Assignment 2: HMM<br />Assignment requires to write a program for Hidden Markov Model backward forward algorithm.<br />This assignment is hard, since the concept and equations of backward and forward algorithm and HMM is quite difficult and complicated. So you need to spend a lot of time to understand it.<br />And with the complicated equations, debugging takes a long time.<br /><br />Assignment 3: Feedforward POS Tagger<br />Assignment requirement is to loop through the scientific method for feed forward part of speech tagger.<br />This assignment is easy in terms of coding, since for every hypothesis, just a few lines of code is needed to be changed.<br />The annoying part is that you would need to write observations of the training set, description of hypothesis, and do error analysis for each hypothesis.<br />And because I didn&#039;t know whether the answers are correct or not, I tried to write as long as possible for the description and explanation, which I used a lot of time to do. I don&#039;t know whether it is necessary to write so long, but in the end I got 100/100<br /><br />Assignment 4: RNN <br />Assignment requirement: create bidirectional RNN, LSTM, and bidirectional LSTM model for tagging part of speech for the training set with the starting code of RNN.<br />I would say this is the most useless and annoying assignment because the machine learning framework used in this assignment is LEGO, which is developed by Dekai and his TAs.<br />Why the hell would you ask the students to use C++ and your own LEGO machine learning framework, but not python with state-of-the-art machine learning framework such as pyTorch or Tensorflow?<br />Not to mention that because the framework is developed by Dekai and his TAs, there are no documentation that you can refer to understand how LEGO actually works.<br />So you would spend a lot of time trying to understand the starting code with the comments, do trial and error to understand how different function works and the output of different variables.<br />Basically, this assignment teaches you to use LEGO machine learning framework, which you would never ever use again in your whole life. (Unless you decide to do postgrad and become his TA)",1,1,1,1,False,False,False,True,False,False,True,False,False,8,9,False,False,0,[]
eMU9fh15I4FrZ7a0L3DoHvO8hKNG11hJ,2018-19 Spring,"[{'id': 104, 'name': 'WU, Dekai', 'rating': 0}]",False,Luoshu,"Jul 11, 2019",I have no idea what the hell dekai is talking about.,"The course title about the course is &quot;natural language processing&quot;. However, I have no idea what the professor is talking about.<br /><br />The course material related to the NLP is taught after the midterm exam. Before the midterm, it is all about some historical staff. (In fact, I am not a fan in history and humanity. I cannot remember what exactly it is taught.)","Normally, in one lecture, the professor will talk something about himself or the AI ethics (such as some buzz word about him being elected to some council). Afterwards, he may deliver some jibber jabber about the language history or some other boring staff.<br /><br />To be honest, at the first two weeks of the semester, I think it was my problem that I cannot understand the content and the purpose of his teaching. However, after several weeks, when I realized that the teaching is not understandable at all.<br /><br />Ultimately, if you are really a huge fan of painful experience (or &quot;抖M&quot; in Chinese), I strongly recommend you to take this course.","To my great surprise, the grading is astonishingly good. For your information, the weight of assignments are very high, so please make sure you complete all assignments in a serious attitude.<br /><br />After checking my final exam, I have scored below the mean score. However, I am still able to obtain an A- grade. Anyway, this is a course that you don&#039;t have any idea about the grading detail.","There are 5 assignments in total. Due to the fact that I need to count on those assignments, I need to finish them in a deep and complete way. In fact, I have no idea how these will affect me. Therefore, all I can do is to write my report as long as possible.",1,1,5,2,True,True,False,True,False,False,False,False,False,5,6,False,False,0,[]
yOeh5eSqUiAfkwqQeIygKADSAZiwCyRN,2024-25 Fall,"[{'id': 1901, 'name': 'WEI, Victor Junqiu', 'rating': 1}]",False,Richard Blažek,"Jan 10, 2025",,"Covers everything about natural language processing...<br />Segmentation (regular expressions, tokenization, lemmatization, normalization, byte-pair encoding), n-gram (with smoothing and interpolation), text classification, logistic regression, neural networks, backpropagation, convolutional neural networks, recurrent neural networks, transformer architecture, word encodings (word2vec etc.), machine translation, chat assistant systems and information retrieval.","Teacher is okay, but most people didn&#039;t attend the lectures (like 3 people attended an average lecture, even though there were around 20-30 students). I regret not attending them though, because I would certainly get a better grade on the final exam if I did.<br /><br />The teacher has a habit of saying &quot;okay&quot; more than once per minute, like after every other sentence.","The final exam was quite hard as there was a lot of material. The midterm wasn&#039;t hard, but there was not enough time to actually do all the questions (it was worth skipping some time-consuming questions and start with the quick ones). Assignments and project were not that hard and they were graded fairly.","There are two assignments and one project. The assignments are very similar to the exam (exam is the assignment plus a few extra questions), so by doing them you also prepare for the exam in large part. For the project, there were detailed instructions for what you have to do, so it didn&#039;t take much ingenuity to do it, you just follow the steps.",4,4,4,3,True,True,False,True,False,True,False,False,False,1,1,False,False,0,[]
8spb52PQ9F0jeAcCb93D4HMpdz1ogIQ6,2017-18 Spring,"[{'id': 104, 'name': 'WU, Dekai', 'rating': 0}]",False,gossipgirl,"Jun 02, 2018",Weird course,Content covers the following topics: <br />1. Bigram models<br />2. Anagramming<br />3. HMM<br />4. IBM Models for Machine Translation<br />5. ITG Models for Machine Translation<br />6. CFG/PCFG/CYK Algorithm for parsing<br /><br />The content is quite old. Agreed that some of these are important topics in this field but I expected an introduction to Neural MT or something.,"I didn&#039;t like the teaching whatsoever. People say he&#039;s very passionate about the field etc etc. Agreed, but while teaching a course there should be a solid structure of content and way to assess students. 12 weeks of classes feel like a blur when you heard a lot of things but don&#039;t quite understand them too well.<br /><br />There are no lecture notes as such. In class, a pdf of his book (should have been printed 3 years ago)&nbsp;&nbsp;is used an then a printout is given before the exams. This makes it very difficult to take good notes and clear doubts during the semester.","Dekai&#039;s grading scheme is very flexible and changes almost every year he teaches. He doesn&#039;t tell us the final scheme he used but a rough idea is<br />5% participation<br />50% assignments<br />20% midterm<br />25% final<br /><br />Depending on how many assignments he gives, he adjusts the weight of the exams. He originally planned to teach scheme but due to lack of time, gave only 1 programming assignment and 1 written assignment. Also, he doesn&#039;t release the score of the final. (Yes, quite a few unknowns in the course)<br /><br />I would say the final grade isn&#039;t that bad. His midterm is very easy and scoring. Final is definitely a bit harder. A range should not be very difficult.",Very light workload this semester.,3,2,4,5,True,True,False,True,False,False,False,False,False,2,3,False,False,0,[]
UnWUGZIo7Zj9ORWTK18evCR7UradpElP,2023-24 Spring,"[{'id': 1901, 'name': 'WEI, Victor Junqiu', 'rating': 1}]",False,Hung Ching Hei,"Aug 08, 2024",,"The amount of content is very large, but the instructor will tell you the scope of the exams, so you don&#039;t need to revise all the notes","Since the instructor is just reading the ppt, it can be quite boring. But the instructor is willing to answer your email and questions. So please don&#039;t hesitate to email him if you got a question.","Assignments (30%)<br />Course Project (20%)<br />Mid-term Exam (20%)<br />Final Exam (30%)<br />For assignment, project and mid term exam, you can say they are extremely easy, the mid term exam is even easier than the assignment. So final exam become the one that decide your grade, which need you to calculate the same stuff for like 4 to 5 times just for 7-8 marks, the whole exam is like this(just like others says-- inverse turing test). Please make sure you are well prepared for the final exam",2 assignments<br />1 individual project<br />mid term and final exam<br />Not very large workload since the assignments and project are very easy to complete,3,4,2,5,True,True,False,True,False,True,False,False,False,0,0,False,False,0,[]
M6leWeutbrfyAvRCc8cQN2uXPUSiznUz,2017-18 Spring,"[{'id': 104, 'name': 'WU, Dekai', 'rating': 0}]",False,readalot,"Jul 31, 2018",old fashioned contents,The content was very old because he did not handle with deep learning such as Neural MT. <br /><br />The content covered the following topics: <br />- Bigram models<br />- Anagramming<br />- HMM<br />- IBM / ITG Models for&nbsp;&nbsp;Machine Translation<br />- CFG/PCFG/CYK Algorithm for parsing,He was passionate but I don&#039;t like his teaching style. He did not share his lecture note such as pdf.,"He did not said the final scheme clearly, but said a rough idea <br />- 5% participation<br />- 50% assignments<br />- 20% midterm<br />- 25% final<br /><br />A midterm was easy and scoring. A final was felt a bit harder.",considerably light workload.,3,3,3,4,True,True,False,True,False,False,False,False,False,1,3,False,False,0,[]
3iSKkS9r8eIAhBqZgKQhiGSj1IfO1ixD,2019-20 Spring,"[{'id': 104, 'name': 'WU, Dekai', 'rating': 1}]",False,RZ,"Feb 02, 2021",,"The content was interesting. But he didn&#039;t have time to address most of them, cause it was easy for us to start chatting. The content started from the history to some algorithm.",Teaching was fair and sometimes interesting. But Dekai never uploads the slides so it&#039;s always hard for me to follow in most of the time.,Absolute grade:<br />Participation<br />Tutorial participation<br />Forum participation (He has set up a forum for this course)<br />Assignments<br />In-class quiz,"Workload was fair but the ddl was always tight. And it always costs much time to think about the right way to solve the problems. Assignment is released on his forum without noticing you on canvas, so make sure to check the forum frequently.",3,4,3,3,False,False,False,True,False,True,True,False,False,0,3,False,False,1,[]
rNbieR1qFuCTfHkY89QqmZWO6vGlbBHo,2016-17 Spring,"[{'id': 104, 'name': 'WU, Dekai', 'rating': 1}]",False,Frederica,"Jan 15, 2018",,He gives an interesting perspective on Natural Language Processing as he is one of the ground-breaking researchers on translation. You will learn a lot about the Chinese &lt;-&gt; English translation.,You will learn lots of theory as with every CS class in HKUST and some functional programming. He&#039;s a great teacher and his class is secretly a philosophy class as well. He encourages students to take NLP from other professors too if given the chance because he believes that each professor who teaches NLP gives a different perspective on it. It is not as hard to fall asleep in his class because he has quite a personality.,"In terms of grading, the breakdown for his class is: <br />85%	&nbsp;&nbsp;&nbsp;&nbsp;&nbsp;&nbsp;&nbsp;&nbsp;A<br />75%		B	<br />65%		C	<br />55%		D	<br /><br />Midterm exam	~20%<br />Final exam	~25%<br />Participation	~5%<br />Assignments	~50%<br /><br />Exams are not open book.",,4,4,4,3,True,True,False,True,False,True,False,True,False,0,10,False,False,0,[]
