hash,semester,instructors,is_author,author,date,title,comment_content,comment_teaching,comment_grading,comment_workload,rating_content,rating_teaching,rating_grading,rating_workload,has_midterm,has_final,has_quiz,has_assignment,has_essay,has_project,has_attendance,has_reading,has_presentation,upvote_count,vote_count,voted,is_upvote,comment_count,attachments
aTAXnBfwKZCtx1jH7YDYvenKwr5gMqNf,2018-19 Spring,"[{'id': 104, 'name': 'WU, Dekai', 'rating': 0}]",False,Stan1ey,"Jun 05, 2019",The best(worst) course of HKUST?,"What I expected:<br />Human language technology for processing text and spoken language. Fundamental machine learning, syntactic parsing, semantic interpretation, and context models, algorithms, and techniques. Applications include machine translation, web technologies, text mining, knowledge management, cognitive modeling, intelligent dialog systems, and computational linguistics.<br /><br />What I have:<br />2019.01.31	1	Lecture	Welcome; Introduction; Survey<br />2019.02.05	1	Holiday	Lunar New Year<br />2019.02.07	1	Holiday	Lunar New Year<br />2019.02.12	2	Lecture	Impact of AI on ethics and society<br />2019.02.13	2	Lecture	Does God play dice? Assumptions: scientific method, hypotheses, models, learning, probability; linguistic relativism and the Sapir-Whorf hypothesis; inductive bias, language bias, search bias; the great cycle of intelligence [at tutorial]<br />2019.02.14	2	Lecture	Languages of the world<br />Administrivia (honor statement, HKUST classroom conduct)<br />2019.02.19	3	Lecture	Learning to translate: engineering, social, and scientific motivations<br />2019.02.20	3	Lecture	&quot;It&#039;s all Chinese to me&quot;: linguistic complexity; challenges in modeling translation [at tutorial]<br />2019.02.21	3	Lecture	Is machine translation intelligent? Interactive simulation [at tutorial]<br />2019.02.26	4	Lecture	Evaluating translation quality: alignment; aligning semantic frames: Interactive exercise	<br />2019.02.27	4	Lecture	Evaluating translation quality: HMEANT [at tutorial]	<br />2019.02.28	4	Lecture	Evaluating translation quality: MEANT	<br />2019.03.05	5	Lecture	Evaluating translation quality: semantic role labeling (SRL), case frames, semantic frames, predicate-argument structure	<br />2019.03.06	5	Lecture	Automatic semantic role labeling (ASRL) [at tutorial]	<br />2019.03.07	5	Lecture	Implementing a feedforward neural network based part-of-speech tagger Assignment 1 due 2019.03.15 23:59; context-independent POS tagging	<br />2019.03.12	6	Lecture	I/O representations for feedforward networks; context-dependent POS tagging	<br />2019.03.13	6	Tutorial	Basic probability theory; conditional probabilities; Bayes&#039; theorem	<br />2019.03.14	6	Lecture	Example-based, instance-based, memory-based, case-based, analogy-based, lazy learning for classification; translation via nearest neighbors (NN); k-NN; weighted k-NN	<br />2019.03.19	7	Exam	Midterm (closed book; handwritten notebook only)	<br />2019.03.21	7	Lecture	Midterm review; machine translation techniques	<br />2019.03.26	8	Lecture	Learning vs performance components in machine learning; supervised learning; Word sense disambiguation; lexical choice; example-based prediction models; nearest neighbor classifiers; similarity metrics; kNN classifiers	<br />2019.03.28	8	Lecture	Exploring different feedforward neural network architectures for POS tagging; model design following scientific method for machine learning in practice Assignment 2 due 2019.04.10 23:59; AI ethics	<br />2019.04.02	9	Lecture	Naive Bayes classifiers for WSD and lexical choice	<br />2019.04.04	9	Lecture	Modern approaches to SRL; corporate responsibility in AI	<br />2019.04.09	10	Lecture	Implementing chunkers and shallow parsers via IOBES tagging plus a POS tagger Assignment 3 due 2019.05.10 23:59	<br />2019.04.11	10	Lecture	Chunking via IOBES representations; shallow bracketing	<br />2019.04.16	11	Lecture	Shallow syntactic parsing; shallow semantic parsing; language bias of IOBES representations, bags of words, and one-hot representations	<br />2019.04.18	11	Lecture	Introduction to word embeddings	<br />2019.04.23	11	Lecture	Vector space models; classic word vector approaches	<br />2019.04.25	11	Lecture	Learning word embeddings via prediction tasks; skip-grams; word2vec; Assignment 3 discussion	<br />2019.04.30	12	Lecture	Recursive autoencoders (RAEs) and recursive auto-associative memories (RAAM); learning word embeddings by making RAEs predict; AI ethics in China; utilitarian and consequentialist ethics; Asilomar AI principles	<br />2019.05.02	12	Lecture	Context-free grammars (CFGs); generative vs parsing models; top-down vs bottom-up parsing; dynamic programming based chart parsing; Cocke-Kasami-Younger (CKY) parsing	<br />2019.05.07	13	Lecture	From CFGs to ITGs (monolingual vs bilingual modeling); how bilingual conditions make grammar induction easier; the mystery of the magic number 4 in semantic frames; simple and full syntax-directed transduction grammars (SDTGs); introductioon to inversion transduction grammars (ITGs); tree vs matrix constituent alignment visualizations	<br />2019.05.08	13	Lecture	ITG characteristics; stochastic ITGs; polynomial-time transduction and learning; resolving the mystery of the magic number 4	<br />2019.05.09	13	Lecture	From RAAM to TRAAM (transduction RAAM); recursive neural network realizations of ITGs; a self-learning rap battle bot	<br /><br />The real content:<br />AI ethics, AI ethics and AI ethics with some small proportion of AI theory.<br />If you want to learn RNN, back propagation, gradient decent or Markov chain etc. Congratulation, please take another AI course, you won&#039;t learn anything from these course other from AI ethics or personal achievement of Dekai. Well done! <br /><br />However, if you want to use professor&#039;s achievement to masturbate. Good! The best course of UST! Please enroll it at once.","Dekai WU. Umm, A good-looking man. Long hair, beard and well-taste dressing. Besides, he is probably the only Chinese who can articulate English accurately. <br /><br />If you want to enjoy his pronunciation, this is the best course of UST.<br /><br />Okay, let&#039;s back to real performance. <br />Please first refer to #Fys2557 <br />COMP4221真係唔屌唔安樂<br />上次屌完上堂啲嘢無謂再講<br />今次一於屌份assignment 3<br />即係咁 你成份嘢分 3 parts<br />由四月尾出做到5月13號交咁係幾合理嘅<br />始終每part都有一個星期工作量咁<br />要用C++打下堆code<br />但係可唔可以做齊啲嘢先一次過release啊<br />咁問題係邊呢? 先由part A講起<br />本來個個都以為係十幾號先交啦<br />點知佢又無啦啦set 個checkpoint要我地係4月就要交part A<br />唔交就直接無嗰一PART嘅分<br />雖然我一早做左無趕Deadline呢樣嘢發生啦<br />但係有其他人可以會拖住先，結果咪要當突然多份assignment咁趕囉<br />跟住就到part C啦<br />個TA 話part C一直都話未做完未set up好啲嘢<br />直到呢個星期一先真係放份zip比我地做<br />雖然離deadling得返5日 咁我當Dekai知做啲嘢同part A,B差唔多<br />勉強都夠時間嘅<br />但係你用黎trian data 個server唔係502就504<br />連極都連唔撚到<br />屌你仲差撚過UBISOFT同EA個薯仔SERVER<br />咁點撚做份assignmrnt啊 連一定要用到嘅工具都炒飛機咁<br />我知你因為咁而extend左個deadline一日<br />但係extend 完後個server都仲係連唔撚到<br />即係咁 手遊斷server都起馬有石賠啊<br />結果份assignment 照舊今日dead但係無論琴日定今日個server都連唔撚到<br />咁extend 黎有撚用咩<br />都係嗰句 見到DEKAI啲COURSE一定掉頭走<br />本人就係柒左嘅例子<br /><br /> and #Fys2260&nbsp;&nbsp;<br />Dekai Wu 真係ON9嗰喎<br />都唔撚明個3211同4221明明寫AI assignment<br />竟然叫人用C++都唔用python呢啲更常用嘅<br />咁都算啦，你個C++要行2017都算啦，g++compiler要用到8.0都算啦<br />但係你仲要係得LINUX機RUN到你個model<br />Eclipse, VS都run唔到，逼你用PuTTY link 學校server或者自己download LINUX 落黎用<br />算啦，咪當學多左囉。<br />不過最ON9嘅都係上堂竟然唔派 lecture notes 但係又唔upload 啲lecture notes同powerpoint 放上網，逼你上堂手抄<br />咁手抄唔係問題，抄唔切咪用相機影落黎先。落堂再抄返落去<br />但係據我所知，佢連lecture material 都唔比TA。連TA都要問我攞返我影低啲相同手抄notes去做preparation。咁TA點先可以教到我地嘢啊?<br />又講下答問題啦。上堂問佢問題，佢會帶你遊花園，然後唔直接答你問題，連學生問題都答唔到，你點教人啊。<br />如果你落堂問佢佢會叫你行埋一邊先，然後仲要好唔禮貌咁用串柒柒嘅語氣黎撚學生，好似覺得你有嘢唔明係你問題咁。<br />都唔撚知佢無老豆點先可以係UST度教到書。<br />我淨係想講句：你唔識教人就返去做你research啦，唔撚好害人啦<br />These two articles are written by me. These two articles has already contains most of my thought about this course. <br /><br />Sorry foreigners. Originally I want to use the machine learning for translation which should be taught in this course to translate those paragraphs. However, as I haven&#039;t learnt anything, this become impossible.&nbsp;&nbsp;:(","Well. I don&#039;t know what should I graded in this section because I don&#039;t know my final score and the score of assignment 3 and assignment 1. What I know is I get a B eventually.<br /><br />For reference:<br />I got full with 5%bonus in assignment 2 and get 80% in midterm exam.<br /><br />There is one thing to remind all of you who want to take this course. Please write the correct name of Dekai, Wu in the midterm and final exam. Otherwise, your paper won&#039;t be graded or mark deduction. <br /><br />Besides, midterm will mainly cover what his said during the lecture instead of lecture slide. You can bring hand written note&nbsp;&nbsp;during exam. So, you should drop note every lectures or steal your friend hand written note directly or force him to help you drop note.<br /><br />Final will mainly cover what he don&#039;t teach during lecture. Believe in your luck. <br />緣分到了，你自然會識做份卷。","The most heaviest workload course in HKUST. Even heavier than all LANG courses or SOSC and HUMA common core. There a three assignments. <br />The first assignment will waste you about 5 days to complete.<br />The second assignment will waste you about a week to complete it.<br />After the deadline of second assignment, the third assignment will release. The workload is three times of the second assignment, which mean you have to use about 3 weeks to complete a single assignment individually. <br />Even worse, there are many system maintenance. Your assignment progress will force to stop during maintenance. Eventually, the time for you to complete the assignment will reduce. <br />Another serious issue is an assignment will divide to three parts. Each part will release each week, which mean you cannot finish the next part before it release. So, you won&#039;t be able to plan finishing all parts during its release. <br />As assignment 3 is released at the last of the semester. you will be very busy.",1,1,1,1,True,True,False,True,False,False,False,False,False,64,67,False,False,5,[]
fbasDJtlMku1nCi3kIAIR0g7YeXsRjp7,2023-24 Spring,"[{'id': 1901, 'name': 'WEI, Victor Junqiu', 'rating': 0}]",False,151044,"May 25, 2024",Victorization: The Process of Achieving Victor(y),"Content is actually an acceptable introduction to the modern field of Natural Language Processing - but the PPTs were not very organized, nor could they effectively explain the intuition behind each concept, which made it rather hard to comprehend. The vast amount of content also made it incredibly hard to revise (or even understand).<br /><br />At any rate, the topics are as follows:<br />Text Processing<br />- Tokenization and the BPE Encoder<br />- Edit Distance and Text Alignment (featuring Dynamic Programming)<br />N-Gram Language Model<br />- Bigrams and Trigrams<br />- Perplexity<br />- Smoothing (Add-1 and Kneser-Ney)<br />Text Classification<br />- Sentiment Analysis (Naive Bayes)<br />- Bag of Words<br />- Precision, Recall, and F1<br />- Significance and Bootstrapping<br />Word Representation Learning<br />- Word Semantic Meanings<br />- Term-Document/Term-Term Matrices (COMP 4321 material)<br />- Similarity Measures (Cosine and Inner product)<br />- Word2Vec Embedding<br />Neural Networks and Neural Language Models<br />- Neural Units<br />- Activation Functions (ReLU, Sigmoid, tanh)<br />- Perceptrons and Multi-layer Perceptrons<br />- Backpropagation and Computational Graphs<br />RNN and Transformer Models<br />- Simple RNN<br />- Special Units: LSTM, GRU<br />- Sequence Learning and Sequence2Sequence<br />- Encoder/Decoder Architecture<br />- Beam Search<br />- Attention (Cross- and Self-Attention)<br />- Transformer Architecture<br />Chatbots and Dialogue Systems<br />- PoS tagging<br />- Historical Perspectives: ELIZA<br />- Frame-Based Dialogue Architecture<br />- Dialogue-State Architecture<br />- Ethical Considerations<br />Syntactic Parsing<br />- Context-Free Grammars (CFGs)<br />- Probabilistic CFGs<br />- Chomsky Normal Form<br />- Dependency Parse Trees and Maximum Spanning Trees<br />Pretrained Language Models (Advanced)<br />- Natural Language Generation<br />- Realization and (De)lexicalization<br />- TransformerXL and XLnet<br />- Prompt Tuning<br /><br />The contents actually overlap slightly with a multitude of other COMP courses - COMP 2211, COMP 4211, COMP 4321 are all at least somewhat relevant if taken in the same semester.<br /><br />Although I have listed a lot of content, I don&#039;t think I have actually learnt much through the course - I understood neural networks from COMP 2211, a bit of RNN/Transformer from the COMP 4211 slides, and the things about information retrieval from COMP 4321.<br /><br />Would recommend 3Blue1Brown&#039;s introductory videos about Transformers/ChatGPT - those are pretty good for illustrating what the abstract Math actually means.","Given that Prof Wei is a new Prof, I can excuse his teaching quality to a certain degree. I also appreciated his prompt upload for the RVC recordings, which is quite rare. However, I must say there is quite a lot of room for improvement, especially regarding his delivery and elaboration.<br /><br />While he may rarely elaborate on the concepts on the slides, he simply read out the Math equations (or the content on the slides) verbatim in a flat tone. Coupled with the 9am Friday lectures, this definitely did not help me understand what is going on.<br /><br />The slides themselves do have a lot of content, but they were unable to deliver much value since most of them are only Math equations without much elaboration. The motivations behind much of the content are skipped, and I have no idea how some of the equations appeared, nor the conceptual understanding behind it.<br /><br />D for at least (probably) being better than Dekai, but the teaching quality could definitely be worked on.","The most disastrous part of the course is definitely the assessment and grading.<br /><br />The grading scheme is as follows:<br />30% Written Assignments (15% each)<br />20% Midterm Exam<br />20% Course Project<br />30% Final Exam<br /><br />Somehow, each and every part of this grading scheme went wrong.<br /><br />The written assignments were the least disastrous parts of the entire assessment scheme, although there were trivial in the sense that much of what is asked of you should really be done by a computer instead of being done by hand. Assignment 1 had you count bigrams and calculating probabilities by hand - extremely tedious and could be done by computers. Assignment 2 was worse - you had to calculate multiple matrix products, which could definitely be done better by a computer. In fact, most of us used Numpy to do assignment 2, which clearly showed that the assignments were of limited utility.<br /><br />The midterm exam was a landmark in the history of &quot;worst midterm exams&quot;. It was a direct copy of Assignment 1 (with a few numerical tweaks), with the relatively more difficult question completely deleted. The midterm was scheduled for an hour - most people walked out after half an hour. The low difficulty ended up creating one of the most impressive box plots I&#039;ve seen - the median for the midterm was 100. <br /><br />Let me repeat: The midterm exam of a 4000-level COMP course has a median of 100. That is perhaps one of the most impressive things in my 3 years of study here. I&#039;ve attached the box plot for your reference (I have set the what-if score to 0).<br /><br />The course project is another example of poor assessment design. 20 marks were awarded for simply running the given code. Another 50 to 60 marks are for modifying 1-2 lines of code. Although the project did give us some experience with NLP in Python, what we learnt was effectively absolutely nothing - given that the code was given, and none of the libraries used were ever explained in any depth whatsoever.<br /><br />All of the above (constituting 70% of the course marks) had a median of 100. This means that 50% of all students (roughly) had full marks before the final. This makes it impossible to distribute grades. So what does Prof Wei do?<br /><br />He sets the most insane final exam that I have had the misfortune of sitting through. At least for COMP 3021 (Prof Shen version), the questions were hard but definitely conceptually interesting. The paper was fair as it at least examined how clear your concepts are. Prof Wei&#039;s paper occupied the other end of the difficulty spectrum, falling squarely into the field of brutally and unnecessarily hard due to sheer tedium. The final featured 8 questions, and was ~40 pages long since the paper was double-side printed. The questions were designed to be tedious and impossible to complete in the allotted period of time. One of the questions asked us to dry run the BPE algorithm 8 times. Another asked us to multiply 4x4 matrices together, manually apply softmax to it, and multiply it with another matrix again. Repeat these steps 3-4 times with minor modifications, and you will have gained a total of 15 marks out of 100, despite the number of numerical calculations required. Another 15 mark question required you to write down the pseudocode for Naive Bayes twice with minor modifications, and dry run it on 5 sentences. The level of number crunching required in the exam was extraordinary, and completely irrelevant to the course aims. Some of the questions also required you to recite some useless definitions (I don&#039;t think anyone needs to know the definition of a language model, nor do they need to recite the psuedocode of the Naive Bayes classifier). The exam felt like a useless trivia memorization test and a human calculation test stapled together in 20 sheets of paper - an extremely poor reflection of our ability.<br /><br />Needless to say, I am deeply disappointed by the course grading scheme.<br /><br />&quot;Fun&quot; notes:<br />I heard at least half the hall swear at the exam paper during the final (that includes me). Someone shouted &quot;Professor, do you hate us?&quot; at the end of the paper. It was one of the loudest exams I&#039;ve sat through - mainly because everyone is swearing to some degree.<br /><br />I have attached the estimated LQs and UQs, as well as the official mean and SD.<br /><br />Update post-solution release: I am literally speechless.<br />- Doing 3 4x4 matrix multiplications: 1/100; <br />- A 4-page solution: 3/100;<br />- Making a 27x27 table with different probabilities: 2/100.<br />Well done!<br /><br />I am incensed by the released solution: Prof Wei didn&#039;t even bother typing out any of the definition questions. For the 4x4 matrices he used Numpy (when we could not). This made me question whether he actually did his paper after setting it. Well done!!","The workload for this course is (mercifully) light, but given the disastrous state of the grading scheme, this really doesn&#039;t help at all.<br /><br />The assignments and the course project only took 1-2 days to complete, and the midterm... was not meaningful to revise for.<br /><br />The final took me 2-3 days to fully catch up with the content. Even then, most of my revised materials are useless since the exam was about being a human calculator.",3,2,1,4,True,True,False,True,False,True,False,False,False,39,40,False,False,4,"[{'key': 'vpe2kCyQCxQPOg8XId3X9v8SHmVh94O0', 'name': '4221-midterm', 'format': 'png'}, {'key': 'OrIwZhxiiMkZ9Fqu35S6N2lXjYZrPqJU', 'name': '4221-dist', 'format': 'png'}]"
rpfBctKOAwgkkZi1AtdHytzJexpizfza,2023-24 Spring,"[{'id': 1901, 'name': 'WEI, Victor Junqiu', 'rating': 1}]",False,m****6,"May 26, 2024",Take this course if you&#039;re a human computer,"The slides are nothing but a pot of mess. Just random words and equations scattered everywhere.<br /><br />Topics are fine, but the content are not coherent or organised in any sense. The following topics are not listed in the teaching order:<br />- Text Processing (Words and Corpora, Tokenization, Alignments, Edit Distance)<br />- N-Gram Language Model<br />- Text Classification<br />- Word Representation Learning<br />- Sequence Labelling for Parts of Speech and Named Entities<br />- Neural Networks and Neural Language Models<br />- RNN and Transformer Models<br />- Pretrained Language Models (Basic)<br />- Sequence-to-Sequence Models and Machine Translation<br />- Question Answering and Information Retrieval<br />- Chatbots and Dialogue Systems<br />- Constituency Parsing<br />- Dependency Parsing<br />- Pretrained Language Models (Advanced)<br />- Prompting and Instruct Tuning","Like 9 out of 10 other UST professor, he just speaks in the usual monotonic voice to simply read out the slides during lectures.<br /><br />The reason I didn&#039;t gave him a E is because he always releases the lecture recording on Canvas.<br /><br />Always makes mistakes in assignment and exam questions -_-<br />At least interrupted us three times in the final exam for various clarification / fixing the questions.","Well what can I say for this? See the earlier post if you want to know the full story. Long story short, the entire grading policy simply could not differentiate students by their understanding on the course material.<br /><br />Grading scheme: (Mean/LQ/Median/UQ)<br />15% Assignment 1 (90.8/97/98/100)<br />15% Assignment 2 (88.11/85/100/100)<br />20% Project (83.21/90/90/100)<br />20% Midterm (97.74/96.75/100/100)<br />30% Final (42.17/37/42.5/51)<br /><br />As you can see, this is a sh*tty distribution. Everyone just get 100 in every single part of the course except in the final exam where the prof decides to screw us all over. Made a careless mistake in your assignment? Say goodbye to your A/B range.<br /><br />The &quot;project&quot; is simply running a given python script and write several lines of code yourself, definitely not the PA kind of work.<br /><br />The final exam is so legendary that I will never forget. The moment I went into the exam venue and sit down at the chair, I was surprised by the sheer thickness of the exam paper which is supposed for a 3-hour examination. Turns out it was double-sided and ends up with like 40 pages in total, which already seem quite dramatic for a 3-hour exam.<br /><br />The content of the exam is purely evil and designed to screw us over. Have you tried doing a matrix multiplication? Then you know how annoying it is to do that for higher dimension matrix such as 4x4. Guess what? You need to do it multiple times just for a single sub-question for 5 marks in the scaled dot-product attention part. Basically you need to do a 4x4 x 4x4, then apply softmax, and do a 4x4 x 4x4 again! At this point, you have done (7+4+7)*16 = 288 add/multiply and applied the exponential functions for 20 times! Congrats, you earned yourself 3 marks now! Now, do it for a few more times for the other sub-questions ^_^<br /><br />You think that is it? Try BPE for ~15-20 characters and 5 lines of text and run it for 8 iterations and that would grant you another 3 points ^_^<br /><br />Did you recite the pseudo-code for multiple algorithms such as graph-based dependency parsing and apply it to 15 nodes interconnecting with 4-5 arrows with one another that you can barely see which arrow is which one? Or did you recite that Naive Bayes classifier algorithm in pseudo-code? No? Too bad, 30 marks gone.<br /><br />Don&#039;t want to handle codes? No problem, let&#039;s circle back to math, just draw a SIMPLE computational graph for a 2-2-1 MLP structure with a maximum of two items for each inter-step (e.g. v1 = w1x1 + w2x2 + b1 would need to split into 4 nodes: a=w1x1, b=w2x2, c=a+b, d=c+b1, imagine how many nodes you would generate for the entire MLP structure with just a simple 2-2-1, just imagine you are a CPU running assembly code), and write the respective partial differentiation for like 30 nodes. For this you would get 2 points!<br /><br />The entire lecture theater is just filled with gasps, sighs and non-stop cursing. To be honest I have no idea what the final grading will be like, or what will happen next. At this point I don&#039;t think there&#039;s anything they can do to justify what they did to us in the final exam.","Light workload and you learn nothing from them.<br />Only 2 assignment and a project which constitutes 35% of your final grade which everyone gets a full mark from. Absolutely no pressure ^_^<br />1 midterm and 1 final, just regular stuff ^_^",3,2,1,3,True,True,False,True,False,True,False,False,False,22,22,False,False,0,[]
